{
  "part1": {
    "ref_no": "INC-20260223-155715",
    "reported_by": "",
    "date_time": "23.02.26 03:57PM",
    "incident_type": "Serious injury",
    "brief_details": {
      "what": "200 litrelik %35 konsantrasyonlu sÃ¼lfÃ¼rik asit konteyneri forklift Ã§arpmasÄ± sonucu 1.2 metre yÃ¼kseklikten dÃ¼ÅŸerek kÄ±rÄ±ldÄ±, 180 litre asit 15 mÂ² alana yayÄ±ldÄ±. 2 kiÅŸi yaralandÄ± (1. derece kimyasal yanÄ±k ve buhar solunumu).",
      "where": "Ä°ngiltere, Londra - Kimyasal Ã¼retim fabrikasÄ±, kimyasal depo alanÄ±",
      "when": "15 Ocak 2026, Saat 14:30",
      "who": "Forklift operatÃ¶rÃ¼ (kazaya neden olan), Depo GÃ¶revlisi 42 yaÅŸ (sol ayak 1. derece kimyasal yanÄ±k, 3 gÃ¼n iÅŸ gÃ¶remez), Temizlik Personeli 29 yaÅŸ (solunum yolu tahriÅŸi, aynÄ± gÃ¼n taburcu), Acil mÃ¼dahale ekibi, Ã–zel eÄŸitimli temizlik personeli",
      "emergency_measures": "14:33 - Kimyasal alarm butonu ile acil durum ekibine haber verildi. 14:40 - Acil mÃ¼dahale ekibi geldi, alan tahliye edildi, 2 yaralÄ± saÄŸlÄ±k birimine sevk edildi. 15:20 - Ã–zel eÄŸitimli personel tarafÄ±ndan nÃ¶tralizasyon ve temizlik iÅŸlemleri baÅŸlatÄ±ldÄ±. 17:00 - Alan temizlendi, havalandÄ±rma ve gÃ¼venlik kontrolleri tamamlandÄ±. Asit drenaj kanalÄ±na ulaÅŸmadan nÃ¶tralize edildi. Ã‡evre AjansÄ±'na bildirim yapÄ±ldÄ±."
    },
    "forwarded_to": "",
    "forwarded_date_time": ""
  },
  "part2": {
    "type_of_event": "Accident",
    "actual_potential_harm": "**Severity Level: 2 - Serious**",
    "riddor_reportable": "N",
    "riddor_date_reported": "",
    "accident_book_entry": "Y",
    "accident_book_date": "23.02.26",
    "accident_book_ref": "054/26",
    "investigation_level": "Medium level",
    "initial_assessment_by": "H&S Officer",
    "assessment_date": "23.02.26",
    "further_investigation_required": "Y",
    "priority": "High",
    "investigation_team": [
      "H&S Officer",
      "Chemical Safety Specialist",
      "Operations Manager",
      "Warehouse Supervisor",
      "Forklift Operations Supervisor",
      "Occupational Health Specialist",
      "Environmental Compliance Officer"
    ]
  },
  "part3_rca": {
    "incident_summary": "200 litrelik %35 konsantrasyonlu sÃ¼lfÃ¼rik asit konteyneri forklift Ã§arpmasÄ± sonucu 1.2 metre yÃ¼kseklikten dÃ¼ÅŸerek kÄ±rÄ±ldÄ±, 180 litre asit 15 mÂ² alana yayÄ±ldÄ±. 2 kiÅŸi yaralandÄ± (1. derece kimyasal yanÄ±k ve buhar solunumu).. Konum: Ä°ngiltere, Londra - Kimyasal Ã¼retim fabrikasÄ±, kimyasal depo alanÄ±. Olay Tipi: Accident",
    "analysis_branches": [
      {
        "branch_number": 1,
        "immediate_cause": {
          "code": "B3.4",
          "standard_title_tr": "Tehlikeli kimyasallar veya toksik maddeler",
          "category_type": "KOÅULSAL",
          "cause_tr": "200 litrelik %35 konsantrasyonlu sÃ¼lfÃ¼rik asit konteyneri kÄ±rÄ±larak 180 litre asidin 15 mÂ² alana yayÄ±lmasÄ± sonucu kimyasal maruziyete neden oldu",
          "evidence_tr": "Raporda '200 litrelik %35 konsantrasyonlu sÃ¼lfÃ¼rik asit konteyneri forklift Ã§arpmasÄ± sonucu 1.2 metre yÃ¼kseklikten dÃ¼ÅŸerek kÄ±rÄ±ldÄ±, 180 litre asit 15 mÂ² alana yayÄ±ldÄ±. 2 kiÅŸi yaralandÄ± (1. derece kimyasal yanÄ±k ve buhar solunumu)' ifadesi yer almaktadÄ±r."
        },
        "why_chain": [
          {
            "level": 1,
            "question_tr": "Neden forklift sÃ¼lfÃ¼rik asit konteynerine Ã§arptÄ±?",
            "answer_tr": "Kimyasal depo alanÄ±nda forklift operatÃ¶rÃ¼ manevra yaparken konteynerin bulunduÄŸu bÃ¶lgeye Ã§arptÄ± ve konteyneri 1.2 metre yÃ¼kseklikten dÃ¼ÅŸÃ¼rdÃ¼"
          },
          {
            "level": 2,
            "question_tr": "Neden kimyasal depo alanÄ±nda forklift trafiÄŸi ile kimyasal konteynerler aynÄ± bÃ¶lgede bulunuyordu?",
            "answer_tr": "Depo alanÄ± tasarÄ±mÄ±nda forklift trafik yollarÄ± ile kimyasal depolama alanlarÄ± fiziksel olarak ayrÄ±lmamÄ±ÅŸtÄ±, bariyerler veya koruyucu yapÄ±lar yoktu"
          },
          {
            "level": 3,
            "question_tr": "Neden depo alanÄ± tasarÄ±mÄ±nda trafik yollarÄ± ile kimyasal depolama alanlarÄ± ayrÄ±lmamÄ±ÅŸtÄ±?",
            "answer_tr": "Tesis tasarÄ±mÄ± sÄ±rasÄ±nda forklift Ã§arpma riski ve kimyasal konteynerlerin korunmasÄ± iÃ§in yeterli risk deÄŸerlendirmesi yapÄ±lmamÄ±ÅŸtÄ±"
          },
          {
            "level": 4,
            "question_tr": "Neden tesis tasarÄ±mÄ±nda forklift Ã§arpma riski iÃ§in yeterli risk deÄŸerlendirmesi yapÄ±lmamÄ±ÅŸtÄ±?",
            "answer_tr": "TasarÄ±m aÅŸamasÄ±nda kimyasal depolama alanlarÄ±na yÃ¶nelik tehlike tanÄ±mlama ve risk analizi (HAZOP/HAZID) sÃ¼reÃ§leri eksik uygulanmÄ±ÅŸ veya forklift trafiÄŸi senaryolarÄ± deÄŸerlendirilmemiÅŸti"
          },
          {
            "level": 5,
            "question_tr": "Neden tasarÄ±m aÅŸamasÄ±nda risk analizi eksik uygulandÄ±?",
            "answer_tr": "TasarÄ±m gÃ¶zden geÃ§irme sÃ¼reÃ§leri yetersizdi ve operasyonel tehlikelerin (forklift trafiÄŸi, Ã§arpma senaryolarÄ±) tasarÄ±ma entegrasyonu iÃ§in sistematik bir yaklaÅŸÄ±m yoktu"
          }
        ],
        "root_cause": {
          "code": "D5.2",
          "standard_title_tr": "Yetersiz tasarÄ±m gÃ¶zden geÃ§irme",
          "category_type": "ORGANÄ°ZASYONEL",
          "cause_tr": "Kimyasal depo alanÄ± tasarÄ±mÄ±nda forklift Ã§arpma risklerinin deÄŸerlendirilmemesi ve koruyucu tasarÄ±m Ã¶nlemlerinin alÄ±nmamasÄ±",
          "explanation_tr": "Tesis tasarÄ±m aÅŸamasÄ±nda kimyasal depolama alanlarÄ±na yÃ¶nelik risk Ã§alÄ±ÅŸmalarÄ± (HAZOP/HAZID) eksik uygulanmÄ±ÅŸ, forklift trafiÄŸi ile kimyasal konteynerlerin etkileÅŸim senaryolarÄ± deÄŸerlendirilmemiÅŸ ve fiziksel ayÄ±rma/koruma gereksinimleri tasarÄ±ma entegre edilmemiÅŸtir"
        }
      },
      {
        "branch_number": 2,
        "immediate_cause": {
          "code": "B4.5",
          "standard_title_tr": "EkipmanÄ±n uygunsuz konuma yerleÅŸtirilmesi",
          "category_type": "KOÅULSAL",
          "cause_tr": "SÃ¼lfÃ¼rik asit konteyneri forklift trafiÄŸine maruz kalacak ÅŸekilde uygunsuz konumda yerleÅŸtirilmiÅŸ ve 1.2 metre yÃ¼kseklikte bulunuyordu",
          "evidence_tr": "Raporda 'forklift Ã§arpmasÄ± sonucu 1.2 metre yÃ¼kseklikten dÃ¼ÅŸerek kÄ±rÄ±ldÄ±' ifadesi konteyner yerleÅŸiminin forklift Ã§arpma riskine aÃ§Ä±k olduÄŸunu gÃ¶stermektedir."
        },
        "why_chain": [
          {
            "level": 1,
            "question_tr": "Neden sÃ¼lfÃ¼rik asit konteyneri forklift trafiÄŸine maruz kalacak ÅŸekilde uygunsuz konumda yerleÅŸtirilmiÅŸti?",
            "answer_tr": "Kimyasal depo alanÄ±nda tehlikeli maddelerin yerleÅŸimi iÃ§in belirlenmiÅŸ gÃ¼venli bÃ¶lgeler ve trafik yollarÄ± tanÄ±mlanmamÄ±ÅŸtÄ±"
          },
          {
            "level": 2,
            "question_tr": "Neden kimyasal depo alanÄ±nda gÃ¼venli bÃ¶lgeler ve trafik yollarÄ± tanÄ±mlanmamÄ±ÅŸtÄ±?",
            "answer_tr": "Depo alanÄ± dÃ¼zenlemesi yapÄ±lÄ±rken tehlikeli madde depolama risk deÄŸerlendirmesi yapÄ±lmamÄ±ÅŸ, sadece kapasite ve eriÅŸim kolaylÄ±ÄŸÄ± dikkate alÄ±nmÄ±ÅŸtÄ±"
          },
          {
            "level": 3,
            "question_tr": "Neden depo dÃ¼zenlemesinde risk deÄŸerlendirmesi yapÄ±lmamÄ±ÅŸtÄ±?",
            "answer_tr": "Kimyasal depolama alanlarÄ±nÄ±n tasarÄ±mÄ± ve dÃ¼zenlenmesi iÃ§in standart bir risk analizi prosedÃ¼rÃ¼ mevcut deÄŸildi"
          },
          {
            "level": 4,
            "question_tr": "Neden kimyasal depolama iÃ§in standart risk analizi prosedÃ¼rÃ¼ yoktu?",
            "answer_tr": "Depo alanÄ± dÃ¼zenlemeleri ve yerleÅŸim planlarÄ± iÃ§in sistematik risk deÄŸerlendirme sÃ¼reci kurulmamÄ±ÅŸ, kontroller belirlenmemiÅŸ ve takip edilmemiÅŸti"
          }
        ],
        "root_cause": {
          "code": "D4.1",
          "standard_title_tr": "Risk analizinin yapÄ±lmamasÄ± veya yetersiz olmasÄ±",
          "category_type": "ORGANÄ°ZASYONEL",
          "cause_tr": "Kimyasal depolama alanÄ± dÃ¼zenlemesi iÃ§in sistematik risk deÄŸerlendirmesi yapÄ±lmamasÄ±",
          "explanation_tr": "Tehlikeli madde depolama alanlarÄ±nÄ±n yerleÅŸim planlamasÄ± yapÄ±lÄ±rken forklift trafiÄŸi, dÃ¼ÅŸme riski ve kimyasal maruziyeti gibi tehlikelerin deÄŸerlendirildiÄŸi bir risk analizi sÃ¼reci mevcut deÄŸildi. Depo dÃ¼zenlemesi sadece operasyonel verimlilik odaklÄ± yapÄ±lmÄ±ÅŸ, gÃ¼venlik riskleri sistematik olarak analiz edilmemiÅŸ ve kontrol Ã¶nlemleri belirlenmemiÅŸti."
        }
      },
      {
        "branch_number": 3,
        "immediate_cause": {
          "code": "A2.1",
          "standard_title_tr": "Ekipman/tesis/aracÄ±n yanlÄ±ÅŸ veya uygunsuz kullanÄ±mÄ±",
          "category_type": "DAVRANIÅSAL",
          "cause_tr": "Forklift operatÃ¶rÃ¼ kimyasal depo alanÄ±nda tehlikeli madde konteynerleri yakÄ±nÄ±nda uygunsuz manevra yaparak konteyner Ã§arpmasÄ±na neden oldu",
          "evidence_tr": "Raporda 'forklift Ã§arpmasÄ± sonucu' ifadesi forklift kullanÄ±mÄ±nÄ±n kimyasal depo alanÄ±nda uygun ÅŸekilde gerÃ§ekleÅŸtirilmediÄŸini gÃ¶stermektedir."
        },
        "why_chain": [
          {
            "level": 1,
            "question_tr": "Neden forklift operatÃ¶rÃ¼ kimyasal depo alanÄ±nda uygunsuz manevra yaptÄ±?",
            "answer_tr": "OperatÃ¶r dar alanda geri manevra yaparken kimyasal konteynerlere olan mesafeyi yanlÄ±ÅŸ hesapladÄ± ve Ã§arpma meydana geldi"
          },
          {
            "level": 2,
            "question_tr": "Neden operatÃ¶r mesafeyi yanlÄ±ÅŸ hesapladÄ± ve Ã§arpma riskini Ã¶ngÃ¶remedi?",
            "answer_tr": "Kimyasal depo alanÄ±nda forklift operasyonlarÄ± iÃ§in Ã¶zel eÄŸitim almamÄ±ÅŸtÄ±, tehlikeli madde konteynerleri yakÄ±nÄ±nda Ã§alÄ±ÅŸma prosedÃ¼rlerini bilmiyordu"
          },
          {
            "level": 3,
            "question_tr": "Neden operatÃ¶r kimyasal depo alanÄ±nda Ã§alÄ±ÅŸmak iÃ§in gerekli Ã¶zel eÄŸitimi almamÄ±ÅŸtÄ±?",
            "answer_tr": "Kimyasal depo alanÄ±nda Ã§alÄ±ÅŸacak forklift operatÃ¶rleri iÃ§in Ã¶zel eÄŸitim programÄ± tanÄ±mlanmamÄ±ÅŸtÄ±, sadece genel forklift eÄŸitimi verilmiÅŸti"
          },
          {
            "level": 4,
            "question_tr": "Neden tehlikeli madde depolama alanlarÄ± iÃ§in Ã¶zel forklift operasyon eÄŸitimi tanÄ±mlanmamÄ±ÅŸtÄ±?",
            "answer_tr": "FarklÄ± Ã§alÄ±ÅŸma alanlarÄ±nÄ±n (kimyasal depo, genel depo vb.) gerektirdiÄŸi Ã¶zel yetkinlikler belirlenmemiÅŸti, eÄŸitim ihtiyaÃ§ analizi yapÄ±lmamÄ±ÅŸtÄ±"
          },
          {
            "level": 5,
            "question_tr": "Neden eÄŸitim ihtiyaÃ§ analizi yapÄ±lmamÄ±ÅŸ ve yetkinlik gereksinimleri belirlenmemiÅŸti?",
            "answer_tr": "Organizasyonda gÃ¶rev bazlÄ± eÄŸitim ihtiyaÃ§larÄ±nÄ± belirleme sistemi yoktu, risk seviyesine gÃ¶re yetkinlik matrisi oluÅŸturulmamÄ±ÅŸtÄ±"
          }
        ],
        "root_cause": {
          "code": "D3.2",
          "standard_title_tr": "EÄŸitim ihtiyaÃ§larÄ±nÄ±n belirlenmemesi",
          "category_type": "ORGANÄ°ZASYONEL",
          "cause_tr": "Kimyasal depo alanÄ±nda forklift operasyonu iÃ§in Ã¶zel eÄŸitim ihtiyaÃ§larÄ±nÄ±n sistematik olarak belirlenmemesi",
          "explanation_tr": "Tehlikeli madde depolama alanlarÄ±nda Ã§alÄ±ÅŸacak forklift operatÃ¶rleri iÃ§in risk bazlÄ± eÄŸitim ihtiyaÃ§ analizi yapÄ±lmamÄ±ÅŸ, gÃ¶rev-yetkinlik matrisi oluÅŸturulmamÄ±ÅŸ ve Ã¶zel eÄŸitim gereksinimleri tanÄ±mlanmamÄ±ÅŸtÄ±r"
        }
      }
    ],
    "final_root_causes": [
      {
        "code": "D5.2",
        "standard_title_tr": "Yetersiz tasarÄ±m gÃ¶zden geÃ§irme",
        "category_type": "ORGANÄ°ZASYONEL",
        "cause_tr": "Kimyasal depo alanÄ± tasarÄ±mÄ±nda forklift Ã§arpma risklerinin deÄŸerlendirilmemesi ve koruyucu tasarÄ±m Ã¶nlemlerinin alÄ±nmamasÄ±",
        "explanation_tr": "Tesis tasarÄ±m aÅŸamasÄ±nda kimyasal depolama alanlarÄ±na yÃ¶nelik risk Ã§alÄ±ÅŸmalarÄ± (HAZOP/HAZID) eksik uygulanmÄ±ÅŸ, forklift trafiÄŸi ile kimyasal konteynerlerin etkileÅŸim senaryolarÄ± deÄŸerlendirilmemiÅŸ ve fiziksel ayÄ±rma/koruma gereksinimleri tasarÄ±ma entegre edilmemiÅŸtir"
      },
      {
        "code": "D4.1",
        "standard_title_tr": "Risk analizinin yapÄ±lmamasÄ± veya yetersiz olmasÄ±",
        "category_type": "ORGANÄ°ZASYONEL",
        "cause_tr": "Kimyasal depolama alanÄ± dÃ¼zenlemesi iÃ§in sistematik risk deÄŸerlendirmesi yapÄ±lmamasÄ±",
        "explanation_tr": "Tehlikeli madde depolama alanlarÄ±nÄ±n yerleÅŸim planlamasÄ± yapÄ±lÄ±rken forklift trafiÄŸi, dÃ¼ÅŸme riski ve kimyasal maruziyeti gibi tehlikelerin deÄŸerlendirildiÄŸi bir risk analizi sÃ¼reci mevcut deÄŸildi. Depo dÃ¼zenlemesi sadece operasyonel verimlilik odaklÄ± yapÄ±lmÄ±ÅŸ, gÃ¼venlik riskleri sistematik olarak analiz edilmemiÅŸ ve kontrol Ã¶nlemleri belirlenmemiÅŸti."
      },
      {
        "code": "D3.2",
        "standard_title_tr": "EÄŸitim ihtiyaÃ§larÄ±nÄ±n belirlenmemesi",
        "category_type": "ORGANÄ°ZASYONEL",
        "cause_tr": "Kimyasal depo alanÄ±nda forklift operasyonu iÃ§in Ã¶zel eÄŸitim ihtiyaÃ§larÄ±nÄ±n sistematik olarak belirlenmemesi",
        "explanation_tr": "Tehlikeli madde depolama alanlarÄ±nda Ã§alÄ±ÅŸacak forklift operatÃ¶rleri iÃ§in risk bazlÄ± eÄŸitim ihtiyaÃ§ analizi yapÄ±lmamÄ±ÅŸ, gÃ¶rev-yetkinlik matrisi oluÅŸturulmamÄ±ÅŸ ve Ã¶zel eÄŸitim gereksinimleri tanÄ±mlanmamÄ±ÅŸtÄ±r"
      }
    ],
    "analysis_method": "HSG245 Hierarchical 5-Why (A/B â†’ C/D)",
    "final_report_tr": "================================================================================\nKÃ–K NEDEN ANALÄ°ZÄ° RAPORU (HSG245 - 5 Why Metodolojisi)\n================================================================================\n\nOLAY: 200 litrelik %35 konsantrasyonlu sÃ¼lfÃ¼rik asit konteyneri forklift Ã§arpmasÄ± sonucu 1.2 metre yÃ¼kseklikten dÃ¼ÅŸerek kÄ±rÄ±ldÄ±, 180 litre asit 15 mÂ² alana yayÄ±ldÄ±. 2 kiÅŸi yaralandÄ± (1. derece kimyasal yanÄ±k ve buhar solunumu).. Konum: Ä°ngiltere, Londra - Kimyasal Ã¼retim fabrikasÄ±, kimyasal depo alanÄ±. Olay Tipi: Accident\n\n--------------------------------------------------------------------------------\n\nâš¡ DAL 1: KOÅULSAL\n\nğŸ“Œ DoÄŸrudan Neden [B3.4] Tehlikeli kimyasallar veya toksik maddeler:\n   200 litrelik %35 konsantrasyonlu sÃ¼lfÃ¼rik asit konteyneri kÄ±rÄ±larak 180 litre asidin 15 mÂ² alana yayÄ±lmasÄ± sonucu kimyasal maruziyete neden oldu\n   KanÄ±t: Raporda '200 litrelik %35 konsantrasyonlu sÃ¼lfÃ¼rik asit konteyneri forklift Ã§arpmasÄ± sonucu 1.2 metre yÃ¼kseklikten dÃ¼ÅŸerek kÄ±rÄ±ldÄ±, 180 litre asit 15 mÂ² alana yayÄ±ldÄ±. 2 kiÅŸi yaralandÄ± (1. derece kimyasal yanÄ±k ve buhar solunumu)' ifadesi yer almaktadÄ±r.\n\nâ“ Neden 1? Neden forklift sÃ¼lfÃ¼rik asit konteynerine Ã§arptÄ±?\n   â†’ Kimyasal depo alanÄ±nda forklift operatÃ¶rÃ¼ manevra yaparken konteynerin bulunduÄŸu bÃ¶lgeye Ã§arptÄ± ve konteyneri 1.2 metre yÃ¼kseklikten dÃ¼ÅŸÃ¼rdÃ¼\nâ“ Neden 2? Neden kimyasal depo alanÄ±nda forklift trafiÄŸi ile kimyasal konteynerler aynÄ± bÃ¶lgede bulunuyordu?\n   â†’ Depo alanÄ± tasarÄ±mÄ±nda forklift trafik yollarÄ± ile kimyasal depolama alanlarÄ± fiziksel olarak ayrÄ±lmamÄ±ÅŸtÄ±, bariyerler veya koruyucu yapÄ±lar yoktu\nâ“ Neden 3? Neden depo alanÄ± tasarÄ±mÄ±nda trafik yollarÄ± ile kimyasal depolama alanlarÄ± ayrÄ±lmamÄ±ÅŸtÄ±?\n   â†’ Tesis tasarÄ±mÄ± sÄ±rasÄ±nda forklift Ã§arpma riski ve kimyasal konteynerlerin korunmasÄ± iÃ§in yeterli risk deÄŸerlendirmesi yapÄ±lmamÄ±ÅŸtÄ±\nâ“ Neden 4? Neden tesis tasarÄ±mÄ±nda forklift Ã§arpma riski iÃ§in yeterli risk deÄŸerlendirmesi yapÄ±lmamÄ±ÅŸtÄ±?\n   â†’ TasarÄ±m aÅŸamasÄ±nda kimyasal depolama alanlarÄ±na yÃ¶nelik tehlike tanÄ±mlama ve risk analizi (HAZOP/HAZID) sÃ¼reÃ§leri eksik uygulanmÄ±ÅŸ veya forklift trafiÄŸi senaryolarÄ± deÄŸerlendirilmemiÅŸti\nâ“ Neden 5? Neden tasarÄ±m aÅŸamasÄ±nda risk analizi eksik uygulandÄ±?\n   â†’ TasarÄ±m gÃ¶zden geÃ§irme sÃ¼reÃ§leri yetersizdi ve operasyonel tehlikelerin (forklift trafiÄŸi, Ã§arpma senaryolarÄ±) tasarÄ±ma entegrasyonu iÃ§in sistematik bir yaklaÅŸÄ±m yoktu\n\nğŸ¯ KÃ–K NEDEN [D5.2] Yetersiz tasarÄ±m gÃ¶zden geÃ§irme - ORGANÄ°ZASYONEL:\n   Kimyasal depo alanÄ± tasarÄ±mÄ±nda forklift Ã§arpma risklerinin deÄŸerlendirilmemesi ve koruyucu tasarÄ±m Ã¶nlemlerinin alÄ±nmamasÄ±\n   Tesis tasarÄ±m aÅŸamasÄ±nda kimyasal depolama alanlarÄ±na yÃ¶nelik risk Ã§alÄ±ÅŸmalarÄ± (HAZOP/HAZID) eksik uygulanmÄ±ÅŸ, forklift trafiÄŸi ile kimyasal konteynerlerin etkileÅŸim senaryolarÄ± deÄŸerlendirilmemiÅŸ ve fiziksel ayÄ±rma/koruma gereksinimleri tasarÄ±ma entegre edilmemiÅŸtir\n\n--------------------------------------------------------------------------------\n\nâš¡ DAL 2: KOÅULSAL\n\nğŸ“Œ DoÄŸrudan Neden [B4.5] EkipmanÄ±n uygunsuz konuma yerleÅŸtirilmesi:\n   SÃ¼lfÃ¼rik asit konteyneri forklift trafiÄŸine maruz kalacak ÅŸekilde uygunsuz konumda yerleÅŸtirilmiÅŸ ve 1.2 metre yÃ¼kseklikte bulunuyordu\n   KanÄ±t: Raporda 'forklift Ã§arpmasÄ± sonucu 1.2 metre yÃ¼kseklikten dÃ¼ÅŸerek kÄ±rÄ±ldÄ±' ifadesi konteyner yerleÅŸiminin forklift Ã§arpma riskine aÃ§Ä±k olduÄŸunu gÃ¶stermektedir.\n\nâ“ Neden 1? Neden sÃ¼lfÃ¼rik asit konteyneri forklift trafiÄŸine maruz kalacak ÅŸekilde uygunsuz konumda yerleÅŸtirilmiÅŸti?\n   â†’ Kimyasal depo alanÄ±nda tehlikeli maddelerin yerleÅŸimi iÃ§in belirlenmiÅŸ gÃ¼venli bÃ¶lgeler ve trafik yollarÄ± tanÄ±mlanmamÄ±ÅŸtÄ±\nâ“ Neden 2? Neden kimyasal depo alanÄ±nda gÃ¼venli bÃ¶lgeler ve trafik yollarÄ± tanÄ±mlanmamÄ±ÅŸtÄ±?\n   â†’ Depo alanÄ± dÃ¼zenlemesi yapÄ±lÄ±rken tehlikeli madde depolama risk deÄŸerlendirmesi yapÄ±lmamÄ±ÅŸ, sadece kapasite ve eriÅŸim kolaylÄ±ÄŸÄ± dikkate alÄ±nmÄ±ÅŸtÄ±\nâ“ Neden 3? Neden depo dÃ¼zenlemesinde risk deÄŸerlendirmesi yapÄ±lmamÄ±ÅŸtÄ±?\n   â†’ Kimyasal depolama alanlarÄ±nÄ±n tasarÄ±mÄ± ve dÃ¼zenlenmesi iÃ§in standart bir risk analizi prosedÃ¼rÃ¼ mevcut deÄŸildi\nâ“ Neden 4? Neden kimyasal depolama iÃ§in standart risk analizi prosedÃ¼rÃ¼ yoktu?\n   â†’ Depo alanÄ± dÃ¼zenlemeleri ve yerleÅŸim planlarÄ± iÃ§in sistematik risk deÄŸerlendirme sÃ¼reci kurulmamÄ±ÅŸ, kontroller belirlenmemiÅŸ ve takip edilmemiÅŸti\n\nğŸ¯ KÃ–K NEDEN [D4.1] Risk analizinin yapÄ±lmamasÄ± veya yetersiz olmasÄ± - ORGANÄ°ZASYONEL:\n   Kimyasal depolama alanÄ± dÃ¼zenlemesi iÃ§in sistematik risk deÄŸerlendirmesi yapÄ±lmamasÄ±\n   Tehlikeli madde depolama alanlarÄ±nÄ±n yerleÅŸim planlamasÄ± yapÄ±lÄ±rken forklift trafiÄŸi, dÃ¼ÅŸme riski ve kimyasal maruziyeti gibi tehlikelerin deÄŸerlendirildiÄŸi bir risk analizi sÃ¼reci mevcut deÄŸildi. Depo dÃ¼zenlemesi sadece operasyonel verimlilik odaklÄ± yapÄ±lmÄ±ÅŸ, gÃ¼venlik riskleri sistematik olarak analiz edilmemiÅŸ ve kontrol Ã¶nlemleri belirlenmemiÅŸti.\n\n--------------------------------------------------------------------------------\n\nâš¡ DAL 3: DAVRANIÅSAL\n\nğŸ“Œ DoÄŸrudan Neden [A2.1] Ekipman/tesis/aracÄ±n yanlÄ±ÅŸ veya uygunsuz kullanÄ±mÄ±:\n   Forklift operatÃ¶rÃ¼ kimyasal depo alanÄ±nda tehlikeli madde konteynerleri yakÄ±nÄ±nda uygunsuz manevra yaparak konteyner Ã§arpmasÄ±na neden oldu\n   KanÄ±t: Raporda 'forklift Ã§arpmasÄ± sonucu' ifadesi forklift kullanÄ±mÄ±nÄ±n kimyasal depo alanÄ±nda uygun ÅŸekilde gerÃ§ekleÅŸtirilmediÄŸini gÃ¶stermektedir.\n\nâ“ Neden 1? Neden forklift operatÃ¶rÃ¼ kimyasal depo alanÄ±nda uygunsuz manevra yaptÄ±?\n   â†’ OperatÃ¶r dar alanda geri manevra yaparken kimyasal konteynerlere olan mesafeyi yanlÄ±ÅŸ hesapladÄ± ve Ã§arpma meydana geldi\nâ“ Neden 2? Neden operatÃ¶r mesafeyi yanlÄ±ÅŸ hesapladÄ± ve Ã§arpma riskini Ã¶ngÃ¶remedi?\n   â†’ Kimyasal depo alanÄ±nda forklift operasyonlarÄ± iÃ§in Ã¶zel eÄŸitim almamÄ±ÅŸtÄ±, tehlikeli madde konteynerleri yakÄ±nÄ±nda Ã§alÄ±ÅŸma prosedÃ¼rlerini bilmiyordu\nâ“ Neden 3? Neden operatÃ¶r kimyasal depo alanÄ±nda Ã§alÄ±ÅŸmak iÃ§in gerekli Ã¶zel eÄŸitimi almamÄ±ÅŸtÄ±?\n   â†’ Kimyasal depo alanÄ±nda Ã§alÄ±ÅŸacak forklift operatÃ¶rleri iÃ§in Ã¶zel eÄŸitim programÄ± tanÄ±mlanmamÄ±ÅŸtÄ±, sadece genel forklift eÄŸitimi verilmiÅŸti\nâ“ Neden 4? Neden tehlikeli madde depolama alanlarÄ± iÃ§in Ã¶zel forklift operasyon eÄŸitimi tanÄ±mlanmamÄ±ÅŸtÄ±?\n   â†’ FarklÄ± Ã§alÄ±ÅŸma alanlarÄ±nÄ±n (kimyasal depo, genel depo vb.) gerektirdiÄŸi Ã¶zel yetkinlikler belirlenmemiÅŸti, eÄŸitim ihtiyaÃ§ analizi yapÄ±lmamÄ±ÅŸtÄ±\nâ“ Neden 5? Neden eÄŸitim ihtiyaÃ§ analizi yapÄ±lmamÄ±ÅŸ ve yetkinlik gereksinimleri belirlenmemiÅŸti?\n   â†’ Organizasyonda gÃ¶rev bazlÄ± eÄŸitim ihtiyaÃ§larÄ±nÄ± belirleme sistemi yoktu, risk seviyesine gÃ¶re yetkinlik matrisi oluÅŸturulmamÄ±ÅŸtÄ±\n\nğŸ¯ KÃ–K NEDEN [D3.2] EÄŸitim ihtiyaÃ§larÄ±nÄ±n belirlenmemesi - ORGANÄ°ZASYONEL:\n   Kimyasal depo alanÄ±nda forklift operasyonu iÃ§in Ã¶zel eÄŸitim ihtiyaÃ§larÄ±nÄ±n sistematik olarak belirlenmemesi\n   Tehlikeli madde depolama alanlarÄ±nda Ã§alÄ±ÅŸacak forklift operatÃ¶rleri iÃ§in risk bazlÄ± eÄŸitim ihtiyaÃ§ analizi yapÄ±lmamÄ±ÅŸ, gÃ¶rev-yetkinlik matrisi oluÅŸturulmamÄ±ÅŸ ve Ã¶zel eÄŸitim gereksinimleri tanÄ±mlanmamÄ±ÅŸtÄ±r\n\n--------------------------------------------------------------------------------"
  },
  "docx_report": "/Users/selcuk/Desktop/HSE_RCAnalysis_AgenticAI-main/outputs/INC-20260223-155715_hse_report.docx",
  "status": "investigation_complete"
}