{
  "incident_summary": "\nOLAY RAPORU - ELEKTRÄ°K Ã‡ARPMASI\n\nTarih: 20 Åubat 2026, Saat: 15:20\nLokasyon: Ãœretim Tesisi - Ana Elektrik Panosu (MDB-02)\nRapor Eden: Elektrik BakÄ±m Sorumlusu - Ä°brahim AydÄ±n\n\nOLAY AÃ‡IKLAMASI:\nBakÄ±m . Olay Tipi: Accident",
  "analysis_branches": [
    {
      "branch_number": 1,
      "immediate_cause": {
        "code": "A3.2",
        "standard_title_tr": "Gerekli KKD/koruyucu yÃ¶ntemlerin kullanÄ±lmamasÄ±",
        "category_type": "DAVRANIÅSAL",
        "cause_tr": "Elektrik bakÄ±m teknisyeni yÃ¼ksek voltaj Ã§alÄ±ÅŸmasÄ± sÄ±rasÄ±nda yalÄ±tkan eldiven kullanmadÄ±",
        "evidence_tr": "Olay raporunda 'BakÄ±m teknisyeni elektrik panelinde Ã§alÄ±ÅŸÄ±rken yalÄ±tkan eldiven kullanmamÄ±ÅŸ' bilgisi yer almaktadÄ±r."
      },
      "why_chain": [
        {
          "level": 1,
          "question_tr": "Neden elektrik bakÄ±m teknisyeni yÃ¼ksek voltaj Ã§alÄ±ÅŸmasÄ± sÄ±rasÄ±nda yalÄ±tkan eldiven kullanmadÄ±?",
          "answer_tr": "Teknisyen, iÅŸin kÄ±sa sÃ¼receÄŸini dÃ¼ÅŸÃ¼nerek KKD kullanmadan Ã§alÄ±ÅŸmaya baÅŸladÄ±; bu davranÄ±ÅŸ daha Ã¶nce de tekrarlanmÄ±ÅŸ ancak dÃ¼zeltilmemiÅŸti."
        },
        {
          "level": 2,
          "question_tr": "Neden bu gÃ¼vensiz davranÄ±ÅŸ daha Ã¶nce dÃ¼zeltilmemiÅŸti?",
          "answer_tr": "Saha gÃ¶zetim mekanizmasÄ± yetersizdi; amirler yÃ¼ksek voltaj Ã§alÄ±ÅŸmalarÄ±nda KKD kullanÄ±mÄ±nÄ± sistematik olarak denetlemiyordu ve sapmalara mÃ¼dahale edilmiyordu."
        },
        {
          "level": 3,
          "question_tr": "Neden amirler KKD kullanÄ±mÄ±nÄ± sistematik olarak denetlemiyordu ve sapmalara mÃ¼dahale etmiyordu?",
          "answer_tr": "YÃ¶netim tarafÄ±ndan gÃ¶rÃ¼nÃ¼r saha liderliÄŸi ve gÃ¼venlik denetimleri iÃ§in yeterli kaynak, zaman ve sorumluluk tanÄ±mlanmamÄ±ÅŸtÄ±; gÃ¼venlik sapmalarÄ± kanÄ±ksanmÄ±ÅŸtÄ±."
        },
        {
          "level": 4,
          "question_tr": "Neden gÃ¼venlik sapmalarÄ± kanÄ±ksanmÄ±ÅŸ ve gÃ¶rÃ¼nÃ¼r saha liderliÄŸi saÄŸlanamamÄ±ÅŸtÄ±?",
          "answer_tr": "Ãœretim baskÄ±sÄ± gÃ¼venliÄŸin Ã¶nÃ¼ne geÃ§miÅŸ, KKD'siz Ã§alÄ±ÅŸma gibi kural ihlalleri zaman iÃ§inde normal kabul edilir hale gelmiÅŸti; yÃ¶netim bu bilinen sapmalara tolerans gÃ¶steriyordu."
        },
        {
          "level": 5,
          "question_tr": "Neden yÃ¶netim bilinen gÃ¼venlik sapmalarÄ±na tolerans gÃ¶steriyordu ve gÃ¼vensiz davranÄ±ÅŸlar dÃ¼zeltilmiyordu?",
          "answer_tr": "Organizasyonda gÃ¼vensiz davranÄ±ÅŸlarÄ±n pekiÅŸtirilmesini Ã¶nleyecek ve doÄŸru davranÄ±ÅŸÄ± Ã¶dÃ¼llendirecek sistematik bir davranÄ±ÅŸsal gÃ¼venlik yÃ¶netim sistemi yoktu; gÃ¼vensiz davranÄ±ÅŸ tekrar tekrar sonuÃ§suz kalarak pekiÅŸtirilmiÅŸti."
        }
      ],
      "root_cause": {
        "code": "C3.5",
        "standard_title_tr": "GÃ¼vensiz davranÄ±ÅŸÄ±n pekiÅŸtirilmesi veya dÃ¼zeltilmemesi",
        "category_type": "KÄ°ÅÄ°SEL",
        "cause_tr": "YalÄ±tkan eldiven kullanmadan yÃ¼ksek voltaj Ã§alÄ±ÅŸmasÄ± yapma davranÄ±ÅŸÄ±, daha Ã¶nceki Ã§alÄ±ÅŸmalarda da tekrarlanmasÄ±na raÄŸmen hiÃ§bir zaman dÃ¼zeltilmemiÅŸ, yaptÄ±rÄ±m uygulanmamÄ±ÅŸ ve bu gÃ¼vensiz davranÄ±ÅŸ fiilen pekiÅŸtirilmiÅŸtir. YÃ¶netimin sapmalara tolerans gÃ¶stermesi ve saha denetim eksikliÄŸi, teknisyenin KKD'siz Ã§alÄ±ÅŸmayÄ± kabul edilebilir bir norm olarak iÃ§selleÅŸtirmesine yol aÃ§mÄ±ÅŸtÄ±r.",
        "explanation_tr": "Elektrik bakÄ±m teknisyeninin yalÄ±tkan eldiven kullanmama davranÄ±ÅŸÄ± izole bir olay deÄŸildir. Organizasyonda gÃ¼vensiz davranÄ±ÅŸlar sistematik olarak tespit edilip dÃ¼zeltilmediÄŸi, doÄŸru davranÄ±ÅŸ olumlu ÅŸekilde pekiÅŸtirilmediÄŸi ve yÃ¶netim bu sapmalara tolerans gÃ¶sterdiÄŸi iÃ§in, KKD'siz Ã§alÄ±ÅŸma alÄ±ÅŸkanlÄ±ÄŸÄ± zaman iÃ§inde normalleÅŸmiÅŸ ve pekiÅŸmiÅŸtir. KÃ¶k neden, davranÄ±ÅŸsal geri bildirim ve dÃ¼zeltme mekanizmalarÄ±nÄ±n yokluÄŸunda gÃ¼vensiz davranÄ±ÅŸÄ±n Ã¶dÃ¼llendirilmesidir (iÅŸi hÄ±zlÄ± bitirme, rahatlÄ±k)."
      }
    },
    {
      "branch_number": 2,
      "immediate_cause": {
        "code": "B3.2",
        "standard_title_tr": "Elektrik enerjisi (enerjili sistemler)",
        "category_type": "KOÅULLAR",
        "cause_tr": "Ana elektrik panosu (MDB-02) enerjili durumda iken mÃ¼dahale edildi",
        "evidence_tr": "Olay lokasyonu 'Ana Elektrik Panosu (MDB-02)' olarak belirtilmiÅŸ ve elektrik Ã§arpmasÄ± meydana gelmiÅŸtir."
      },
      "why_chain": [
        {
          "level": 1,
          "question_tr": "Neden ana elektrik panosuna (MDB-02) enerjili durumda iken mÃ¼dahale edildi?",
          "answer_tr": "Panoya mÃ¼dahale Ã¶ncesinde enerji izolasyonu (LOTO) prosedÃ¼rÃ¼ uygulanmadÄ± ve enerjinin kesilmesi saÄŸlanmadÄ±"
        },
        {
          "level": 2,
          "question_tr": "Neden enerji izolasyonu (LOTO) prosedÃ¼rÃ¼ uygulanmadÄ±?",
          "answer_tr": "Ãœretim hattÄ±nÄ±n durmasÄ±nÄ± Ã¶nlemek iÃ§in yÃ¶netim ve saha sorumlusu tarafÄ±ndan enerjili mÃ¼dahaleye onay verildi; Ã¼retim baskÄ±sÄ± gÃ¼venlik prosedÃ¼rÃ¼nÃ¼n Ã¶nÃ¼ne geÃ§ti"
        },
        {
          "level": 3,
          "question_tr": "Neden Ã¼retim baskÄ±sÄ± gÃ¼venlik prosedÃ¼rÃ¼nÃ¼n Ã¶nÃ¼ne geÃ§ebildi?",
          "answer_tr": "Tesiste enerjili Ã§alÄ±ÅŸma yasaÄŸÄ±na iliÅŸkin net bir iÅŸ durdurma mekanizmasÄ± yoktu ve Ã§alÄ±ÅŸanlar gÃ¼venlik gerekÃ§esiyle iÅŸi reddetme yetkisini kullanamÄ±yordu"
        },
        {
          "level": 4,
          "question_tr": "Neden Ã§alÄ±ÅŸanlar gÃ¼venlik gerekÃ§esiyle iÅŸi durdurma yetkisini kullanamÄ±yordu?",
          "answer_tr": "YÃ¶netim, daha Ã¶nceki benzer sapmalara (enerjili panoda mÃ¼dahale) tolerans gÃ¶stermiÅŸ ve bu durum zaman iÃ§inde normalleÅŸmiÅŸti; gÃ¼venlik liderliÄŸi taahhÃ¼dÃ¼ yetersizdi"
        },
        {
          "level": 5,
          "question_tr": "Neden yÃ¶netim bilinen gÃ¼venlik sapmalarÄ±na tolerans gÃ¶steriyordu ve bu sapmalar normalleÅŸmiÅŸti?",
          "answer_tr": "Tesiste Ã¼retim Ã¶ncelikli bir kÃ¼ltÃ¼r hÃ¢kimdi; gÃ¼venlik sapmalarÄ± sistematik olarak raporlanmÄ±yor, takip edilmiyor ve hesap sorulmuyordu. Ãœretim baskÄ±sÄ±nÄ±n gÃ¼venliÄŸin Ã¶nÃ¼ne geÃ§mesi kurumsal dÃ¼zeyde kabul gÃ¶rmÃ¼ÅŸ bir norm haline gelmiÅŸti"
        }
      ],
      "root_cause": {
        "code": "D1.4",
        "standard_title_tr": "Ãœretim baskÄ±sÄ±nÄ±n gÃ¼venliÄŸin Ã¶nÃ¼ne geÃ§mesi",
        "category_type": "ORGANÄ°ZASYONEL",
        "cause_tr": "Ãœretim sÃ¼rekliliÄŸi baskÄ±sÄ±nÄ±n enerji izolasyonu ve LOTO prosedÃ¼rlerinin devre dÄ±ÅŸÄ± bÄ±rakÄ±lmasÄ±na yol aÃ§masÄ±",
        "explanation_tr": "Ãœretim hattÄ±nÄ±n durmamasÄ± iÃ§in enerjili panoda mÃ¼dahaleye izin verilmiÅŸ, LOTO prosedÃ¼rÃ¼ atlanmÄ±ÅŸtÄ±r. YÃ¶netim bu tÃ¼r sapmalara daha Ã¶nce de tolerans gÃ¶stermiÅŸ ve bu durum normalleÅŸmiÅŸtir. GÃ¼venlik liderliÄŸi taahhÃ¼dÃ¼ yetersiz kalmÄ±ÅŸ, iÅŸ durdurma yetkisi etkin kullanÄ±lamamÄ±ÅŸ ve Ã¼retim baskÄ±sÄ± gÃ¼venlik kontrollerinin sistematik olarak devre dÄ±ÅŸÄ± bÄ±rakÄ±lmasÄ±na zemin hazÄ±rlamÄ±ÅŸtÄ±r"
      }
    },
    {
      "branch_number": 3,
      "immediate_cause": {
        "code": "A1.1",
        "standard_title_tr": "Bireysel kural/prosedÃ¼r ihlali",
        "category_type": "DAVRANIÅSAL",
        "cause_tr": "Elektrik bakÄ±m teknisyeni LOTO (Kilitleme/Etiketleme) prosedÃ¼rÃ¼nÃ¼ uygulamadan enerjili panele mÃ¼dahale etti",
        "evidence_tr": "Elektrik BakÄ±m Sorumlusu tarafÄ±ndan rapor edilmiÅŸ olup, bakÄ±m Ã§alÄ±ÅŸmasÄ± sÄ±rasÄ±nda elektrik Ã§arpmasÄ± meydana gelmiÅŸtir."
      },
      "why_chain": [
        {
          "level": 1,
          "question_tr": "Neden elektrik bakÄ±m teknisyeni LOTO prosedÃ¼rÃ¼nÃ¼ uygulamadan enerjili panele mÃ¼dahale etti?",
          "answer_tr": "Teknisyen, arÄ±zanÄ±n basit olduÄŸunu dÃ¼ÅŸÃ¼nerek LOTO prosedÃ¼rÃ¼nÃ¼ zaman kaybÄ± olarak deÄŸerlendirdi ve doÄŸrudan mÃ¼dahale etti"
        },
        {
          "level": 2,
          "question_tr": "Neden teknisyen LOTO prosedÃ¼rÃ¼nÃ¼ zaman kaybÄ± olarak deÄŸerlendirdi ve atlayabildi?",
          "answer_tr": "Daha Ã¶nce de LOTO uygulamadan mÃ¼dahale yapÄ±lmÄ±ÅŸ ve bu durum gÃ¶zetim tarafÄ±ndan fark edilmemiÅŸ veya dÃ¼zeltilmemiÅŸti; prosedÃ¼r atlama davranÄ±ÅŸÄ± normalleÅŸmiÅŸti"
        },
        {
          "level": 3,
          "question_tr": "Neden LOTO prosedÃ¼rÃ¼nÃ¼n atlanmasÄ± daha Ã¶nce tespit edilip dÃ¼zeltilmemiÅŸti?",
          "answer_tr": "Sahada yeterli gÃ¶zetim ve denetim mekanizmasÄ± bulunmuyordu; bakÄ±m Ã§alÄ±ÅŸmalarÄ± sÄ±rasÄ±nda LOTO uygulamasÄ±nÄ±n kontrol edildiÄŸi sistematik bir saha denetimi yoktu"
        },
        {
          "level": 4,
          "question_tr": "Neden bakÄ±m Ã§alÄ±ÅŸmalarÄ±nda LOTO uygulamasÄ±nÄ± kontrol eden sistematik bir saha denetim mekanizmasÄ± yoktu?",
          "answer_tr": "YÃ¶netim, enerji izolasyon prosedÃ¼rlerinin sahada fiilen uygulanÄ±p uygulanmadÄ±ÄŸÄ±nÄ± takip etmek iÃ§in bir denetim programÄ± oluÅŸturmamÄ±ÅŸ ve gÃ¼venlik sapmalarÄ±na karÅŸÄ± hesap verebilirlik mekanizmasÄ± kurmamÄ±ÅŸtÄ±"
        },
        {
          "level": 5,
          "question_tr": "Neden yÃ¶netim, enerji izolasyon prosedÃ¼rlerinin sahada uygulanmasÄ±nÄ± takip eden bir denetim programÄ± ve hesap verebilirlik mekanizmasÄ± kurmamÄ±ÅŸtÄ±?",
          "answer_tr": "LOTO prosedÃ¼rÃ¼nÃ¼n atlanmasÄ± gibi gÃ¼venlik sapmalarÄ± zaman iÃ§inde kanÄ±ksanmÄ±ÅŸ, bu sapmalar kabul edilebilir bir uygulama olarak normalleÅŸmiÅŸ ve yÃ¶netim bu bilinen sapmalara tolerans gÃ¶stermiÅŸti"
        }
      ],
      "root_cause": {
        "code": "D1.5",
        "standard_title_tr": "SapmalarÄ±n normalleÅŸmesi (KanÄ±ksama)",
        "category_type": "ORGANÄ°ZASYONEL",
        "cause_tr": "LOTO prosedÃ¼rÃ¼nÃ¼n atlanmasÄ±nÄ±n organizasyonel dÃ¼zeyde kanÄ±ksanmasÄ± ve normalleÅŸmesi",
        "explanation_tr": "Elektrik bakÄ±m Ã§alÄ±ÅŸmalarÄ±nda LOTO (Kilitleme/Etiketleme) prosedÃ¼rÃ¼nÃ¼n uygulanmamasÄ± zaman iÃ§inde tekrarlayan bir sapma haline gelmiÅŸ, bu sapma gÃ¶zetim mekanizmalarÄ±nÄ±n yetersizliÄŸi nedeniyle tespit edilememiÅŸ ve yÃ¶netim tarafÄ±ndan dÃ¼zeltilmemiÅŸtir. ProsedÃ¼r ihlalinin sonuÃ§suz kalmasÄ±, gÃ¼vensiz davranÄ±ÅŸÄ±n normalleÅŸmesine ve enerjili panele LOTO'suz mÃ¼dahalenin kabul edilebilir bir uygulama olarak yerleÅŸmesine yol aÃ§mÄ±ÅŸtÄ±r"
      }
    }
  ],
  "final_root_causes": [
    {
      "code": "C3.5",
      "standard_title_tr": "GÃ¼vensiz davranÄ±ÅŸÄ±n pekiÅŸtirilmesi veya dÃ¼zeltilmemesi",
      "category_type": "KÄ°ÅÄ°SEL",
      "cause_tr": "YalÄ±tkan eldiven kullanmadan yÃ¼ksek voltaj Ã§alÄ±ÅŸmasÄ± yapma davranÄ±ÅŸÄ±, daha Ã¶nceki Ã§alÄ±ÅŸmalarda da tekrarlanmasÄ±na raÄŸmen hiÃ§bir zaman dÃ¼zeltilmemiÅŸ, yaptÄ±rÄ±m uygulanmamÄ±ÅŸ ve bu gÃ¼vensiz davranÄ±ÅŸ fiilen pekiÅŸtirilmiÅŸtir. YÃ¶netimin sapmalara tolerans gÃ¶stermesi ve saha denetim eksikliÄŸi, teknisyenin KKD'siz Ã§alÄ±ÅŸmayÄ± kabul edilebilir bir norm olarak iÃ§selleÅŸtirmesine yol aÃ§mÄ±ÅŸtÄ±r.",
      "explanation_tr": "Elektrik bakÄ±m teknisyeninin yalÄ±tkan eldiven kullanmama davranÄ±ÅŸÄ± izole bir olay deÄŸildir. Organizasyonda gÃ¼vensiz davranÄ±ÅŸlar sistematik olarak tespit edilip dÃ¼zeltilmediÄŸi, doÄŸru davranÄ±ÅŸ olumlu ÅŸekilde pekiÅŸtirilmediÄŸi ve yÃ¶netim bu sapmalara tolerans gÃ¶sterdiÄŸi iÃ§in, KKD'siz Ã§alÄ±ÅŸma alÄ±ÅŸkanlÄ±ÄŸÄ± zaman iÃ§inde normalleÅŸmiÅŸ ve pekiÅŸmiÅŸtir. KÃ¶k neden, davranÄ±ÅŸsal geri bildirim ve dÃ¼zeltme mekanizmalarÄ±nÄ±n yokluÄŸunda gÃ¼vensiz davranÄ±ÅŸÄ±n Ã¶dÃ¼llendirilmesidir (iÅŸi hÄ±zlÄ± bitirme, rahatlÄ±k)."
    },
    {
      "code": "D1.4",
      "standard_title_tr": "Ãœretim baskÄ±sÄ±nÄ±n gÃ¼venliÄŸin Ã¶nÃ¼ne geÃ§mesi",
      "category_type": "ORGANÄ°ZASYONEL",
      "cause_tr": "Ãœretim sÃ¼rekliliÄŸi baskÄ±sÄ±nÄ±n enerji izolasyonu ve LOTO prosedÃ¼rlerinin devre dÄ±ÅŸÄ± bÄ±rakÄ±lmasÄ±na yol aÃ§masÄ±",
      "explanation_tr": "Ãœretim hattÄ±nÄ±n durmamasÄ± iÃ§in enerjili panoda mÃ¼dahaleye izin verilmiÅŸ, LOTO prosedÃ¼rÃ¼ atlanmÄ±ÅŸtÄ±r. YÃ¶netim bu tÃ¼r sapmalara daha Ã¶nce de tolerans gÃ¶stermiÅŸ ve bu durum normalleÅŸmiÅŸtir. GÃ¼venlik liderliÄŸi taahhÃ¼dÃ¼ yetersiz kalmÄ±ÅŸ, iÅŸ durdurma yetkisi etkin kullanÄ±lamamÄ±ÅŸ ve Ã¼retim baskÄ±sÄ± gÃ¼venlik kontrollerinin sistematik olarak devre dÄ±ÅŸÄ± bÄ±rakÄ±lmasÄ±na zemin hazÄ±rlamÄ±ÅŸtÄ±r"
    },
    {
      "code": "D1.5",
      "standard_title_tr": "SapmalarÄ±n normalleÅŸmesi (KanÄ±ksama)",
      "category_type": "ORGANÄ°ZASYONEL",
      "cause_tr": "LOTO prosedÃ¼rÃ¼nÃ¼n atlanmasÄ±nÄ±n organizasyonel dÃ¼zeyde kanÄ±ksanmasÄ± ve normalleÅŸmesi",
      "explanation_tr": "Elektrik bakÄ±m Ã§alÄ±ÅŸmalarÄ±nda LOTO (Kilitleme/Etiketleme) prosedÃ¼rÃ¼nÃ¼n uygulanmamasÄ± zaman iÃ§inde tekrarlayan bir sapma haline gelmiÅŸ, bu sapma gÃ¶zetim mekanizmalarÄ±nÄ±n yetersizliÄŸi nedeniyle tespit edilememiÅŸ ve yÃ¶netim tarafÄ±ndan dÃ¼zeltilmemiÅŸtir. ProsedÃ¼r ihlalinin sonuÃ§suz kalmasÄ±, gÃ¼vensiz davranÄ±ÅŸÄ±n normalleÅŸmesine ve enerjili panele LOTO'suz mÃ¼dahalenin kabul edilebilir bir uygulama olarak yerleÅŸmesine yol aÃ§mÄ±ÅŸtÄ±r"
    }
  ],
  "analysis_method": "HSG245 Hierarchical 5-Why (A/B â†’ C/D)",
  "final_report_tr": "================================================================================\nKÃ–K NEDEN ANALÄ°ZÄ° RAPORU (HSG245 - 5 Why Metodolojisi)\n================================================================================\n\nOLAY: \nOLAY RAPORU - ELEKTRÄ°K Ã‡ARPMASI\n\nTarih: 20 Åubat 2026, Saat: 15:20\nLokasyon: Ãœretim Tesisi - Ana Elektrik Panosu (MDB-02)\nRapor Eden: Elektrik BakÄ±m Sorumlusu - Ä°brahim AydÄ±n\n\nOLAY AÃ‡IKLAMASI:\nBakÄ±m . Olay Tipi: Accident\n\n--------------------------------------------------------------------------------\n\nâš¡ DAL 1: DAVRANIÅSAL\n\nğŸ“Œ DoÄŸrudan Neden [A3.2] Gerekli KKD/koruyucu yÃ¶ntemlerin kullanÄ±lmamasÄ±:\n   Elektrik bakÄ±m teknisyeni yÃ¼ksek voltaj Ã§alÄ±ÅŸmasÄ± sÄ±rasÄ±nda yalÄ±tkan eldiven kullanmadÄ±\n   KanÄ±t: Olay raporunda 'BakÄ±m teknisyeni elektrik panelinde Ã§alÄ±ÅŸÄ±rken yalÄ±tkan eldiven kullanmamÄ±ÅŸ' bilgisi yer almaktadÄ±r.\n\nâ“ Neden 1? Neden elektrik bakÄ±m teknisyeni yÃ¼ksek voltaj Ã§alÄ±ÅŸmasÄ± sÄ±rasÄ±nda yalÄ±tkan eldiven kullanmadÄ±?\n   â†’ Teknisyen, iÅŸin kÄ±sa sÃ¼receÄŸini dÃ¼ÅŸÃ¼nerek KKD kullanmadan Ã§alÄ±ÅŸmaya baÅŸladÄ±; bu davranÄ±ÅŸ daha Ã¶nce de tekrarlanmÄ±ÅŸ ancak dÃ¼zeltilmemiÅŸti.\nâ“ Neden 2? Neden bu gÃ¼vensiz davranÄ±ÅŸ daha Ã¶nce dÃ¼zeltilmemiÅŸti?\n   â†’ Saha gÃ¶zetim mekanizmasÄ± yetersizdi; amirler yÃ¼ksek voltaj Ã§alÄ±ÅŸmalarÄ±nda KKD kullanÄ±mÄ±nÄ± sistematik olarak denetlemiyordu ve sapmalara mÃ¼dahale edilmiyordu.\nâ“ Neden 3? Neden amirler KKD kullanÄ±mÄ±nÄ± sistematik olarak denetlemiyordu ve sapmalara mÃ¼dahale etmiyordu?\n   â†’ YÃ¶netim tarafÄ±ndan gÃ¶rÃ¼nÃ¼r saha liderliÄŸi ve gÃ¼venlik denetimleri iÃ§in yeterli kaynak, zaman ve sorumluluk tanÄ±mlanmamÄ±ÅŸtÄ±; gÃ¼venlik sapmalarÄ± kanÄ±ksanmÄ±ÅŸtÄ±.\nâ“ Neden 4? Neden gÃ¼venlik sapmalarÄ± kanÄ±ksanmÄ±ÅŸ ve gÃ¶rÃ¼nÃ¼r saha liderliÄŸi saÄŸlanamamÄ±ÅŸtÄ±?\n   â†’ Ãœretim baskÄ±sÄ± gÃ¼venliÄŸin Ã¶nÃ¼ne geÃ§miÅŸ, KKD'siz Ã§alÄ±ÅŸma gibi kural ihlalleri zaman iÃ§inde normal kabul edilir hale gelmiÅŸti; yÃ¶netim bu bilinen sapmalara tolerans gÃ¶steriyordu.\nâ“ Neden 5? Neden yÃ¶netim bilinen gÃ¼venlik sapmalarÄ±na tolerans gÃ¶steriyordu ve gÃ¼vensiz davranÄ±ÅŸlar dÃ¼zeltilmiyordu?\n   â†’ Organizasyonda gÃ¼vensiz davranÄ±ÅŸlarÄ±n pekiÅŸtirilmesini Ã¶nleyecek ve doÄŸru davranÄ±ÅŸÄ± Ã¶dÃ¼llendirecek sistematik bir davranÄ±ÅŸsal gÃ¼venlik yÃ¶netim sistemi yoktu; gÃ¼vensiz davranÄ±ÅŸ tekrar tekrar sonuÃ§suz kalarak pekiÅŸtirilmiÅŸti.\n\nğŸ¯ KÃ–K NEDEN [C3.5] GÃ¼vensiz davranÄ±ÅŸÄ±n pekiÅŸtirilmesi veya dÃ¼zeltilmemesi - KÄ°ÅÄ°SEL:\n   YalÄ±tkan eldiven kullanmadan yÃ¼ksek voltaj Ã§alÄ±ÅŸmasÄ± yapma davranÄ±ÅŸÄ±, daha Ã¶nceki Ã§alÄ±ÅŸmalarda da tekrarlanmasÄ±na raÄŸmen hiÃ§bir zaman dÃ¼zeltilmemiÅŸ, yaptÄ±rÄ±m uygulanmamÄ±ÅŸ ve bu gÃ¼vensiz davranÄ±ÅŸ fiilen pekiÅŸtirilmiÅŸtir. YÃ¶netimin sapmalara tolerans gÃ¶stermesi ve saha denetim eksikliÄŸi, teknisyenin KKD'siz Ã§alÄ±ÅŸmayÄ± kabul edilebilir bir norm olarak iÃ§selleÅŸtirmesine yol aÃ§mÄ±ÅŸtÄ±r.\n   Elektrik bakÄ±m teknisyeninin yalÄ±tkan eldiven kullanmama davranÄ±ÅŸÄ± izole bir olay deÄŸildir. Organizasyonda gÃ¼vensiz davranÄ±ÅŸlar sistematik olarak tespit edilip dÃ¼zeltilmediÄŸi, doÄŸru davranÄ±ÅŸ olumlu ÅŸekilde pekiÅŸtirilmediÄŸi ve yÃ¶netim bu sapmalara tolerans gÃ¶sterdiÄŸi iÃ§in, KKD'siz Ã§alÄ±ÅŸma alÄ±ÅŸkanlÄ±ÄŸÄ± zaman iÃ§inde normalleÅŸmiÅŸ ve pekiÅŸmiÅŸtir. KÃ¶k neden, davranÄ±ÅŸsal geri bildirim ve dÃ¼zeltme mekanizmalarÄ±nÄ±n yokluÄŸunda gÃ¼vensiz davranÄ±ÅŸÄ±n Ã¶dÃ¼llendirilmesidir (iÅŸi hÄ±zlÄ± bitirme, rahatlÄ±k).\n\n--------------------------------------------------------------------------------\n\nâš¡ DAL 2: KOÅULLAR\n\nğŸ“Œ DoÄŸrudan Neden [B3.2] Elektrik enerjisi (enerjili sistemler):\n   Ana elektrik panosu (MDB-02) enerjili durumda iken mÃ¼dahale edildi\n   KanÄ±t: Olay lokasyonu 'Ana Elektrik Panosu (MDB-02)' olarak belirtilmiÅŸ ve elektrik Ã§arpmasÄ± meydana gelmiÅŸtir.\n\nâ“ Neden 1? Neden ana elektrik panosuna (MDB-02) enerjili durumda iken mÃ¼dahale edildi?\n   â†’ Panoya mÃ¼dahale Ã¶ncesinde enerji izolasyonu (LOTO) prosedÃ¼rÃ¼ uygulanmadÄ± ve enerjinin kesilmesi saÄŸlanmadÄ±\nâ“ Neden 2? Neden enerji izolasyonu (LOTO) prosedÃ¼rÃ¼ uygulanmadÄ±?\n   â†’ Ãœretim hattÄ±nÄ±n durmasÄ±nÄ± Ã¶nlemek iÃ§in yÃ¶netim ve saha sorumlusu tarafÄ±ndan enerjili mÃ¼dahaleye onay verildi; Ã¼retim baskÄ±sÄ± gÃ¼venlik prosedÃ¼rÃ¼nÃ¼n Ã¶nÃ¼ne geÃ§ti\nâ“ Neden 3? Neden Ã¼retim baskÄ±sÄ± gÃ¼venlik prosedÃ¼rÃ¼nÃ¼n Ã¶nÃ¼ne geÃ§ebildi?\n   â†’ Tesiste enerjili Ã§alÄ±ÅŸma yasaÄŸÄ±na iliÅŸkin net bir iÅŸ durdurma mekanizmasÄ± yoktu ve Ã§alÄ±ÅŸanlar gÃ¼venlik gerekÃ§esiyle iÅŸi reddetme yetkisini kullanamÄ±yordu\nâ“ Neden 4? Neden Ã§alÄ±ÅŸanlar gÃ¼venlik gerekÃ§esiyle iÅŸi durdurma yetkisini kullanamÄ±yordu?\n   â†’ YÃ¶netim, daha Ã¶nceki benzer sapmalara (enerjili panoda mÃ¼dahale) tolerans gÃ¶stermiÅŸ ve bu durum zaman iÃ§inde normalleÅŸmiÅŸti; gÃ¼venlik liderliÄŸi taahhÃ¼dÃ¼ yetersizdi\nâ“ Neden 5? Neden yÃ¶netim bilinen gÃ¼venlik sapmalarÄ±na tolerans gÃ¶steriyordu ve bu sapmalar normalleÅŸmiÅŸti?\n   â†’ Tesiste Ã¼retim Ã¶ncelikli bir kÃ¼ltÃ¼r hÃ¢kimdi; gÃ¼venlik sapmalarÄ± sistematik olarak raporlanmÄ±yor, takip edilmiyor ve hesap sorulmuyordu. Ãœretim baskÄ±sÄ±nÄ±n gÃ¼venliÄŸin Ã¶nÃ¼ne geÃ§mesi kurumsal dÃ¼zeyde kabul gÃ¶rmÃ¼ÅŸ bir norm haline gelmiÅŸti\n\nğŸ¯ KÃ–K NEDEN [D1.4] Ãœretim baskÄ±sÄ±nÄ±n gÃ¼venliÄŸin Ã¶nÃ¼ne geÃ§mesi - ORGANÄ°ZASYONEL:\n   Ãœretim sÃ¼rekliliÄŸi baskÄ±sÄ±nÄ±n enerji izolasyonu ve LOTO prosedÃ¼rlerinin devre dÄ±ÅŸÄ± bÄ±rakÄ±lmasÄ±na yol aÃ§masÄ±\n   Ãœretim hattÄ±nÄ±n durmamasÄ± iÃ§in enerjili panoda mÃ¼dahaleye izin verilmiÅŸ, LOTO prosedÃ¼rÃ¼ atlanmÄ±ÅŸtÄ±r. YÃ¶netim bu tÃ¼r sapmalara daha Ã¶nce de tolerans gÃ¶stermiÅŸ ve bu durum normalleÅŸmiÅŸtir. GÃ¼venlik liderliÄŸi taahhÃ¼dÃ¼ yetersiz kalmÄ±ÅŸ, iÅŸ durdurma yetkisi etkin kullanÄ±lamamÄ±ÅŸ ve Ã¼retim baskÄ±sÄ± gÃ¼venlik kontrollerinin sistematik olarak devre dÄ±ÅŸÄ± bÄ±rakÄ±lmasÄ±na zemin hazÄ±rlamÄ±ÅŸtÄ±r\n\n--------------------------------------------------------------------------------\n\nâš¡ DAL 3: DAVRANIÅSAL\n\nğŸ“Œ DoÄŸrudan Neden [A1.1] Bireysel kural/prosedÃ¼r ihlali:\n   Elektrik bakÄ±m teknisyeni LOTO (Kilitleme/Etiketleme) prosedÃ¼rÃ¼nÃ¼ uygulamadan enerjili panele mÃ¼dahale etti\n   KanÄ±t: Elektrik BakÄ±m Sorumlusu tarafÄ±ndan rapor edilmiÅŸ olup, bakÄ±m Ã§alÄ±ÅŸmasÄ± sÄ±rasÄ±nda elektrik Ã§arpmasÄ± meydana gelmiÅŸtir.\n\nâ“ Neden 1? Neden elektrik bakÄ±m teknisyeni LOTO prosedÃ¼rÃ¼nÃ¼ uygulamadan enerjili panele mÃ¼dahale etti?\n   â†’ Teknisyen, arÄ±zanÄ±n basit olduÄŸunu dÃ¼ÅŸÃ¼nerek LOTO prosedÃ¼rÃ¼nÃ¼ zaman kaybÄ± olarak deÄŸerlendirdi ve doÄŸrudan mÃ¼dahale etti\nâ“ Neden 2? Neden teknisyen LOTO prosedÃ¼rÃ¼nÃ¼ zaman kaybÄ± olarak deÄŸerlendirdi ve atlayabildi?\n   â†’ Daha Ã¶nce de LOTO uygulamadan mÃ¼dahale yapÄ±lmÄ±ÅŸ ve bu durum gÃ¶zetim tarafÄ±ndan fark edilmemiÅŸ veya dÃ¼zeltilmemiÅŸti; prosedÃ¼r atlama davranÄ±ÅŸÄ± normalleÅŸmiÅŸti\nâ“ Neden 3? Neden LOTO prosedÃ¼rÃ¼nÃ¼n atlanmasÄ± daha Ã¶nce tespit edilip dÃ¼zeltilmemiÅŸti?\n   â†’ Sahada yeterli gÃ¶zetim ve denetim mekanizmasÄ± bulunmuyordu; bakÄ±m Ã§alÄ±ÅŸmalarÄ± sÄ±rasÄ±nda LOTO uygulamasÄ±nÄ±n kontrol edildiÄŸi sistematik bir saha denetimi yoktu\nâ“ Neden 4? Neden bakÄ±m Ã§alÄ±ÅŸmalarÄ±nda LOTO uygulamasÄ±nÄ± kontrol eden sistematik bir saha denetim mekanizmasÄ± yoktu?\n   â†’ YÃ¶netim, enerji izolasyon prosedÃ¼rlerinin sahada fiilen uygulanÄ±p uygulanmadÄ±ÄŸÄ±nÄ± takip etmek iÃ§in bir denetim programÄ± oluÅŸturmamÄ±ÅŸ ve gÃ¼venlik sapmalarÄ±na karÅŸÄ± hesap verebilirlik mekanizmasÄ± kurmamÄ±ÅŸtÄ±\nâ“ Neden 5? Neden yÃ¶netim, enerji izolasyon prosedÃ¼rlerinin sahada uygulanmasÄ±nÄ± takip eden bir denetim programÄ± ve hesap verebilirlik mekanizmasÄ± kurmamÄ±ÅŸtÄ±?\n   â†’ LOTO prosedÃ¼rÃ¼nÃ¼n atlanmasÄ± gibi gÃ¼venlik sapmalarÄ± zaman iÃ§inde kanÄ±ksanmÄ±ÅŸ, bu sapmalar kabul edilebilir bir uygulama olarak normalleÅŸmiÅŸ ve yÃ¶netim bu bilinen sapmalara tolerans gÃ¶stermiÅŸti\n\nğŸ¯ KÃ–K NEDEN [D1.5] SapmalarÄ±n normalleÅŸmesi (KanÄ±ksama) - ORGANÄ°ZASYONEL:\n   LOTO prosedÃ¼rÃ¼nÃ¼n atlanmasÄ±nÄ±n organizasyonel dÃ¼zeyde kanÄ±ksanmasÄ± ve normalleÅŸmesi\n   Elektrik bakÄ±m Ã§alÄ±ÅŸmalarÄ±nda LOTO (Kilitleme/Etiketleme) prosedÃ¼rÃ¼nÃ¼n uygulanmamasÄ± zaman iÃ§inde tekrarlayan bir sapma haline gelmiÅŸ, bu sapma gÃ¶zetim mekanizmalarÄ±nÄ±n yetersizliÄŸi nedeniyle tespit edilememiÅŸ ve yÃ¶netim tarafÄ±ndan dÃ¼zeltilmemiÅŸtir. ProsedÃ¼r ihlalinin sonuÃ§suz kalmasÄ±, gÃ¼vensiz davranÄ±ÅŸÄ±n normalleÅŸmesine ve enerjili panele LOTO'suz mÃ¼dahalenin kabul edilebilir bir uygulama olarak yerleÅŸmesine yol aÃ§mÄ±ÅŸtÄ±r\n\n--------------------------------------------------------------------------------"
}