{
  "incident_summary": "\nOLAY RAPORU - ELEKTRÄ°K Ã‡ARPMASI\n\nTarih: 20 Åubat 2026, Saat: 15:20\nLokasyon: Ãœretim Tesisi - Ana Elektrik Panosu (MDB-02)\nRapor Eden: Elektrik BakÄ±m Sorumlusu - Ä°brahim AydÄ±n\n\nOLAY AÃ‡IKLAMASI:\nBakÄ±m . Olay Tipi: Accident",
  "analysis_branches": [
    {
      "branch_number": 1,
      "immediate_cause": {
        "code": "A3.2",
        "standard_title_tr": "Gerekli KKD/koruyucu yÃ¶ntemlerin kullanÄ±lmamasÄ±",
        "category_type": "DAVRANIÅSAL",
        "cause_tr": "Elektrik teknisyeni yÃ¼ksek voltaj Ã§alÄ±ÅŸmasÄ± iÃ§in zorunlu olan yalÄ±tkan eldiven kullanmadÄ±",
        "evidence_tr": "Olay raporunda 'BakÄ±m teknisyeni elektrik Ã§alÄ±ÅŸmasÄ± sÄ±rasÄ±nda uygun koruyucu ekipman kullanmadÄ±' bilgisi yer almaktadÄ±r."
      },
      "why_chain": [
        {
          "level": 1,
          "question_tr": "Neden elektrik teknisyeni yalÄ±tkan eldiven kullanmadÄ±?",
          "answer_tr": "Eldivenler Ã§alÄ±ÅŸma alanÄ±nda hazÄ±r bulunmuyordu ve teknisyen iÅŸi hÄ±zlÄ± bitirmek iÃ§in eldivensiz devam etti"
        },
        {
          "level": 2,
          "question_tr": "Neden eldivenler Ã§alÄ±ÅŸma alanÄ±nda hazÄ±r bulunmuyordu?",
          "answer_tr": "KKE'ler merkezi depoda tutuluyordu ve her iÅŸ Ã¶ncesi alÄ±nmasÄ± gerekiyordu, ancak bu kontrol yapÄ±lmÄ±yordu"
        },
        {
          "level": 3,
          "question_tr": "Neden iÅŸ Ã¶ncesi KKE kontrolÃ¼ yapÄ±lmÄ±yordu?",
          "answer_tr": "Elektrik Ã§alÄ±ÅŸmalarÄ± iÃ§in iÅŸ izin sistemi uygulanmÄ±yordu ve KKE kontrol listesi zorunlu tutulmuyordu"
        },
        {
          "level": 4,
          "question_tr": "Neden elektrik Ã§alÄ±ÅŸmalarÄ± iÃ§in iÅŸ izin sistemi uygulanmÄ±yordu?",
          "answer_tr": "YÃ¼ksek voltaj Ã§alÄ±ÅŸmalarÄ± iÃ§in Ã¶zel iÅŸ izin prosedÃ¼rÃ¼ tanÄ±mlanmamÄ±ÅŸ ve mevcut sistem sadece sÄ±cak iÅŸleri kapsÄ±yordu"
        },
        {
          "level": 5,
          "question_tr": "Neden yÃ¼ksek voltaj iÃ§in Ã¶zel iÅŸ izin prosedÃ¼rÃ¼ tanÄ±mlanmamÄ±ÅŸtÄ±?",
          "answer_tr": "Risk deÄŸerlendirmesi yapÄ±lÄ±rken elektrik Ã§alÄ±ÅŸmalarÄ±nÄ±n kritik kontrol gereksinimleri belirlenmemiÅŸ ve iÅŸ izin sistemine entegre edilmemiÅŸti"
        }
      ],
      "root_cause": {
        "code": "D4.4",
        "standard_title_tr": "Ä°ÅŸ izin sisteminin etkisiz olmasÄ±",
        "category_type": "ORGANÄ°ZASYONEL",
        "cause_tr": "Elektrik Ã§alÄ±ÅŸmalarÄ± iÃ§in iÅŸ izin sisteminin tanÄ±mlanmamasÄ± ve KKE kontrollerinin zorunlu tutulmamasÄ±",
        "explanation_tr": "YÃ¼ksek voltaj Ã§alÄ±ÅŸmalarÄ± iÃ§in Ã¶zel iÅŸ izin prosedÃ¼rÃ¼ oluÅŸturulmamÄ±ÅŸ, risk kontrolleri (KKE kullanÄ±mÄ±, enerji izolasyonu vb.) iÅŸ izin sistemine entegre edilmemiÅŸ ve bu nedenle kritik gÃ¼venlik Ã¶nlemleri atlanabilir hale gelmiÅŸtir"
      }
    },
    {
      "branch_number": 2,
      "immediate_cause": {
        "code": "B3.2",
        "standard_title_tr": "Elektrik enerjisi (enerjili sistemler)",
        "category_type": "KOÅULLAR",
        "cause_tr": "Ana elektrik panosu (MDB-02) enerjili durumdayken mÃ¼dahale edildi",
        "evidence_tr": "Lokasyon 'Ana Elektrik Panosu (MDB-02)' olarak belirtilmiÅŸ ve elektrik Ã§arpmasÄ± meydana gelmiÅŸtir."
      },
      "why_chain": [
        {
          "level": 1,
          "question_tr": "Neden ana elektrik panosu enerjili durumdayken mÃ¼dahale edildi?",
          "answer_tr": "Enerji izolasyonu (LOTO) prosedÃ¼rÃ¼ uygulanmadÄ±, elektrikli bakÄ±m yapÄ±ldÄ±"
        },
        {
          "level": 2,
          "question_tr": "Neden enerji izolasyonu prosedÃ¼rÃ¼ uygulanmadÄ±?",
          "answer_tr": "BakÄ±m teknisyeni LOTO prosedÃ¼rÃ¼nÃ¼ biliyordu ancak zaman kazanmak iÃ§in atladÄ±"
        },
        {
          "level": 3,
          "question_tr": "Neden prosedÃ¼rÃ¼ atlama davranÄ±ÅŸÄ± gerÃ§ekleÅŸti?",
          "answer_tr": "Daha Ã¶nce de benzer ÅŸekilde kÄ±sa yoldan yapÄ±lan iÅŸlerde kaza olmamÄ±ÅŸ, bu davranÄ±ÅŸ dÃ¼zeltilmemiÅŸ"
        },
        {
          "level": 4,
          "question_tr": "Neden gÃ¼vensiz davranÄ±ÅŸ dÃ¼zeltilmedi veya Ã¶nlenmedi?",
          "answer_tr": "Sahada yeterli gÃ¶zetim yapÄ±lmÄ±yor, prosedÃ¼r ihlalleri tespit edilmiyor ve mÃ¼dahale edilmiyor"
        },
        {
          "level": 5,
          "question_tr": "Neden prosedÃ¼r ihlalleri tespit edilip dÃ¼zeltilmiyor?",
          "answer_tr": "YÃ¶netim ve gÃ¶zetim sistemi zayÄ±f, saha denetimi yetersiz, sapmalara mÃ¼dahale edilmiyor"
        }
      ],
      "root_cause": {
        "code": "D1.2",
        "standard_title_tr": "Yetersiz gÃ¶zetim veya denetim",
        "category_type": "ORGANÄ°ZASYONEL",
        "cause_tr": "Elektrik bakÄ±m Ã§alÄ±ÅŸmalarÄ±nda yetersiz gÃ¶zetim ve prosedÃ¼r ihlallerinin tespit edilememesi",
        "explanation_tr": "BakÄ±m teknisyenlerinin saha Ã§alÄ±ÅŸmalarÄ± yeterince denetlenmiyor, LOTO gibi kritik prosedÃ¼rlerin atlanmasÄ± tespit edilip dÃ¼zeltilmiyor, gÃ¼vensiz davranÄ±ÅŸlar normalleÅŸiyor"
      }
    },
    {
      "branch_number": 3,
      "immediate_cause": {
        "code": "A1.1",
        "standard_title_tr": "Bireysel kural/prosedÃ¼r ihlali",
        "category_type": "DAVRANIÅSAL",
        "cause_tr": "Teknisyen LOTO (Lock Out Tag Out) prosedÃ¼rÃ¼nÃ¼ uygulamadan enerjili panoya mÃ¼dahale etti",
        "evidence_tr": "Elektrik BakÄ±m Sorumlusu tarafÄ±ndan rapor edilmiÅŸ olup, bakÄ±m Ã§alÄ±ÅŸmasÄ± sÄ±rasÄ±nda elektrik Ã§arpmasÄ± meydana gelmiÅŸtir."
      },
      "why_chain": [
        {
          "level": 1,
          "question_tr": "Neden teknisyen LOTO prosedÃ¼rÃ¼nÃ¼ uygulamadÄ±?",
          "answer_tr": "Teknisyen iÅŸin acil olduÄŸunu dÃ¼ÅŸÃ¼ndÃ¼ ve LOTO uygulamanÄ±n zaman kaybÄ± olacaÄŸÄ±nÄ± varsaydÄ±"
        },
        {
          "level": 2,
          "question_tr": "Neden teknisyen LOTO prosedÃ¼rÃ¼nÃ¼ atlamanÄ±n kabul edilebilir olduÄŸunu dÃ¼ÅŸÃ¼ndÃ¼?",
          "answer_tr": "Daha Ã¶nce benzer durumlarda LOTO uygulanmadan yapÄ±lan mÃ¼dahalelerde herhangi bir uyarÄ± veya dÃ¼zeltme yapÄ±lmamÄ±ÅŸtÄ±"
        },
        {
          "level": 3,
          "question_tr": "Neden prosedÃ¼r ihlalleri tespit edilip dÃ¼zeltilmedi?",
          "answer_tr": "Elektrik bakÄ±m Ã§alÄ±ÅŸmalarÄ± sÄ±rasÄ±nda yeterli gÃ¶zetim ve denetim yapÄ±lmÄ±yordu"
        },
        {
          "level": 4,
          "question_tr": "Neden elektrik bakÄ±m Ã§alÄ±ÅŸmalarÄ±nda gÃ¶zetim ve denetim yetersizdi?",
          "answer_tr": "BakÄ±m sorumlularÄ± Ã§ok sayÄ±da iÅŸten sorumluydu ve saha denetimi iÃ§in yeterli zaman ayÄ±ramÄ±yordu"
        },
        {
          "level": 5,
          "question_tr": "Neden prosedÃ¼r ihlalleri ve gÃ¼venli olmayan davranÄ±ÅŸlar dÃ¼zeltilmedi ve hesap sorulmadÄ±?",
          "answer_tr": "YÃ¶netim tarafÄ±ndan gÃ¼venlik kurallarÄ±na uyumsuzluklar iÃ§in net hesap verebilirlik sistemi oluÅŸturulmamÄ±ÅŸ ve uygulanmamÄ±ÅŸtÄ±"
        }
      ],
      "root_cause": {
        "code": "D1.3",
        "standard_title_tr": "Hesap verebilirlik eksikliÄŸi",
        "category_type": "ORGANÄ°ZASYONEL",
        "cause_tr": "LOTO prosedÃ¼rÃ¼ ihlallerinde hesap verebilirlik sisteminin olmamasÄ±",
        "explanation_tr": "GÃ¼venlik prosedÃ¼rlerine uyumsuzluk gÃ¶steren Ã§alÄ±ÅŸanlar iÃ§in net hesap verebilirlik mekanizmasÄ± oluÅŸturulmamÄ±ÅŸ, prosedÃ¼r ihlalleri tespit edilse bile dÃ¼zeltici Ã¶nlem alÄ±nmamÄ±ÅŸ ve bu durum gÃ¼venli olmayan davranÄ±ÅŸlarÄ±n normalleÅŸmesine yol aÃ§mÄ±ÅŸtÄ±r"
      }
    }
  ],
  "final_root_causes": [
    {
      "code": "D4.4",
      "standard_title_tr": "Ä°ÅŸ izin sisteminin etkisiz olmasÄ±",
      "category_type": "ORGANÄ°ZASYONEL",
      "cause_tr": "Elektrik Ã§alÄ±ÅŸmalarÄ± iÃ§in iÅŸ izin sisteminin tanÄ±mlanmamasÄ± ve KKE kontrollerinin zorunlu tutulmamasÄ±",
      "explanation_tr": "YÃ¼ksek voltaj Ã§alÄ±ÅŸmalarÄ± iÃ§in Ã¶zel iÅŸ izin prosedÃ¼rÃ¼ oluÅŸturulmamÄ±ÅŸ, risk kontrolleri (KKE kullanÄ±mÄ±, enerji izolasyonu vb.) iÅŸ izin sistemine entegre edilmemiÅŸ ve bu nedenle kritik gÃ¼venlik Ã¶nlemleri atlanabilir hale gelmiÅŸtir"
    },
    {
      "code": "D1.2",
      "standard_title_tr": "Yetersiz gÃ¶zetim veya denetim",
      "category_type": "ORGANÄ°ZASYONEL",
      "cause_tr": "Elektrik bakÄ±m Ã§alÄ±ÅŸmalarÄ±nda yetersiz gÃ¶zetim ve prosedÃ¼r ihlallerinin tespit edilememesi",
      "explanation_tr": "BakÄ±m teknisyenlerinin saha Ã§alÄ±ÅŸmalarÄ± yeterince denetlenmiyor, LOTO gibi kritik prosedÃ¼rlerin atlanmasÄ± tespit edilip dÃ¼zeltilmiyor, gÃ¼vensiz davranÄ±ÅŸlar normalleÅŸiyor"
    },
    {
      "code": "D1.3",
      "standard_title_tr": "Hesap verebilirlik eksikliÄŸi",
      "category_type": "ORGANÄ°ZASYONEL",
      "cause_tr": "LOTO prosedÃ¼rÃ¼ ihlallerinde hesap verebilirlik sisteminin olmamasÄ±",
      "explanation_tr": "GÃ¼venlik prosedÃ¼rlerine uyumsuzluk gÃ¶steren Ã§alÄ±ÅŸanlar iÃ§in net hesap verebilirlik mekanizmasÄ± oluÅŸturulmamÄ±ÅŸ, prosedÃ¼r ihlalleri tespit edilse bile dÃ¼zeltici Ã¶nlem alÄ±nmamÄ±ÅŸ ve bu durum gÃ¼venli olmayan davranÄ±ÅŸlarÄ±n normalleÅŸmesine yol aÃ§mÄ±ÅŸtÄ±r"
    }
  ],
  "analysis_method": "HSG245 Hierarchical 5-Why (A/B â†’ C/D)",
  "final_report_tr": "================================================================================\nKÃ–K NEDEN ANALÄ°ZÄ° RAPORU (HSG245 - 5 Why Metodolojisi)\n================================================================================\n\nOLAY: \nOLAY RAPORU - ELEKTRÄ°K Ã‡ARPMASI\n\nTarih: 20 Åubat 2026, Saat: 15:20\nLokasyon: Ãœretim Tesisi - Ana Elektrik Panosu (MDB-02)\nRapor Eden: Elektrik BakÄ±m Sorumlusu - Ä°brahim AydÄ±n\n\nOLAY AÃ‡IKLAMASI:\nBakÄ±m . Olay Tipi: Accident\n\n--------------------------------------------------------------------------------\n\nâš¡ DAL 1: DAVRANIÅSAL\n\nğŸ“Œ DoÄŸrudan Neden [A3.2] Gerekli KKD/koruyucu yÃ¶ntemlerin kullanÄ±lmamasÄ±:\n   Elektrik teknisyeni yÃ¼ksek voltaj Ã§alÄ±ÅŸmasÄ± iÃ§in zorunlu olan yalÄ±tkan eldiven kullanmadÄ±\n   KanÄ±t: Olay raporunda 'BakÄ±m teknisyeni elektrik Ã§alÄ±ÅŸmasÄ± sÄ±rasÄ±nda uygun koruyucu ekipman kullanmadÄ±' bilgisi yer almaktadÄ±r.\n\nâ“ Neden 1? Neden elektrik teknisyeni yalÄ±tkan eldiven kullanmadÄ±?\n   â†’ Eldivenler Ã§alÄ±ÅŸma alanÄ±nda hazÄ±r bulunmuyordu ve teknisyen iÅŸi hÄ±zlÄ± bitirmek iÃ§in eldivensiz devam etti\nâ“ Neden 2? Neden eldivenler Ã§alÄ±ÅŸma alanÄ±nda hazÄ±r bulunmuyordu?\n   â†’ KKE'ler merkezi depoda tutuluyordu ve her iÅŸ Ã¶ncesi alÄ±nmasÄ± gerekiyordu, ancak bu kontrol yapÄ±lmÄ±yordu\nâ“ Neden 3? Neden iÅŸ Ã¶ncesi KKE kontrolÃ¼ yapÄ±lmÄ±yordu?\n   â†’ Elektrik Ã§alÄ±ÅŸmalarÄ± iÃ§in iÅŸ izin sistemi uygulanmÄ±yordu ve KKE kontrol listesi zorunlu tutulmuyordu\nâ“ Neden 4? Neden elektrik Ã§alÄ±ÅŸmalarÄ± iÃ§in iÅŸ izin sistemi uygulanmÄ±yordu?\n   â†’ YÃ¼ksek voltaj Ã§alÄ±ÅŸmalarÄ± iÃ§in Ã¶zel iÅŸ izin prosedÃ¼rÃ¼ tanÄ±mlanmamÄ±ÅŸ ve mevcut sistem sadece sÄ±cak iÅŸleri kapsÄ±yordu\nâ“ Neden 5? Neden yÃ¼ksek voltaj iÃ§in Ã¶zel iÅŸ izin prosedÃ¼rÃ¼ tanÄ±mlanmamÄ±ÅŸtÄ±?\n   â†’ Risk deÄŸerlendirmesi yapÄ±lÄ±rken elektrik Ã§alÄ±ÅŸmalarÄ±nÄ±n kritik kontrol gereksinimleri belirlenmemiÅŸ ve iÅŸ izin sistemine entegre edilmemiÅŸti\n\nğŸ¯ KÃ–K NEDEN [D4.4] Ä°ÅŸ izin sisteminin etkisiz olmasÄ± - ORGANÄ°ZASYONEL:\n   Elektrik Ã§alÄ±ÅŸmalarÄ± iÃ§in iÅŸ izin sisteminin tanÄ±mlanmamasÄ± ve KKE kontrollerinin zorunlu tutulmamasÄ±\n   YÃ¼ksek voltaj Ã§alÄ±ÅŸmalarÄ± iÃ§in Ã¶zel iÅŸ izin prosedÃ¼rÃ¼ oluÅŸturulmamÄ±ÅŸ, risk kontrolleri (KKE kullanÄ±mÄ±, enerji izolasyonu vb.) iÅŸ izin sistemine entegre edilmemiÅŸ ve bu nedenle kritik gÃ¼venlik Ã¶nlemleri atlanabilir hale gelmiÅŸtir\n\n--------------------------------------------------------------------------------\n\nâš¡ DAL 2: KOÅULLAR\n\nğŸ“Œ DoÄŸrudan Neden [B3.2] Elektrik enerjisi (enerjili sistemler):\n   Ana elektrik panosu (MDB-02) enerjili durumdayken mÃ¼dahale edildi\n   KanÄ±t: Lokasyon 'Ana Elektrik Panosu (MDB-02)' olarak belirtilmiÅŸ ve elektrik Ã§arpmasÄ± meydana gelmiÅŸtir.\n\nâ“ Neden 1? Neden ana elektrik panosu enerjili durumdayken mÃ¼dahale edildi?\n   â†’ Enerji izolasyonu (LOTO) prosedÃ¼rÃ¼ uygulanmadÄ±, elektrikli bakÄ±m yapÄ±ldÄ±\nâ“ Neden 2? Neden enerji izolasyonu prosedÃ¼rÃ¼ uygulanmadÄ±?\n   â†’ BakÄ±m teknisyeni LOTO prosedÃ¼rÃ¼nÃ¼ biliyordu ancak zaman kazanmak iÃ§in atladÄ±\nâ“ Neden 3? Neden prosedÃ¼rÃ¼ atlama davranÄ±ÅŸÄ± gerÃ§ekleÅŸti?\n   â†’ Daha Ã¶nce de benzer ÅŸekilde kÄ±sa yoldan yapÄ±lan iÅŸlerde kaza olmamÄ±ÅŸ, bu davranÄ±ÅŸ dÃ¼zeltilmemiÅŸ\nâ“ Neden 4? Neden gÃ¼vensiz davranÄ±ÅŸ dÃ¼zeltilmedi veya Ã¶nlenmedi?\n   â†’ Sahada yeterli gÃ¶zetim yapÄ±lmÄ±yor, prosedÃ¼r ihlalleri tespit edilmiyor ve mÃ¼dahale edilmiyor\nâ“ Neden 5? Neden prosedÃ¼r ihlalleri tespit edilip dÃ¼zeltilmiyor?\n   â†’ YÃ¶netim ve gÃ¶zetim sistemi zayÄ±f, saha denetimi yetersiz, sapmalara mÃ¼dahale edilmiyor\n\nğŸ¯ KÃ–K NEDEN [D1.2] Yetersiz gÃ¶zetim veya denetim - ORGANÄ°ZASYONEL:\n   Elektrik bakÄ±m Ã§alÄ±ÅŸmalarÄ±nda yetersiz gÃ¶zetim ve prosedÃ¼r ihlallerinin tespit edilememesi\n   BakÄ±m teknisyenlerinin saha Ã§alÄ±ÅŸmalarÄ± yeterince denetlenmiyor, LOTO gibi kritik prosedÃ¼rlerin atlanmasÄ± tespit edilip dÃ¼zeltilmiyor, gÃ¼vensiz davranÄ±ÅŸlar normalleÅŸiyor\n\n--------------------------------------------------------------------------------\n\nâš¡ DAL 3: DAVRANIÅSAL\n\nğŸ“Œ DoÄŸrudan Neden [A1.1] Bireysel kural/prosedÃ¼r ihlali:\n   Teknisyen LOTO (Lock Out Tag Out) prosedÃ¼rÃ¼nÃ¼ uygulamadan enerjili panoya mÃ¼dahale etti\n   KanÄ±t: Elektrik BakÄ±m Sorumlusu tarafÄ±ndan rapor edilmiÅŸ olup, bakÄ±m Ã§alÄ±ÅŸmasÄ± sÄ±rasÄ±nda elektrik Ã§arpmasÄ± meydana gelmiÅŸtir.\n\nâ“ Neden 1? Neden teknisyen LOTO prosedÃ¼rÃ¼nÃ¼ uygulamadÄ±?\n   â†’ Teknisyen iÅŸin acil olduÄŸunu dÃ¼ÅŸÃ¼ndÃ¼ ve LOTO uygulamanÄ±n zaman kaybÄ± olacaÄŸÄ±nÄ± varsaydÄ±\nâ“ Neden 2? Neden teknisyen LOTO prosedÃ¼rÃ¼nÃ¼ atlamanÄ±n kabul edilebilir olduÄŸunu dÃ¼ÅŸÃ¼ndÃ¼?\n   â†’ Daha Ã¶nce benzer durumlarda LOTO uygulanmadan yapÄ±lan mÃ¼dahalelerde herhangi bir uyarÄ± veya dÃ¼zeltme yapÄ±lmamÄ±ÅŸtÄ±\nâ“ Neden 3? Neden prosedÃ¼r ihlalleri tespit edilip dÃ¼zeltilmedi?\n   â†’ Elektrik bakÄ±m Ã§alÄ±ÅŸmalarÄ± sÄ±rasÄ±nda yeterli gÃ¶zetim ve denetim yapÄ±lmÄ±yordu\nâ“ Neden 4? Neden elektrik bakÄ±m Ã§alÄ±ÅŸmalarÄ±nda gÃ¶zetim ve denetim yetersizdi?\n   â†’ BakÄ±m sorumlularÄ± Ã§ok sayÄ±da iÅŸten sorumluydu ve saha denetimi iÃ§in yeterli zaman ayÄ±ramÄ±yordu\nâ“ Neden 5? Neden prosedÃ¼r ihlalleri ve gÃ¼venli olmayan davranÄ±ÅŸlar dÃ¼zeltilmedi ve hesap sorulmadÄ±?\n   â†’ YÃ¶netim tarafÄ±ndan gÃ¼venlik kurallarÄ±na uyumsuzluklar iÃ§in net hesap verebilirlik sistemi oluÅŸturulmamÄ±ÅŸ ve uygulanmamÄ±ÅŸtÄ±\n\nğŸ¯ KÃ–K NEDEN [D1.3] Hesap verebilirlik eksikliÄŸi - ORGANÄ°ZASYONEL:\n   LOTO prosedÃ¼rÃ¼ ihlallerinde hesap verebilirlik sisteminin olmamasÄ±\n   GÃ¼venlik prosedÃ¼rlerine uyumsuzluk gÃ¶steren Ã§alÄ±ÅŸanlar iÃ§in net hesap verebilirlik mekanizmasÄ± oluÅŸturulmamÄ±ÅŸ, prosedÃ¼r ihlalleri tespit edilse bile dÃ¼zeltici Ã¶nlem alÄ±nmamÄ±ÅŸ ve bu durum gÃ¼venli olmayan davranÄ±ÅŸlarÄ±n normalleÅŸmesine yol aÃ§mÄ±ÅŸtÄ±r\n\n--------------------------------------------------------------------------------"
}