{
  "incident_summary": "\nOLAY RAPORU - ELEKTRÄ°K Ã‡ARPMASI\n\nTarih: 20 Åubat 2026, Saat: 15:20\nLokasyon: Ãœretim Tesisi - Ana Elektrik Panosu (MDB-02)\nRapor Eden: Elektrik BakÄ±m Sorumlusu - Ä°brahim AydÄ±n\n\nOLAY AÃ‡IKLAMASI:\nBakÄ±m . Olay Tipi: Accident",
  "analysis_branches": [
    {
      "branch_number": 1,
      "immediate_cause": {
        "code": "A3.2",
        "standard_title_tr": "Gerekli KKD/koruyucu yÃ¶ntemlerin kullanÄ±lmamasÄ±",
        "category_type": "DAVRANIÅSAL",
        "cause_tr": "Elektrik teknisyeni elektrik yalÄ±tkan eldiven kullanmadan enerjili panoda Ã§alÄ±ÅŸtÄ±",
        "evidence_tr": "Olay Ã¶zetinde 'BakÄ±m' ifadesi geÃ§mekte ancak elektrik Ã§arpmasÄ± meydana gelmiÅŸtir, bu da uygun KKD kullanÄ±lmadÄ±ÄŸÄ±nÄ± gÃ¶stermektedir."
      },
      "why_chain": [
        {
          "level": 1,
          "question_tr": "Neden elektrik teknisyeni yalÄ±tkan eldiven kullanmadÄ±?",
          "answer_tr": "Teknisyen, kÄ±sa sÃ¼reli bir iÅŸlem olduÄŸu iÃ§in eldiven kullanmaya gerek gÃ¶rmedi"
        },
        {
          "level": 2,
          "question_tr": "Neden kÄ±sa sÃ¼reli iÅŸlemlerde bile KKE kullanÄ±mÄ±nÄ±n zorunlu olduÄŸunu bilmiyordu veya Ã¶nemsemedi?",
          "answer_tr": "Enerjili ekipman Ã¼zerinde Ã§alÄ±ÅŸÄ±rken KKE kullanÄ±mÄ± konusunda yeterli eÄŸitim almamÄ±ÅŸ ve bu davranÄ±ÅŸ denetlenmemiÅŸti"
        },
        {
          "level": 3,
          "question_tr": "Neden enerjili ekipman Ã§alÄ±ÅŸmalarÄ± iÃ§in yeterli eÄŸitim verilmemiÅŸti?",
          "answer_tr": "Elektrik iÅŸleri iÃ§in Ã¶zel eÄŸitim programÄ± oluÅŸturulmamÄ±ÅŸ, sadece genel Ä°SG eÄŸitimi verilmiÅŸti"
        },
        {
          "level": 4,
          "question_tr": "Neden elektrik iÅŸlerine Ã¶zel eÄŸitim programÄ± oluÅŸturulmamÄ±ÅŸtÄ±?",
          "answer_tr": "GÃ¶rev bazlÄ± eÄŸitim ihtiyaÃ§ analizi yapÄ±lmamÄ±ÅŸ, hangi pozisyonlarÄ±n hangi Ã¶zel eÄŸitimlere ihtiyacÄ± olduÄŸu belirlenmemiÅŸti"
        }
      ],
      "root_cause": {
        "code": "D3.2",
        "standard_title_tr": "EÄŸitim ihtiyaÃ§larÄ±nÄ±n belirlenmemesi",
        "category_type": "ORGANÄ°ZASYONEL",
        "cause_tr": "Elektrik teknisyenleri iÃ§in gÃ¶rev bazlÄ± eÄŸitim ihtiyaÃ§ analizi yapÄ±lmamÄ±ÅŸ olmasÄ±",
        "explanation_tr": "Enerjili ekipman Ã¼zerinde Ã§alÄ±ÅŸacak personelin Ã¶zel eÄŸitim gereksinimleri sistematik olarak belirlenmemiÅŸ, sadece genel Ä°SG eÄŸitimleri ile yetinilmiÅŸtir. GÃ¶rev bazlÄ± risk analizi ve buna baÄŸlÄ± eÄŸitim matrisi oluÅŸturulmamÄ±ÅŸtÄ±r."
      }
    },
    {
      "branch_number": 2,
      "immediate_cause": {
        "code": "B3.2",
        "standard_title_tr": "Elektrik enerjisi (enerjili sistemler)",
        "category_type": "KOÅULSAL",
        "cause_tr": "Ana elektrik panosu (MDB-02) enerjili durumdayken mÃ¼dahale edildi",
        "evidence_tr": "Lokasyon 'Ana Elektrik Panosu (MDB-02)' olarak belirtilmiÅŸ ve elektrik Ã§arpmasÄ± meydana gelmiÅŸtir."
      },
      "why_chain": [
        {
          "level": 1,
          "question_tr": "Neden ana elektrik panosu enerjili durumdayken mÃ¼dahale edildi?",
          "answer_tr": "Elektrik teknisyeni panoya mÃ¼dahale etmeden Ã¶nce enerji izolasyonu (LOTO) prosedÃ¼rÃ¼nÃ¼ uygulamadÄ±"
        },
        {
          "level": 2,
          "question_tr": "Neden enerji izolasyonu (LOTO) prosedÃ¼rÃ¼ uygulanmadÄ±?",
          "answer_tr": "Teknisyen acil arÄ±za giderme sÄ±rasÄ±nda LOTO prosedÃ¼rÃ¼nÃ¼ atladÄ±, Ã§Ã¼nkÃ¼ iÅŸin hÄ±zlÄ± yapÄ±lmasÄ± gerektiÄŸini dÃ¼ÅŸÃ¼ndÃ¼"
        },
        {
          "level": 3,
          "question_tr": "Neden teknisyen prosedÃ¼rÃ¼ atlayarak hÄ±zlÄ± iÅŸ yapma ihtiyacÄ± hissetti?",
          "answer_tr": "Ãœretim hattÄ± durmuÅŸtu ve Ã¼retim baskÄ±sÄ± nedeniyle arÄ±zanÄ±n en kÄ±sa sÃ¼rede giderilmesi isteniyordu"
        },
        {
          "level": 4,
          "question_tr": "Neden Ã¼retim baskÄ±sÄ± gÃ¼venlik prosedÃ¼rlerinin atlanmasÄ±na neden oldu?",
          "answer_tr": "LOTO prosedÃ¼rÃ¼nÃ¼n atlanmasÄ± veya kÄ±saltÄ±lmasÄ± daha Ã¶nce de olmuÅŸ ve yÃ¶netim tarafÄ±ndan mÃ¼dahale edilmemiÅŸti"
        },
        {
          "level": 5,
          "question_tr": "Neden yÃ¶netim prosedÃ¼r ihlallerine mÃ¼dahale etmedi?",
          "answer_tr": "Enerji izolasyonu (LOTO) sisteminin etkinliÄŸi dÃ¼zenli olarak denetlenmiyordu ve sapmalara tolerans gÃ¶steriliyordu"
        }
      ],
      "root_cause": {
        "code": "D4.5",
        "standard_title_tr": "Enerji izolasyonunun (LOTO) etkisiz olmasÄ±",
        "category_type": "ORGANÄ°ZASYONEL",
        "cause_tr": "LOTO Sisteminin Etkisiz UygulanmasÄ± ve Denetlenmemesi",
        "explanation_tr": "Enerji izolasyonu (LOTO) prosedÃ¼rÃ¼ dÃ¼zenli olarak denetlenmiyor, prosedÃ¼r ihlalleri tespit edilmiyor ve Ã¼retim baskÄ±sÄ± altÄ±nda LOTO atlanmasÄ±na tolerans gÃ¶steriliyor. Sistem etkinliÄŸinin izlenmemesi ve sapmalarÄ±n normalleÅŸmesi nedeniyle enerjili ekipmana gÃ¼vensiz mÃ¼dahale yapÄ±lÄ±yor."
      }
    },
    {
      "branch_number": 3,
      "immediate_cause": {
        "code": "A1.1",
        "standard_title_tr": "Bireysel kural/prosedÃ¼r ihlali",
        "category_type": "DAVRANIÅSAL",
        "cause_tr": "Elektrik BakÄ±m Sorumlusu LOTO (Kilitleme/Etiketleme) prosedÃ¼rÃ¼nÃ¼ uygulamadan Ã§alÄ±ÅŸmaya baÅŸladÄ±",
        "evidence_tr": "Elektrik Ã§arpmasÄ± olayÄ±nÄ±n gerÃ§ekleÅŸmesi, enerjili sistemde gÃ¼venli Ã§alÄ±ÅŸma prosedÃ¼rlerinin ihlal edildiÄŸini gÃ¶stermektedir."
      },
      "why_chain": [
        {
          "level": 1,
          "question_tr": "Neden LOTO prosedÃ¼rÃ¼ uygulanmadan Ã§alÄ±ÅŸmaya baÅŸlandÄ±?",
          "answer_tr": "Elektrik BakÄ±m Sorumlusu prosedÃ¼rÃ¼ biliyordu ancak zaman kazanmak iÃ§in atladÄ±"
        },
        {
          "level": 2,
          "question_tr": "Neden prosedÃ¼rÃ¼ atlayarak zaman kazanmaya Ã§alÄ±ÅŸtÄ±?",
          "answer_tr": "Ãœretim baskÄ±sÄ± vardÄ± ve arÄ±zanÄ±n hÄ±zlÄ± giderilmesi isteniyordu"
        },
        {
          "level": 3,
          "question_tr": "Neden Ã¼retim baskÄ±sÄ± gÃ¼venlik prosedÃ¼rÃ¼nÃ¼n Ã¶nÃ¼ne geÃ§ti?",
          "answer_tr": "YÃ¶netim arÄ±zalarda hÄ±zlÄ± mÃ¼dahaleyi Ã¶dÃ¼llendiriyor, prosedÃ¼r ihlallerini gÃ¶rmezden geliyordu"
        },
        {
          "level": 4,
          "question_tr": "Neden prosedÃ¼r ihlalleri gÃ¶rmezden geliniyor ve dÃ¼zeltilmiyordu?",
          "answer_tr": "Denetim ve gÃ¶zetim yetersizdi, sapmalara mÃ¼dahale edilmiyordu"
        }
      ],
      "root_cause": {
        "code": "D1.4",
        "standard_title_tr": "Ãœretim baskÄ±sÄ±nÄ±n gÃ¼venliÄŸin Ã¶nÃ¼ne geÃ§mesi",
        "category_type": "ORGANÄ°ZASYONEL",
        "cause_tr": "Ãœretim SÃ¼rekliliÄŸi Ã–nceliÄŸinin GÃ¼venlik ProsedÃ¼rlerinin Ã–nÃ¼ne GeÃ§mesi",
        "explanation_tr": "YÃ¶netim Ã¼retim duruÅŸlarÄ±nÄ± minimize etmeyi Ã¶nceliklendirdiÄŸi iÃ§in, Ã§alÄ±ÅŸanlar LOTO gibi kritik gÃ¼venlik prosedÃ¼rlerini atlayarak hÄ±zlÄ± mÃ¼dahale etme baskÄ±sÄ± hissediyor. ProsedÃ¼r ihlalleri tespit edilse bile dÃ¼zeltici Ã¶nlem alÄ±nmÄ±yor, bu da sapmalarÄ±n normalleÅŸmesine yol aÃ§Ä±yor."
      }
    }
  ],
  "final_root_causes": [
    {
      "code": "D3.2",
      "standard_title_tr": "EÄŸitim ihtiyaÃ§larÄ±nÄ±n belirlenmemesi",
      "category_type": "ORGANÄ°ZASYONEL",
      "cause_tr": "Elektrik teknisyenleri iÃ§in gÃ¶rev bazlÄ± eÄŸitim ihtiyaÃ§ analizi yapÄ±lmamÄ±ÅŸ olmasÄ±",
      "explanation_tr": "Enerjili ekipman Ã¼zerinde Ã§alÄ±ÅŸacak personelin Ã¶zel eÄŸitim gereksinimleri sistematik olarak belirlenmemiÅŸ, sadece genel Ä°SG eÄŸitimleri ile yetinilmiÅŸtir. GÃ¶rev bazlÄ± risk analizi ve buna baÄŸlÄ± eÄŸitim matrisi oluÅŸturulmamÄ±ÅŸtÄ±r."
    },
    {
      "code": "D4.5",
      "standard_title_tr": "Enerji izolasyonunun (LOTO) etkisiz olmasÄ±",
      "category_type": "ORGANÄ°ZASYONEL",
      "cause_tr": "LOTO Sisteminin Etkisiz UygulanmasÄ± ve Denetlenmemesi",
      "explanation_tr": "Enerji izolasyonu (LOTO) prosedÃ¼rÃ¼ dÃ¼zenli olarak denetlenmiyor, prosedÃ¼r ihlalleri tespit edilmiyor ve Ã¼retim baskÄ±sÄ± altÄ±nda LOTO atlanmasÄ±na tolerans gÃ¶steriliyor. Sistem etkinliÄŸinin izlenmemesi ve sapmalarÄ±n normalleÅŸmesi nedeniyle enerjili ekipmana gÃ¼vensiz mÃ¼dahale yapÄ±lÄ±yor."
    },
    {
      "code": "D1.4",
      "standard_title_tr": "Ãœretim baskÄ±sÄ±nÄ±n gÃ¼venliÄŸin Ã¶nÃ¼ne geÃ§mesi",
      "category_type": "ORGANÄ°ZASYONEL",
      "cause_tr": "Ãœretim SÃ¼rekliliÄŸi Ã–nceliÄŸinin GÃ¼venlik ProsedÃ¼rlerinin Ã–nÃ¼ne GeÃ§mesi",
      "explanation_tr": "YÃ¶netim Ã¼retim duruÅŸlarÄ±nÄ± minimize etmeyi Ã¶nceliklendirdiÄŸi iÃ§in, Ã§alÄ±ÅŸanlar LOTO gibi kritik gÃ¼venlik prosedÃ¼rlerini atlayarak hÄ±zlÄ± mÃ¼dahale etme baskÄ±sÄ± hissediyor. ProsedÃ¼r ihlalleri tespit edilse bile dÃ¼zeltici Ã¶nlem alÄ±nmÄ±yor, bu da sapmalarÄ±n normalleÅŸmesine yol aÃ§Ä±yor."
    }
  ],
  "analysis_method": "HSG245 Hierarchical 5-Why (A/B â†’ C/D)",
  "final_report_tr": "================================================================================\nKÃ–K NEDEN ANALÄ°ZÄ° RAPORU (HSG245 - 5 Why Metodolojisi)\n================================================================================\n\nOLAY: \nOLAY RAPORU - ELEKTRÄ°K Ã‡ARPMASI\n\nTarih: 20 Åubat 2026, Saat: 15:20\nLokasyon: Ãœretim Tesisi - Ana Elektrik Panosu (MDB-02)\nRapor Eden: Elektrik BakÄ±m Sorumlusu - Ä°brahim AydÄ±n\n\nOLAY AÃ‡IKLAMASI:\nBakÄ±m . Olay Tipi: Accident\n\n--------------------------------------------------------------------------------\n\nâš¡ DAL 1: DAVRANIÅSAL\n\nğŸ“Œ DoÄŸrudan Neden [A3.2] Gerekli KKD/koruyucu yÃ¶ntemlerin kullanÄ±lmamasÄ±:\n   Elektrik teknisyeni elektrik yalÄ±tkan eldiven kullanmadan enerjili panoda Ã§alÄ±ÅŸtÄ±\n   KanÄ±t: Olay Ã¶zetinde 'BakÄ±m' ifadesi geÃ§mekte ancak elektrik Ã§arpmasÄ± meydana gelmiÅŸtir, bu da uygun KKD kullanÄ±lmadÄ±ÄŸÄ±nÄ± gÃ¶stermektedir.\n\nâ“ Neden 1? Neden elektrik teknisyeni yalÄ±tkan eldiven kullanmadÄ±?\n   â†’ Teknisyen, kÄ±sa sÃ¼reli bir iÅŸlem olduÄŸu iÃ§in eldiven kullanmaya gerek gÃ¶rmedi\nâ“ Neden 2? Neden kÄ±sa sÃ¼reli iÅŸlemlerde bile KKE kullanÄ±mÄ±nÄ±n zorunlu olduÄŸunu bilmiyordu veya Ã¶nemsemedi?\n   â†’ Enerjili ekipman Ã¼zerinde Ã§alÄ±ÅŸÄ±rken KKE kullanÄ±mÄ± konusunda yeterli eÄŸitim almamÄ±ÅŸ ve bu davranÄ±ÅŸ denetlenmemiÅŸti\nâ“ Neden 3? Neden enerjili ekipman Ã§alÄ±ÅŸmalarÄ± iÃ§in yeterli eÄŸitim verilmemiÅŸti?\n   â†’ Elektrik iÅŸleri iÃ§in Ã¶zel eÄŸitim programÄ± oluÅŸturulmamÄ±ÅŸ, sadece genel Ä°SG eÄŸitimi verilmiÅŸti\nâ“ Neden 4? Neden elektrik iÅŸlerine Ã¶zel eÄŸitim programÄ± oluÅŸturulmamÄ±ÅŸtÄ±?\n   â†’ GÃ¶rev bazlÄ± eÄŸitim ihtiyaÃ§ analizi yapÄ±lmamÄ±ÅŸ, hangi pozisyonlarÄ±n hangi Ã¶zel eÄŸitimlere ihtiyacÄ± olduÄŸu belirlenmemiÅŸti\n\nğŸ¯ KÃ–K NEDEN [D3.2] EÄŸitim ihtiyaÃ§larÄ±nÄ±n belirlenmemesi - ORGANÄ°ZASYONEL:\n   Elektrik teknisyenleri iÃ§in gÃ¶rev bazlÄ± eÄŸitim ihtiyaÃ§ analizi yapÄ±lmamÄ±ÅŸ olmasÄ±\n   Enerjili ekipman Ã¼zerinde Ã§alÄ±ÅŸacak personelin Ã¶zel eÄŸitim gereksinimleri sistematik olarak belirlenmemiÅŸ, sadece genel Ä°SG eÄŸitimleri ile yetinilmiÅŸtir. GÃ¶rev bazlÄ± risk analizi ve buna baÄŸlÄ± eÄŸitim matrisi oluÅŸturulmamÄ±ÅŸtÄ±r.\n\n--------------------------------------------------------------------------------\n\nâš¡ DAL 2: KOÅULSAL\n\nğŸ“Œ DoÄŸrudan Neden [B3.2] Elektrik enerjisi (enerjili sistemler):\n   Ana elektrik panosu (MDB-02) enerjili durumdayken mÃ¼dahale edildi\n   KanÄ±t: Lokasyon 'Ana Elektrik Panosu (MDB-02)' olarak belirtilmiÅŸ ve elektrik Ã§arpmasÄ± meydana gelmiÅŸtir.\n\nâ“ Neden 1? Neden ana elektrik panosu enerjili durumdayken mÃ¼dahale edildi?\n   â†’ Elektrik teknisyeni panoya mÃ¼dahale etmeden Ã¶nce enerji izolasyonu (LOTO) prosedÃ¼rÃ¼nÃ¼ uygulamadÄ±\nâ“ Neden 2? Neden enerji izolasyonu (LOTO) prosedÃ¼rÃ¼ uygulanmadÄ±?\n   â†’ Teknisyen acil arÄ±za giderme sÄ±rasÄ±nda LOTO prosedÃ¼rÃ¼nÃ¼ atladÄ±, Ã§Ã¼nkÃ¼ iÅŸin hÄ±zlÄ± yapÄ±lmasÄ± gerektiÄŸini dÃ¼ÅŸÃ¼ndÃ¼\nâ“ Neden 3? Neden teknisyen prosedÃ¼rÃ¼ atlayarak hÄ±zlÄ± iÅŸ yapma ihtiyacÄ± hissetti?\n   â†’ Ãœretim hattÄ± durmuÅŸtu ve Ã¼retim baskÄ±sÄ± nedeniyle arÄ±zanÄ±n en kÄ±sa sÃ¼rede giderilmesi isteniyordu\nâ“ Neden 4? Neden Ã¼retim baskÄ±sÄ± gÃ¼venlik prosedÃ¼rlerinin atlanmasÄ±na neden oldu?\n   â†’ LOTO prosedÃ¼rÃ¼nÃ¼n atlanmasÄ± veya kÄ±saltÄ±lmasÄ± daha Ã¶nce de olmuÅŸ ve yÃ¶netim tarafÄ±ndan mÃ¼dahale edilmemiÅŸti\nâ“ Neden 5? Neden yÃ¶netim prosedÃ¼r ihlallerine mÃ¼dahale etmedi?\n   â†’ Enerji izolasyonu (LOTO) sisteminin etkinliÄŸi dÃ¼zenli olarak denetlenmiyordu ve sapmalara tolerans gÃ¶steriliyordu\n\nğŸ¯ KÃ–K NEDEN [D4.5] Enerji izolasyonunun (LOTO) etkisiz olmasÄ± - ORGANÄ°ZASYONEL:\n   LOTO Sisteminin Etkisiz UygulanmasÄ± ve Denetlenmemesi\n   Enerji izolasyonu (LOTO) prosedÃ¼rÃ¼ dÃ¼zenli olarak denetlenmiyor, prosedÃ¼r ihlalleri tespit edilmiyor ve Ã¼retim baskÄ±sÄ± altÄ±nda LOTO atlanmasÄ±na tolerans gÃ¶steriliyor. Sistem etkinliÄŸinin izlenmemesi ve sapmalarÄ±n normalleÅŸmesi nedeniyle enerjili ekipmana gÃ¼vensiz mÃ¼dahale yapÄ±lÄ±yor.\n\n--------------------------------------------------------------------------------\n\nâš¡ DAL 3: DAVRANIÅSAL\n\nğŸ“Œ DoÄŸrudan Neden [A1.1] Bireysel kural/prosedÃ¼r ihlali:\n   Elektrik BakÄ±m Sorumlusu LOTO (Kilitleme/Etiketleme) prosedÃ¼rÃ¼nÃ¼ uygulamadan Ã§alÄ±ÅŸmaya baÅŸladÄ±\n   KanÄ±t: Elektrik Ã§arpmasÄ± olayÄ±nÄ±n gerÃ§ekleÅŸmesi, enerjili sistemde gÃ¼venli Ã§alÄ±ÅŸma prosedÃ¼rlerinin ihlal edildiÄŸini gÃ¶stermektedir.\n\nâ“ Neden 1? Neden LOTO prosedÃ¼rÃ¼ uygulanmadan Ã§alÄ±ÅŸmaya baÅŸlandÄ±?\n   â†’ Elektrik BakÄ±m Sorumlusu prosedÃ¼rÃ¼ biliyordu ancak zaman kazanmak iÃ§in atladÄ±\nâ“ Neden 2? Neden prosedÃ¼rÃ¼ atlayarak zaman kazanmaya Ã§alÄ±ÅŸtÄ±?\n   â†’ Ãœretim baskÄ±sÄ± vardÄ± ve arÄ±zanÄ±n hÄ±zlÄ± giderilmesi isteniyordu\nâ“ Neden 3? Neden Ã¼retim baskÄ±sÄ± gÃ¼venlik prosedÃ¼rÃ¼nÃ¼n Ã¶nÃ¼ne geÃ§ti?\n   â†’ YÃ¶netim arÄ±zalarda hÄ±zlÄ± mÃ¼dahaleyi Ã¶dÃ¼llendiriyor, prosedÃ¼r ihlallerini gÃ¶rmezden geliyordu\nâ“ Neden 4? Neden prosedÃ¼r ihlalleri gÃ¶rmezden geliniyor ve dÃ¼zeltilmiyordu?\n   â†’ Denetim ve gÃ¶zetim yetersizdi, sapmalara mÃ¼dahale edilmiyordu\n\nğŸ¯ KÃ–K NEDEN [D1.4] Ãœretim baskÄ±sÄ±nÄ±n gÃ¼venliÄŸin Ã¶nÃ¼ne geÃ§mesi - ORGANÄ°ZASYONEL:\n   Ãœretim SÃ¼rekliliÄŸi Ã–nceliÄŸinin GÃ¼venlik ProsedÃ¼rlerinin Ã–nÃ¼ne GeÃ§mesi\n   YÃ¶netim Ã¼retim duruÅŸlarÄ±nÄ± minimize etmeyi Ã¶nceliklendirdiÄŸi iÃ§in, Ã§alÄ±ÅŸanlar LOTO gibi kritik gÃ¼venlik prosedÃ¼rlerini atlayarak hÄ±zlÄ± mÃ¼dahale etme baskÄ±sÄ± hissediyor. ProsedÃ¼r ihlalleri tespit edilse bile dÃ¼zeltici Ã¶nlem alÄ±nmÄ±yor, bu da sapmalarÄ±n normalleÅŸmesine yol aÃ§Ä±yor.\n\n--------------------------------------------------------------------------------"
}