{
  "incident_summary": "\nOLAY RAPORU - ELEKTRÄ°K Ã‡ARPMASI\n\nTarih: 20 Åubat 2026, Saat: 15:20\nLokasyon: Ãœretim Tesisi - Ana Elektrik Panosu (MDB-02)\nRapor Eden: Elektrik BakÄ±m Sorumlusu - Ä°brahim AydÄ±n\n\nOLAY AÃ‡IKLAMASI:\nBakÄ±m . Olay Tipi: Accident",
  "analysis_branches": [
    {
      "branch_number": 1,
      "immediate_cause": {
        "code": "A3.2",
        "standard_title_tr": "Gerekli KKD/koruyucu yÃ¶ntemlerin kullanÄ±lmamasÄ±",
        "category_type": "DAVRANIÅSAL",
        "cause_tr": "Elektrik teknisyeni elektrik yalÄ±tkan eldiven kullanmadan enerjili panoda Ã§alÄ±ÅŸtÄ±",
        "evidence_tr": "Olay Ã¶zetinde 'BakÄ±m' ifadesi geÃ§mekte ancak elektrik Ã§arpmasÄ± meydana gelmiÅŸtir, bu da uygun KKD kullanÄ±lmadÄ±ÄŸÄ±nÄ± gÃ¶stermektedir."
      },
      "why_chain": [
        {
          "level": 1,
          "question_tr": "Neden elektrik teknisyeni yalÄ±tkan eldiven kullanmadÄ±?",
          "answer_tr": "Teknisyen, kÄ±sa sÃ¼reli bir iÅŸlem olduÄŸu iÃ§in eldiven kullanÄ±mÄ±nÄ± atladÄ± ve bu davranÄ±ÅŸ daha Ã¶nce uyarÄ±lmamÄ±ÅŸtÄ±"
        },
        {
          "level": 2,
          "question_tr": "Neden bu gÃ¼vensiz davranÄ±ÅŸ daha Ã¶nce uyarÄ±lmadÄ± veya dÃ¼zeltilmedi?",
          "answer_tr": "Elektrik iÅŸlerinde gÃ¶zetim yetersizdi ve teknisyenler saha Ã§alÄ±ÅŸmalarÄ±nda yeterince denetlenmiyordu"
        },
        {
          "level": 3,
          "question_tr": "Neden elektrik iÅŸlerinde gÃ¶zetim ve denetim yetersizdi?",
          "answer_tr": "BakÄ±m ekibi liderinin saha denetimi iÃ§in sistematik bir planÄ± yoktu ve gÃ¼nlÃ¼k iÅŸlere odaklanÄ±yordu"
        },
        {
          "level": 4,
          "question_tr": "Neden saha denetimi iÃ§in sistematik bir plan yoktu?",
          "answer_tr": "YÃ¶netim, saha liderliÄŸi ve denetim iÃ§in net bir beklenti ve yapÄ± oluÅŸturmamÄ±ÅŸtÄ±, gÃ¶zetim sorumluluÄŸu belirsizdi"
        }
      ],
      "root_cause": {
        "code": "D1.2",
        "standard_title_tr": "Yetersiz gÃ¶zetim veya denetim",
        "category_type": "ORGANÄ°ZASYONEL",
        "cause_tr": "Elektrik Ã‡alÄ±ÅŸmalarÄ±nda Sistematik GÃ¶zetim ve Denetim EksikliÄŸi",
        "explanation_tr": "Elektrik teknisyenlerinin saha Ã§alÄ±ÅŸmalarÄ± dÃ¼zenli olarak denetlenmiyor, gÃ¼vensiz davranÄ±ÅŸlar tespit edilip dÃ¼zeltilmiyor. GÃ¶zetim sorumluluÄŸu ve saha denetim planÄ± tanÄ±mlanmamÄ±ÅŸ durumda."
      }
    },
    {
      "branch_number": 2,
      "immediate_cause": {
        "code": "B3.2",
        "standard_title_tr": "Elektrik enerjisi (enerjili sistemler)",
        "category_type": "KOÅULLAR",
        "cause_tr": "Ana elektrik panosunda (MDB-02) elektrik enerjisi mevcut durumdayken Ã§alÄ±ÅŸma yapÄ±ldÄ±",
        "evidence_tr": "Lokasyon 'Ana Elektrik Panosu (MDB-02)' olarak belirtilmiÅŸ ve elektrik Ã§arpmasÄ± meydana gelmiÅŸtir."
      },
      "why_chain": [
        {
          "level": 1,
          "question_tr": "Neden ana elektrik panosunda enerji mevcut durumdayken Ã§alÄ±ÅŸma yapÄ±ldÄ±?",
          "answer_tr": "Elektrik enerjisi kesilmeden ve LOTO (Kilitleme/Etiketleme) prosedÃ¼rÃ¼ uygulanmadan Ã§alÄ±ÅŸmaya baÅŸlandÄ±"
        },
        {
          "level": 2,
          "question_tr": "Neden LOTO prosedÃ¼rÃ¼ uygulanmadÄ±?",
          "answer_tr": "BakÄ±m personeli enerjili Ã§alÄ±ÅŸmanÄ±n risklerini tam olarak kavramadÄ± ve prosedÃ¼rÃ¼ atladÄ±"
        },
        {
          "level": 3,
          "question_tr": "Neden bakÄ±m personeli LOTO prosedÃ¼rÃ¼nÃ¼n kritik Ã¶nemini kavramadÄ±?",
          "answer_tr": "Elektrikli ekipmanlar Ã¼zerinde gÃ¼venli Ã§alÄ±ÅŸma ve enerji izolasyonu konusunda yeterli eÄŸitim almamÄ±ÅŸtÄ±"
        },
        {
          "level": 4,
          "question_tr": "Neden elektrikli ekipmanlar iÃ§in yeterli eÄŸitim verilmemiÅŸti?",
          "answer_tr": "Elektrik iÅŸlerinde Ã§alÄ±ÅŸacak personel iÃ§in Ã¶zel eÄŸitim programÄ± ve yetkinlik doÄŸrulama sistemi mevcut deÄŸildi"
        },
        {
          "level": 5,
          "question_tr": "Neden Ã¶zel eÄŸitim programÄ± ve yetkinlik doÄŸrulama sistemi yoktu?",
          "answer_tr": "Organizasyonda eÄŸitim ihtiyaÃ§ analizi yapÄ±lmÄ±yor, kritik gÃ¶revler iÃ§in yetkinlik gereksinimleri belirlenmemiÅŸ ve doÄŸrulanmÄ±yordu"
        }
      ],
      "root_cause": {
        "code": "D3.2",
        "standard_title_tr": "EÄŸitim ihtiyaÃ§larÄ±nÄ±n belirlenmemesi",
        "category_type": "ORGANÄ°ZASYONEL",
        "cause_tr": "Elektrik iÅŸleri iÃ§in eÄŸitim ihtiyaÃ§ analizi yapÄ±lmamasÄ± ve yetkinlik gereksinimlerinin belirlenmemesi",
        "explanation_tr": "Organizasyonda sistematik eÄŸitim ihtiyaÃ§ analizi yapÄ±lmadÄ±ÄŸÄ± iÃ§in elektrikli ekipmanlar Ã¼zerinde Ã§alÄ±ÅŸacak personelin hangi eÄŸitimlere ihtiyaÃ§ duyduÄŸu belirlenmemiÅŸ, LOTO ve enerjili Ã§alÄ±ÅŸma riskleri konusunda gerekli eÄŸitimler planlanmamÄ±ÅŸ ve verilmemiÅŸtir"
      }
    },
    {
      "branch_number": 3,
      "immediate_cause": {
        "code": "A1.1",
        "standard_title_tr": "Bireysel kural/prosedÃ¼r ihlali",
        "category_type": "DAVRANIÅSAL",
        "cause_tr": "Elektrik bakÄ±m teknisyeni LOTO (Kilitleme/Etiketleme) prosedÃ¼rÃ¼nÃ¼ uygulamadan enerjili sistemde Ã§alÄ±ÅŸtÄ±",
        "evidence_tr": "Elektrik Ã§arpmasÄ± meydana gelmesi, enerjinin izole edilmediÄŸini ve standart elektrik gÃ¼venlik prosedÃ¼rlerinin ihlal edildiÄŸini gÃ¶stermektedir."
      },
      "why_chain": [
        {
          "level": 1,
          "question_tr": "Neden elektrik bakÄ±m teknisyeni LOTO prosedÃ¼rÃ¼nÃ¼ uygulamadan enerjili sistemde Ã§alÄ±ÅŸtÄ±?",
          "answer_tr": "Teknisyen, iÅŸin kÄ±sa sÃ¼receÄŸini dÃ¼ÅŸÃ¼nerek LOTO prosedÃ¼rÃ¼nÃ¼ atladÄ± ve doÄŸrudan mÃ¼dahale etti"
        },
        {
          "level": 2,
          "question_tr": "Neden teknisyen LOTO prosedÃ¼rÃ¼nÃ¼ atlayabileceÄŸini dÃ¼ÅŸÃ¼ndÃ¼?",
          "answer_tr": "Daha Ã¶nce benzer kÄ±sa iÅŸlerde LOTO uygulanmadÄ±ÄŸÄ± ve bunun yÃ¶netim tarafÄ±ndan fark edilip dÃ¼zeltilmediÄŸi gÃ¶rÃ¼lmÃ¼ÅŸtÃ¼"
        },
        {
          "level": 3,
          "question_tr": "Neden yÃ¶netim bu prosedÃ¼r ihlallerini fark edip dÃ¼zeltmedi?",
          "answer_tr": "Saha denetimleri dÃ¼zenli yapÄ±lmÄ±yor, yapÄ±ldÄ±ÄŸÄ±nda da prosedÃ¼r uygulamalarÄ±na yeterince odaklanÄ±lmÄ±yordu"
        },
        {
          "level": 4,
          "question_tr": "Neden saha denetimleri yetersiz ve etkisiz yapÄ±lÄ±yordu?",
          "answer_tr": "GÃ¶zetim planÄ± yoktu, sorumluluklar net deÄŸildi ve prosedÃ¼r sapmalarÄ± iÃ§in hesap verebilirlik mekanizmasÄ± iÅŸlemiyordu"
        }
      ],
      "root_cause": {
        "code": "D1.2",
        "standard_title_tr": "Yetersiz gÃ¶zetim veya denetim",
        "category_type": "ORGANÄ°ZASYONEL",
        "cause_tr": "LOTO ProsedÃ¼rÃ¼ UygulamalarÄ±nÄ±n Yetersiz GÃ¶zetimi ve Denetimi",
        "explanation_tr": "Elektrik bakÄ±m Ã§alÄ±ÅŸmalarÄ±nda LOTO prosedÃ¼rÃ¼ uygulamalarÄ±nÄ±n dÃ¼zenli olarak denetlenmemesi, prosedÃ¼r ihlallerinin tespit edilmemesi ve dÃ¼zeltici Ã¶nlem alÄ±nmamasÄ± sonucu gÃ¼venlik kurallarÄ±nÄ±n atlanmasÄ± normalleÅŸmiÅŸtir"
      }
    }
  ],
  "final_root_causes": [
    {
      "code": "D1.2",
      "standard_title_tr": "Yetersiz gÃ¶zetim veya denetim",
      "category_type": "ORGANÄ°ZASYONEL",
      "cause_tr": "Elektrik Ã‡alÄ±ÅŸmalarÄ±nda Sistematik GÃ¶zetim ve Denetim EksikliÄŸi",
      "explanation_tr": "Elektrik teknisyenlerinin saha Ã§alÄ±ÅŸmalarÄ± dÃ¼zenli olarak denetlenmiyor, gÃ¼vensiz davranÄ±ÅŸlar tespit edilip dÃ¼zeltilmiyor. GÃ¶zetim sorumluluÄŸu ve saha denetim planÄ± tanÄ±mlanmamÄ±ÅŸ durumda."
    },
    {
      "code": "D3.2",
      "standard_title_tr": "EÄŸitim ihtiyaÃ§larÄ±nÄ±n belirlenmemesi",
      "category_type": "ORGANÄ°ZASYONEL",
      "cause_tr": "Elektrik iÅŸleri iÃ§in eÄŸitim ihtiyaÃ§ analizi yapÄ±lmamasÄ± ve yetkinlik gereksinimlerinin belirlenmemesi",
      "explanation_tr": "Organizasyonda sistematik eÄŸitim ihtiyaÃ§ analizi yapÄ±lmadÄ±ÄŸÄ± iÃ§in elektrikli ekipmanlar Ã¼zerinde Ã§alÄ±ÅŸacak personelin hangi eÄŸitimlere ihtiyaÃ§ duyduÄŸu belirlenmemiÅŸ, LOTO ve enerjili Ã§alÄ±ÅŸma riskleri konusunda gerekli eÄŸitimler planlanmamÄ±ÅŸ ve verilmemiÅŸtir"
    },
    {
      "code": "D1.2",
      "standard_title_tr": "Yetersiz gÃ¶zetim veya denetim",
      "category_type": "ORGANÄ°ZASYONEL",
      "cause_tr": "LOTO ProsedÃ¼rÃ¼ UygulamalarÄ±nÄ±n Yetersiz GÃ¶zetimi ve Denetimi",
      "explanation_tr": "Elektrik bakÄ±m Ã§alÄ±ÅŸmalarÄ±nda LOTO prosedÃ¼rÃ¼ uygulamalarÄ±nÄ±n dÃ¼zenli olarak denetlenmemesi, prosedÃ¼r ihlallerinin tespit edilmemesi ve dÃ¼zeltici Ã¶nlem alÄ±nmamasÄ± sonucu gÃ¼venlik kurallarÄ±nÄ±n atlanmasÄ± normalleÅŸmiÅŸtir"
    }
  ],
  "analysis_method": "HSG245 Hierarchical 5-Why (A/B â†’ C/D)",
  "final_report_tr": "================================================================================\nKÃ–K NEDEN ANALÄ°ZÄ° RAPORU (HSG245 - 5 Why Metodolojisi)\n================================================================================\n\nOLAY: \nOLAY RAPORU - ELEKTRÄ°K Ã‡ARPMASI\n\nTarih: 20 Åubat 2026, Saat: 15:20\nLokasyon: Ãœretim Tesisi - Ana Elektrik Panosu (MDB-02)\nRapor Eden: Elektrik BakÄ±m Sorumlusu - Ä°brahim AydÄ±n\n\nOLAY AÃ‡IKLAMASI:\nBakÄ±m . Olay Tipi: Accident\n\n--------------------------------------------------------------------------------\n\nâš¡ DAL 1: DAVRANIÅSAL\n\nğŸ“Œ DoÄŸrudan Neden [A3.2] Gerekli KKD/koruyucu yÃ¶ntemlerin kullanÄ±lmamasÄ±:\n   Elektrik teknisyeni elektrik yalÄ±tkan eldiven kullanmadan enerjili panoda Ã§alÄ±ÅŸtÄ±\n   KanÄ±t: Olay Ã¶zetinde 'BakÄ±m' ifadesi geÃ§mekte ancak elektrik Ã§arpmasÄ± meydana gelmiÅŸtir, bu da uygun KKD kullanÄ±lmadÄ±ÄŸÄ±nÄ± gÃ¶stermektedir.\n\nâ“ Neden 1? Neden elektrik teknisyeni yalÄ±tkan eldiven kullanmadÄ±?\n   â†’ Teknisyen, kÄ±sa sÃ¼reli bir iÅŸlem olduÄŸu iÃ§in eldiven kullanÄ±mÄ±nÄ± atladÄ± ve bu davranÄ±ÅŸ daha Ã¶nce uyarÄ±lmamÄ±ÅŸtÄ±\nâ“ Neden 2? Neden bu gÃ¼vensiz davranÄ±ÅŸ daha Ã¶nce uyarÄ±lmadÄ± veya dÃ¼zeltilmedi?\n   â†’ Elektrik iÅŸlerinde gÃ¶zetim yetersizdi ve teknisyenler saha Ã§alÄ±ÅŸmalarÄ±nda yeterince denetlenmiyordu\nâ“ Neden 3? Neden elektrik iÅŸlerinde gÃ¶zetim ve denetim yetersizdi?\n   â†’ BakÄ±m ekibi liderinin saha denetimi iÃ§in sistematik bir planÄ± yoktu ve gÃ¼nlÃ¼k iÅŸlere odaklanÄ±yordu\nâ“ Neden 4? Neden saha denetimi iÃ§in sistematik bir plan yoktu?\n   â†’ YÃ¶netim, saha liderliÄŸi ve denetim iÃ§in net bir beklenti ve yapÄ± oluÅŸturmamÄ±ÅŸtÄ±, gÃ¶zetim sorumluluÄŸu belirsizdi\n\nğŸ¯ KÃ–K NEDEN [D1.2] Yetersiz gÃ¶zetim veya denetim - ORGANÄ°ZASYONEL:\n   Elektrik Ã‡alÄ±ÅŸmalarÄ±nda Sistematik GÃ¶zetim ve Denetim EksikliÄŸi\n   Elektrik teknisyenlerinin saha Ã§alÄ±ÅŸmalarÄ± dÃ¼zenli olarak denetlenmiyor, gÃ¼vensiz davranÄ±ÅŸlar tespit edilip dÃ¼zeltilmiyor. GÃ¶zetim sorumluluÄŸu ve saha denetim planÄ± tanÄ±mlanmamÄ±ÅŸ durumda.\n\n--------------------------------------------------------------------------------\n\nâš¡ DAL 2: KOÅULLAR\n\nğŸ“Œ DoÄŸrudan Neden [B3.2] Elektrik enerjisi (enerjili sistemler):\n   Ana elektrik panosunda (MDB-02) elektrik enerjisi mevcut durumdayken Ã§alÄ±ÅŸma yapÄ±ldÄ±\n   KanÄ±t: Lokasyon 'Ana Elektrik Panosu (MDB-02)' olarak belirtilmiÅŸ ve elektrik Ã§arpmasÄ± meydana gelmiÅŸtir.\n\nâ“ Neden 1? Neden ana elektrik panosunda enerji mevcut durumdayken Ã§alÄ±ÅŸma yapÄ±ldÄ±?\n   â†’ Elektrik enerjisi kesilmeden ve LOTO (Kilitleme/Etiketleme) prosedÃ¼rÃ¼ uygulanmadan Ã§alÄ±ÅŸmaya baÅŸlandÄ±\nâ“ Neden 2? Neden LOTO prosedÃ¼rÃ¼ uygulanmadÄ±?\n   â†’ BakÄ±m personeli enerjili Ã§alÄ±ÅŸmanÄ±n risklerini tam olarak kavramadÄ± ve prosedÃ¼rÃ¼ atladÄ±\nâ“ Neden 3? Neden bakÄ±m personeli LOTO prosedÃ¼rÃ¼nÃ¼n kritik Ã¶nemini kavramadÄ±?\n   â†’ Elektrikli ekipmanlar Ã¼zerinde gÃ¼venli Ã§alÄ±ÅŸma ve enerji izolasyonu konusunda yeterli eÄŸitim almamÄ±ÅŸtÄ±\nâ“ Neden 4? Neden elektrikli ekipmanlar iÃ§in yeterli eÄŸitim verilmemiÅŸti?\n   â†’ Elektrik iÅŸlerinde Ã§alÄ±ÅŸacak personel iÃ§in Ã¶zel eÄŸitim programÄ± ve yetkinlik doÄŸrulama sistemi mevcut deÄŸildi\nâ“ Neden 5? Neden Ã¶zel eÄŸitim programÄ± ve yetkinlik doÄŸrulama sistemi yoktu?\n   â†’ Organizasyonda eÄŸitim ihtiyaÃ§ analizi yapÄ±lmÄ±yor, kritik gÃ¶revler iÃ§in yetkinlik gereksinimleri belirlenmemiÅŸ ve doÄŸrulanmÄ±yordu\n\nğŸ¯ KÃ–K NEDEN [D3.2] EÄŸitim ihtiyaÃ§larÄ±nÄ±n belirlenmemesi - ORGANÄ°ZASYONEL:\n   Elektrik iÅŸleri iÃ§in eÄŸitim ihtiyaÃ§ analizi yapÄ±lmamasÄ± ve yetkinlik gereksinimlerinin belirlenmemesi\n   Organizasyonda sistematik eÄŸitim ihtiyaÃ§ analizi yapÄ±lmadÄ±ÄŸÄ± iÃ§in elektrikli ekipmanlar Ã¼zerinde Ã§alÄ±ÅŸacak personelin hangi eÄŸitimlere ihtiyaÃ§ duyduÄŸu belirlenmemiÅŸ, LOTO ve enerjili Ã§alÄ±ÅŸma riskleri konusunda gerekli eÄŸitimler planlanmamÄ±ÅŸ ve verilmemiÅŸtir\n\n--------------------------------------------------------------------------------\n\nâš¡ DAL 3: DAVRANIÅSAL\n\nğŸ“Œ DoÄŸrudan Neden [A1.1] Bireysel kural/prosedÃ¼r ihlali:\n   Elektrik bakÄ±m teknisyeni LOTO (Kilitleme/Etiketleme) prosedÃ¼rÃ¼nÃ¼ uygulamadan enerjili sistemde Ã§alÄ±ÅŸtÄ±\n   KanÄ±t: Elektrik Ã§arpmasÄ± meydana gelmesi, enerjinin izole edilmediÄŸini ve standart elektrik gÃ¼venlik prosedÃ¼rlerinin ihlal edildiÄŸini gÃ¶stermektedir.\n\nâ“ Neden 1? Neden elektrik bakÄ±m teknisyeni LOTO prosedÃ¼rÃ¼nÃ¼ uygulamadan enerjili sistemde Ã§alÄ±ÅŸtÄ±?\n   â†’ Teknisyen, iÅŸin kÄ±sa sÃ¼receÄŸini dÃ¼ÅŸÃ¼nerek LOTO prosedÃ¼rÃ¼nÃ¼ atladÄ± ve doÄŸrudan mÃ¼dahale etti\nâ“ Neden 2? Neden teknisyen LOTO prosedÃ¼rÃ¼nÃ¼ atlayabileceÄŸini dÃ¼ÅŸÃ¼ndÃ¼?\n   â†’ Daha Ã¶nce benzer kÄ±sa iÅŸlerde LOTO uygulanmadÄ±ÄŸÄ± ve bunun yÃ¶netim tarafÄ±ndan fark edilip dÃ¼zeltilmediÄŸi gÃ¶rÃ¼lmÃ¼ÅŸtÃ¼\nâ“ Neden 3? Neden yÃ¶netim bu prosedÃ¼r ihlallerini fark edip dÃ¼zeltmedi?\n   â†’ Saha denetimleri dÃ¼zenli yapÄ±lmÄ±yor, yapÄ±ldÄ±ÄŸÄ±nda da prosedÃ¼r uygulamalarÄ±na yeterince odaklanÄ±lmÄ±yordu\nâ“ Neden 4? Neden saha denetimleri yetersiz ve etkisiz yapÄ±lÄ±yordu?\n   â†’ GÃ¶zetim planÄ± yoktu, sorumluluklar net deÄŸildi ve prosedÃ¼r sapmalarÄ± iÃ§in hesap verebilirlik mekanizmasÄ± iÅŸlemiyordu\n\nğŸ¯ KÃ–K NEDEN [D1.2] Yetersiz gÃ¶zetim veya denetim - ORGANÄ°ZASYONEL:\n   LOTO ProsedÃ¼rÃ¼ UygulamalarÄ±nÄ±n Yetersiz GÃ¶zetimi ve Denetimi\n   Elektrik bakÄ±m Ã§alÄ±ÅŸmalarÄ±nda LOTO prosedÃ¼rÃ¼ uygulamalarÄ±nÄ±n dÃ¼zenli olarak denetlenmemesi, prosedÃ¼r ihlallerinin tespit edilmemesi ve dÃ¼zeltici Ã¶nlem alÄ±nmamasÄ± sonucu gÃ¼venlik kurallarÄ±nÄ±n atlanmasÄ± normalleÅŸmiÅŸtir\n\n--------------------------------------------------------------------------------"
}