{
  "incident_summary": "Ä°skele montaj iÅŸÃ§isi Hasan YÄ±ldÄ±z (32) 6 metre yÃ¼kseklikteki iskeleden dÃ¼ÅŸerek aÄŸÄ±r yaralandÄ±. L2 omurga kÄ±rÄ±ÄŸÄ±, pelvis Ã§atlaÄŸÄ± ve iÃ§ kanama ile yoÄŸun bakÄ±ma alÄ±ndÄ±. Emniyet kemeri takÄ±lmamÄ±ÅŸ, korkuluk eksikti, gÃ¼venlik aÄŸÄ± yoktu.. Konum: YapÄ± Ä°nÅŸaat Åantiyesi - 4. Kat Ä°skele AlanÄ±. Olay Tipi: Accident",
  "analysis_branches": [
    {
      "branch_number": 1,
      "immediate_cause": {
        "code": "A3.2",
        "standard_title_tr": "Gerekli KKD/koruyucu yÃ¶ntemlerin kullanÄ±lmamasÄ±",
        "category_type": "DAVRANIÅSAL",
        "cause_tr": "Ä°ÅŸÃ§i 6 metre yÃ¼kseklikte Ã§alÄ±ÅŸÄ±rken emniyet kemeri takmamÄ±ÅŸtÄ±r",
        "evidence_tr": "Raporda 'Emniyet kemeri takÄ±lmamÄ±ÅŸ' ifadesi aÃ§Ä±kÃ§a belirtilmektedir."
      },
      "why_chain": [
        {
          "level": 1,
          "question_tr": "Neden iÅŸÃ§i emniyet kemeri takmamÄ±ÅŸtÄ±?",
          "answer_tr": "Emniyet kemeri kullanÄ±mÄ±nÄ±n zorunlu olduÄŸunu biliyordu ancak rahatsÄ±z edici bulduÄŸu iÃ§in takmadÄ±"
        },
        {
          "level": 2,
          "question_tr": "Neden kemersiz Ã§alÄ±ÅŸtÄ±ÄŸÄ± fark edilmedi veya mÃ¼dahale edilmedi?",
          "answer_tr": "Åantiyede sÃ¼rekli gÃ¶zetim yoktu, iÅŸÃ§iler kendi baÅŸlarÄ±na Ã§alÄ±ÅŸÄ±yordu"
        },
        {
          "level": 3,
          "question_tr": "Neden sÃ¼rekli gÃ¶zetim ve denetim yapÄ±lmÄ±yordu?",
          "answer_tr": "Åantiye ÅŸefi ve ustabaÅŸÄ± aynÄ± anda birden fazla noktayÄ± kontrol etmeye Ã§alÄ±ÅŸÄ±yordu, yeterli denetim personeli yoktu"
        },
        {
          "level": 4,
          "question_tr": "Neden yeterli denetim personeli yoktu ve gÃ¼venlik kurallarÄ±na uymayanlar tespit edilemiyordu?",
          "answer_tr": "YÃ¼ksekte Ã§alÄ±ÅŸma alanlarÄ±nda dÃ¼zenli denetim planÄ± yoktu, gÃ¶zetim sorumluluÄŸu net tanÄ±mlanmamÄ±ÅŸtÄ±"
        }
      ],
      "root_cause": {
        "code": "D1.2",
        "standard_title_tr": "Yetersiz gÃ¶zetim veya denetim",
        "category_type": "ORGANÄ°ZASYONEL",
        "cause_tr": "YÃ¼ksekte Ã‡alÄ±ÅŸmalarda Yetersiz GÃ¶zetim ve Denetim Sistemi",
        "explanation_tr": "Ä°skele alanlarÄ±nda dÃ¼zenli gÃ¶zetim planÄ± bulunmamakta, emniyet kemeri kullanÄ±mÄ± ve diÄŸer gÃ¼venlik kurallarÄ±na uyum kontrol edilmemekte, denetim sorumluluÄŸu net tanÄ±mlanmamÄ±ÅŸtÄ±r"
      }
    },
    {
      "branch_number": 2,
      "immediate_cause": {
        "code": "B4.4",
        "standard_title_tr": "KorunmasÄ±z yÃ¼kseklik veya dÃ¼ÅŸme tehlikesi",
        "category_type": "KOÅULLAR",
        "cause_tr": "6 metre yÃ¼kseklikteki iskelede korkuluk ve gÃ¼venlik aÄŸÄ± bulunmamaktadÄ±r",
        "evidence_tr": "Raporda 'korkuluk eksikti, gÃ¼venlik aÄŸÄ± yoktu' ifadeleri yer almaktadÄ±r."
      },
      "why_chain": [
        {
          "level": 1,
          "question_tr": "Neden 6 metre yÃ¼kseklikteki iskelede korkuluk ve gÃ¼venlik aÄŸÄ± bulunmuyordu?",
          "answer_tr": "Ä°skele montajÄ± tamamlandÄ±ktan sonra korkuluk ve gÃ¼venlik aÄŸÄ± takÄ±lmamÄ±ÅŸ, eksik bÄ±rakÄ±lmÄ±ÅŸtÄ±"
        },
        {
          "level": 2,
          "question_tr": "Neden iskele montajÄ± eksik bÄ±rakÄ±lmÄ±ÅŸtÄ±?",
          "answer_tr": "Ä°skele montajÄ±nÄ±n tamamlanÄ±p tamamlanmadÄ±ÄŸÄ± kontrol edilmemiÅŸti, iÅŸÃ§iler eksik montajla Ã§alÄ±ÅŸmaya baÅŸlamÄ±ÅŸtÄ±"
        },
        {
          "level": 3,
          "question_tr": "Neden iskele montajÄ± kontrol edilmemiÅŸti?",
          "answer_tr": "YÃ¼ksekte Ã§alÄ±ÅŸma Ã¶ncesi iskele gÃ¼venlik kontrolÃ¼ yapÄ±lmasÄ± iÃ§in bir sistem veya prosedÃ¼r yoktu"
        },
        {
          "level": 4,
          "question_tr": "Neden yÃ¼ksekte Ã§alÄ±ÅŸma iÃ§in kontrol sistemi yoktu?",
          "answer_tr": "YÃ¼ksekte Ã§alÄ±ÅŸma iÃ§in iÅŸ izin sistemi uygulanmÄ±yordu, risk kontrolleri takip edilmiyordu"
        }
      ],
      "root_cause": {
        "code": "D4.4",
        "standard_title_tr": "Ä°ÅŸ izin sisteminin etkisiz olmasÄ±",
        "category_type": "ORGANÄ°ZASYONEL",
        "cause_tr": "YÃ¼ksekte Ã‡alÄ±ÅŸma Ä°Ã§in Ä°ÅŸ Ä°zin Sisteminin OlmamasÄ± ve Risk Kontrollerinin Takip Edilmemesi",
        "explanation_tr": "YÃ¼ksekte Ã§alÄ±ÅŸma Ã¶ncesi iskele gÃ¼venlik kontrollerinin yapÄ±lmasÄ±nÄ± saÄŸlayacak iÅŸ izin sistemi mevcut deÄŸil. Korkuluk, gÃ¼venlik aÄŸÄ± gibi kritik gÃ¼venlik Ã¶nlemlerinin tamamlanÄ±p tamamlanmadÄ±ÄŸÄ± kontrol edilmiyor ve onaylanmÄ±yor."
      }
    },
    {
      "branch_number": 3,
      "immediate_cause": {
        "code": "A1.1",
        "standard_title_tr": "Bireysel kural/prosedÃ¼r ihlali",
        "category_type": "DAVRANIÅSAL",
        "cause_tr": "Ä°ÅŸÃ§i yÃ¼ksekte Ã§alÄ±ÅŸma prosedÃ¼rlerini ihlal ederek emniyet tedbiri almadan Ã§alÄ±ÅŸmÄ±ÅŸtÄ±r",
        "evidence_tr": "6 metre yÃ¼kseklikte emniyet kemeri takÄ±lmadan Ã§alÄ±ÅŸÄ±lmasÄ±, yÃ¼ksekte Ã§alÄ±ÅŸma prosedÃ¼rlerinin ihlal edildiÄŸini gÃ¶stermektedir."
      },
      "why_chain": [
        {
          "level": 1,
          "question_tr": "Neden iÅŸÃ§i emniyet kemeri takmadan ve korkuluksuz alanda Ã§alÄ±ÅŸtÄ±?",
          "answer_tr": "Ä°ÅŸÃ§i yÃ¼ksekte Ã§alÄ±ÅŸma prosedÃ¼rlerini bilmiyordu ve uygulamÄ±yordu"
        },
        {
          "level": 2,
          "question_tr": "Neden iÅŸÃ§i yÃ¼ksekte Ã§alÄ±ÅŸma prosedÃ¼rlerini bilmiyordu?",
          "answer_tr": "Ä°ÅŸÃ§iye yÃ¼ksekte Ã§alÄ±ÅŸma konusunda yeterli eÄŸitim verilmemiÅŸti"
        },
        {
          "level": 3,
          "question_tr": "Neden iÅŸÃ§iye yÃ¼ksekte Ã§alÄ±ÅŸma eÄŸitimi verilmemiÅŸti?",
          "answer_tr": "Åantiyede eÄŸitim ihtiyaÃ§ analizi yapÄ±lmÄ±yor, iÅŸÃ§iler doÄŸrudan iÅŸe baÅŸlatÄ±lÄ±yordu"
        },
        {
          "level": 4,
          "question_tr": "Neden eÄŸitim ihtiyaÃ§ analizi yapÄ±lmÄ±yordu?",
          "answer_tr": "Åirketin sistematik bir eÄŸitim programÄ± ve yetkinlik deÄŸerlendirme sistemi yoktu"
        }
      ],
      "root_cause": {
        "code": "D3.2",
        "standard_title_tr": "EÄŸitim ihtiyaÃ§larÄ±nÄ±n belirlenmemesi",
        "category_type": "ORGANÄ°ZASYONEL",
        "cause_tr": "YÃ¼ksekte Ã§alÄ±ÅŸacak iÅŸÃ§iler iÃ§in eÄŸitim ihtiyaÃ§ analizi yapÄ±lmamÄ±ÅŸ ve sistematik eÄŸitim programÄ± oluÅŸturulmamÄ±ÅŸ",
        "explanation_tr": "Åantiyede iÅŸe alÄ±nan iÅŸÃ§ilerin hangi konularda eÄŸitime ihtiyaÃ§ duyduÄŸu belirlenmemiÅŸ, yÃ¼ksekte Ã§alÄ±ÅŸma gibi kritik iÅŸler iÃ§in zorunlu eÄŸitim matrisi oluÅŸturulmamÄ±ÅŸ ve iÅŸÃ§iler yetkinlik deÄŸerlendirmesi yapÄ±lmadan tehlikeli iÅŸlere baÅŸlatÄ±lmÄ±ÅŸtÄ±r"
      }
    }
  ],
  "final_root_causes": [
    {
      "code": "D1.2",
      "standard_title_tr": "Yetersiz gÃ¶zetim veya denetim",
      "category_type": "ORGANÄ°ZASYONEL",
      "cause_tr": "YÃ¼ksekte Ã‡alÄ±ÅŸmalarda Yetersiz GÃ¶zetim ve Denetim Sistemi",
      "explanation_tr": "Ä°skele alanlarÄ±nda dÃ¼zenli gÃ¶zetim planÄ± bulunmamakta, emniyet kemeri kullanÄ±mÄ± ve diÄŸer gÃ¼venlik kurallarÄ±na uyum kontrol edilmemekte, denetim sorumluluÄŸu net tanÄ±mlanmamÄ±ÅŸtÄ±r"
    },
    {
      "code": "D4.4",
      "standard_title_tr": "Ä°ÅŸ izin sisteminin etkisiz olmasÄ±",
      "category_type": "ORGANÄ°ZASYONEL",
      "cause_tr": "YÃ¼ksekte Ã‡alÄ±ÅŸma Ä°Ã§in Ä°ÅŸ Ä°zin Sisteminin OlmamasÄ± ve Risk Kontrollerinin Takip Edilmemesi",
      "explanation_tr": "YÃ¼ksekte Ã§alÄ±ÅŸma Ã¶ncesi iskele gÃ¼venlik kontrollerinin yapÄ±lmasÄ±nÄ± saÄŸlayacak iÅŸ izin sistemi mevcut deÄŸil. Korkuluk, gÃ¼venlik aÄŸÄ± gibi kritik gÃ¼venlik Ã¶nlemlerinin tamamlanÄ±p tamamlanmadÄ±ÄŸÄ± kontrol edilmiyor ve onaylanmÄ±yor."
    },
    {
      "code": "D3.2",
      "standard_title_tr": "EÄŸitim ihtiyaÃ§larÄ±nÄ±n belirlenmemesi",
      "category_type": "ORGANÄ°ZASYONEL",
      "cause_tr": "YÃ¼ksekte Ã§alÄ±ÅŸacak iÅŸÃ§iler iÃ§in eÄŸitim ihtiyaÃ§ analizi yapÄ±lmamÄ±ÅŸ ve sistematik eÄŸitim programÄ± oluÅŸturulmamÄ±ÅŸ",
      "explanation_tr": "Åantiyede iÅŸe alÄ±nan iÅŸÃ§ilerin hangi konularda eÄŸitime ihtiyaÃ§ duyduÄŸu belirlenmemiÅŸ, yÃ¼ksekte Ã§alÄ±ÅŸma gibi kritik iÅŸler iÃ§in zorunlu eÄŸitim matrisi oluÅŸturulmamÄ±ÅŸ ve iÅŸÃ§iler yetkinlik deÄŸerlendirmesi yapÄ±lmadan tehlikeli iÅŸlere baÅŸlatÄ±lmÄ±ÅŸtÄ±r"
    }
  ],
  "analysis_method": "HSG245 Hierarchical 5-Why (A/B â†’ C/D)",
  "final_report_tr": "================================================================================\nKÃ–K NEDEN ANALÄ°ZÄ° RAPORU (HSG245 - 5 Why Metodolojisi)\n================================================================================\n\nOLAY: Ä°skele montaj iÅŸÃ§isi Hasan YÄ±ldÄ±z (32) 6 metre yÃ¼kseklikteki iskeleden dÃ¼ÅŸerek aÄŸÄ±r yaralandÄ±. L2 omurga kÄ±rÄ±ÄŸÄ±, pelvis Ã§atlaÄŸÄ± ve iÃ§ kanama ile yoÄŸun bakÄ±ma alÄ±ndÄ±. Emniyet kemeri takÄ±lmamÄ±ÅŸ, korkuluk eksikti, gÃ¼venlik aÄŸÄ± yoktu.. Konum: YapÄ± Ä°nÅŸaat Åantiyesi - 4. Kat Ä°skele AlanÄ±. Olay Tipi: Accident\n\n--------------------------------------------------------------------------------\n\nâš¡ DAL 1: DAVRANIÅSAL\n\nğŸ“Œ DoÄŸrudan Neden [A3.2] Gerekli KKD/koruyucu yÃ¶ntemlerin kullanÄ±lmamasÄ±:\n   Ä°ÅŸÃ§i 6 metre yÃ¼kseklikte Ã§alÄ±ÅŸÄ±rken emniyet kemeri takmamÄ±ÅŸtÄ±r\n   KanÄ±t: Raporda 'Emniyet kemeri takÄ±lmamÄ±ÅŸ' ifadesi aÃ§Ä±kÃ§a belirtilmektedir.\n\nâ“ Neden 1? Neden iÅŸÃ§i emniyet kemeri takmamÄ±ÅŸtÄ±?\n   â†’ Emniyet kemeri kullanÄ±mÄ±nÄ±n zorunlu olduÄŸunu biliyordu ancak rahatsÄ±z edici bulduÄŸu iÃ§in takmadÄ±\nâ“ Neden 2? Neden kemersiz Ã§alÄ±ÅŸtÄ±ÄŸÄ± fark edilmedi veya mÃ¼dahale edilmedi?\n   â†’ Åantiyede sÃ¼rekli gÃ¶zetim yoktu, iÅŸÃ§iler kendi baÅŸlarÄ±na Ã§alÄ±ÅŸÄ±yordu\nâ“ Neden 3? Neden sÃ¼rekli gÃ¶zetim ve denetim yapÄ±lmÄ±yordu?\n   â†’ Åantiye ÅŸefi ve ustabaÅŸÄ± aynÄ± anda birden fazla noktayÄ± kontrol etmeye Ã§alÄ±ÅŸÄ±yordu, yeterli denetim personeli yoktu\nâ“ Neden 4? Neden yeterli denetim personeli yoktu ve gÃ¼venlik kurallarÄ±na uymayanlar tespit edilemiyordu?\n   â†’ YÃ¼ksekte Ã§alÄ±ÅŸma alanlarÄ±nda dÃ¼zenli denetim planÄ± yoktu, gÃ¶zetim sorumluluÄŸu net tanÄ±mlanmamÄ±ÅŸtÄ±\n\nğŸ¯ KÃ–K NEDEN [D1.2] Yetersiz gÃ¶zetim veya denetim - ORGANÄ°ZASYONEL:\n   YÃ¼ksekte Ã‡alÄ±ÅŸmalarda Yetersiz GÃ¶zetim ve Denetim Sistemi\n   Ä°skele alanlarÄ±nda dÃ¼zenli gÃ¶zetim planÄ± bulunmamakta, emniyet kemeri kullanÄ±mÄ± ve diÄŸer gÃ¼venlik kurallarÄ±na uyum kontrol edilmemekte, denetim sorumluluÄŸu net tanÄ±mlanmamÄ±ÅŸtÄ±r\n\n--------------------------------------------------------------------------------\n\nâš¡ DAL 2: KOÅULLAR\n\nğŸ“Œ DoÄŸrudan Neden [B4.4] KorunmasÄ±z yÃ¼kseklik veya dÃ¼ÅŸme tehlikesi:\n   6 metre yÃ¼kseklikteki iskelede korkuluk ve gÃ¼venlik aÄŸÄ± bulunmamaktadÄ±r\n   KanÄ±t: Raporda 'korkuluk eksikti, gÃ¼venlik aÄŸÄ± yoktu' ifadeleri yer almaktadÄ±r.\n\nâ“ Neden 1? Neden 6 metre yÃ¼kseklikteki iskelede korkuluk ve gÃ¼venlik aÄŸÄ± bulunmuyordu?\n   â†’ Ä°skele montajÄ± tamamlandÄ±ktan sonra korkuluk ve gÃ¼venlik aÄŸÄ± takÄ±lmamÄ±ÅŸ, eksik bÄ±rakÄ±lmÄ±ÅŸtÄ±\nâ“ Neden 2? Neden iskele montajÄ± eksik bÄ±rakÄ±lmÄ±ÅŸtÄ±?\n   â†’ Ä°skele montajÄ±nÄ±n tamamlanÄ±p tamamlanmadÄ±ÄŸÄ± kontrol edilmemiÅŸti, iÅŸÃ§iler eksik montajla Ã§alÄ±ÅŸmaya baÅŸlamÄ±ÅŸtÄ±\nâ“ Neden 3? Neden iskele montajÄ± kontrol edilmemiÅŸti?\n   â†’ YÃ¼ksekte Ã§alÄ±ÅŸma Ã¶ncesi iskele gÃ¼venlik kontrolÃ¼ yapÄ±lmasÄ± iÃ§in bir sistem veya prosedÃ¼r yoktu\nâ“ Neden 4? Neden yÃ¼ksekte Ã§alÄ±ÅŸma iÃ§in kontrol sistemi yoktu?\n   â†’ YÃ¼ksekte Ã§alÄ±ÅŸma iÃ§in iÅŸ izin sistemi uygulanmÄ±yordu, risk kontrolleri takip edilmiyordu\n\nğŸ¯ KÃ–K NEDEN [D4.4] Ä°ÅŸ izin sisteminin etkisiz olmasÄ± - ORGANÄ°ZASYONEL:\n   YÃ¼ksekte Ã‡alÄ±ÅŸma Ä°Ã§in Ä°ÅŸ Ä°zin Sisteminin OlmamasÄ± ve Risk Kontrollerinin Takip Edilmemesi\n   YÃ¼ksekte Ã§alÄ±ÅŸma Ã¶ncesi iskele gÃ¼venlik kontrollerinin yapÄ±lmasÄ±nÄ± saÄŸlayacak iÅŸ izin sistemi mevcut deÄŸil. Korkuluk, gÃ¼venlik aÄŸÄ± gibi kritik gÃ¼venlik Ã¶nlemlerinin tamamlanÄ±p tamamlanmadÄ±ÄŸÄ± kontrol edilmiyor ve onaylanmÄ±yor.\n\n--------------------------------------------------------------------------------\n\nâš¡ DAL 3: DAVRANIÅSAL\n\nğŸ“Œ DoÄŸrudan Neden [A1.1] Bireysel kural/prosedÃ¼r ihlali:\n   Ä°ÅŸÃ§i yÃ¼ksekte Ã§alÄ±ÅŸma prosedÃ¼rlerini ihlal ederek emniyet tedbiri almadan Ã§alÄ±ÅŸmÄ±ÅŸtÄ±r\n   KanÄ±t: 6 metre yÃ¼kseklikte emniyet kemeri takÄ±lmadan Ã§alÄ±ÅŸÄ±lmasÄ±, yÃ¼ksekte Ã§alÄ±ÅŸma prosedÃ¼rlerinin ihlal edildiÄŸini gÃ¶stermektedir.\n\nâ“ Neden 1? Neden iÅŸÃ§i emniyet kemeri takmadan ve korkuluksuz alanda Ã§alÄ±ÅŸtÄ±?\n   â†’ Ä°ÅŸÃ§i yÃ¼ksekte Ã§alÄ±ÅŸma prosedÃ¼rlerini bilmiyordu ve uygulamÄ±yordu\nâ“ Neden 2? Neden iÅŸÃ§i yÃ¼ksekte Ã§alÄ±ÅŸma prosedÃ¼rlerini bilmiyordu?\n   â†’ Ä°ÅŸÃ§iye yÃ¼ksekte Ã§alÄ±ÅŸma konusunda yeterli eÄŸitim verilmemiÅŸti\nâ“ Neden 3? Neden iÅŸÃ§iye yÃ¼ksekte Ã§alÄ±ÅŸma eÄŸitimi verilmemiÅŸti?\n   â†’ Åantiyede eÄŸitim ihtiyaÃ§ analizi yapÄ±lmÄ±yor, iÅŸÃ§iler doÄŸrudan iÅŸe baÅŸlatÄ±lÄ±yordu\nâ“ Neden 4? Neden eÄŸitim ihtiyaÃ§ analizi yapÄ±lmÄ±yordu?\n   â†’ Åirketin sistematik bir eÄŸitim programÄ± ve yetkinlik deÄŸerlendirme sistemi yoktu\n\nğŸ¯ KÃ–K NEDEN [D3.2] EÄŸitim ihtiyaÃ§larÄ±nÄ±n belirlenmemesi - ORGANÄ°ZASYONEL:\n   YÃ¼ksekte Ã§alÄ±ÅŸacak iÅŸÃ§iler iÃ§in eÄŸitim ihtiyaÃ§ analizi yapÄ±lmamÄ±ÅŸ ve sistematik eÄŸitim programÄ± oluÅŸturulmamÄ±ÅŸ\n   Åantiyede iÅŸe alÄ±nan iÅŸÃ§ilerin hangi konularda eÄŸitime ihtiyaÃ§ duyduÄŸu belirlenmemiÅŸ, yÃ¼ksekte Ã§alÄ±ÅŸma gibi kritik iÅŸler iÃ§in zorunlu eÄŸitim matrisi oluÅŸturulmamÄ±ÅŸ ve iÅŸÃ§iler yetkinlik deÄŸerlendirmesi yapÄ±lmadan tehlikeli iÅŸlere baÅŸlatÄ±lmÄ±ÅŸtÄ±r\n\n--------------------------------------------------------------------------------"
}