{
  "incident_summary": "\nOLAY RAPORU - MAKÄ°NE SIKIÅMASI / EZILME\n\nTarih: 22 Åubat 2026, Saat: 11:15\nLokasyon: Ambalaj HattÄ± 3 - KonveyÃ¶r BandÄ± Sistemi\nRapor Eden: Hat Åefi - AyÅŸe Demir\n\nOLAY AÃ‡IKLAMASI:\nKonveyÃ¶r bandÄ± operat. Olay Tipi: Accident",
  "analysis_branches": [
    {
      "branch_number": 1,
      "immediate_cause": {
        "code": "A3.5",
        "standard_title_tr": "GÃ¼venlik/koruyucu cihazlarÄ±n sÃ¶kÃ¼lmesi, baypas edilmesi veya devre dÄ±ÅŸÄ± bÄ±rakÄ±lmasÄ±",
        "category_type": "DAVRANIÅSAL",
        "cause_tr": "OperatÃ¶r konveyÃ¶r bandÄ±nÄ±n acil durdurma dÃ¼ÄŸmesini kullanmadan ve koruyucu kapaÄŸÄ± aÃ§arak sÄ±kÄ±ÅŸan Ã¼rÃ¼nÃ¼ Ã§Ä±karmaya Ã§alÄ±ÅŸtÄ±",
        "evidence_tr": "Raporda 'OperatÃ¶r konveyÃ¶r bandÄ±nÄ±n koruyucu kapaÄŸÄ±nÄ± aÃ§arak sÄ±kÄ±ÅŸan Ã¼rÃ¼nÃ¼ Ã§Ä±karmaya Ã§alÄ±ÅŸÄ±rken' ifadesi yer almaktadÄ±r."
      },
      "why_chain": [
        {
          "level": 1,
          "question_tr": "Neden operatÃ¶r acil durdurma dÃ¼ÄŸmesini kullanmadan mÃ¼dahale etti?",
          "answer_tr": "OperatÃ¶r sÄ±kÄ±ÅŸan Ã¼rÃ¼nÃ¼ hÄ±zlÄ±ca Ã§Ä±karmanÄ±n daha pratik olduÄŸunu dÃ¼ÅŸÃ¼ndÃ¼ ve bu yÃ¶ntemi daha Ã¶nce de kullanmÄ±ÅŸtÄ±"
        },
        {
          "level": 2,
          "question_tr": "Neden operatÃ¶r bu gÃ¼vensiz davranÄ±ÅŸÄ± daha Ã¶nce de uygulamÄ±ÅŸtÄ±?",
          "answer_tr": "GeÃ§miÅŸte aynÄ± ÅŸekilde mÃ¼dahale ettiÄŸinde herhangi bir kaza olmamÄ±ÅŸ ve bu davranÄ±ÅŸ iÃ§in uyarÄ± almamÄ±ÅŸtÄ±"
        },
        {
          "level": 3,
          "question_tr": "Neden bu gÃ¼vensiz davranÄ±ÅŸ fark edilip dÃ¼zeltilmemiÅŸti?",
          "answer_tr": "Hat ÅŸefi ve vardiya amirleri sahada yeterli gÃ¶zetim yapmÄ±yordu ve operatÃ¶rlerin Ã§alÄ±ÅŸma yÃ¶ntemlerini dÃ¼zenli kontrol etmiyordu"
        },
        {
          "level": 4,
          "question_tr": "Neden gÃ¶zetim ve denetim yetersizdi?",
          "answer_tr": "YÃ¶netim Ã¼retim hedeflerine odaklanmÄ±ÅŸ durumda ve gÃ¼venlik denetimi iÃ§in yeterli zaman ayrÄ±lmÄ±yordu, ayrÄ±ca gÃ¶zetim sorumluluklarÄ±nÄ±n net tanÄ±mÄ± yoktu"
        }
      ],
      "root_cause": {
        "code": "D1.2",
        "standard_title_tr": "Yetersiz gÃ¶zetim veya denetim",
        "category_type": "ORGANÄ°ZASYONEL",
        "cause_tr": "Saha GÃ¶zetiminin YetersizliÄŸi ve GÃ¼vensiz DavranÄ±ÅŸlarÄ±n Tespit Edilememesi",
        "explanation_tr": "YÃ¶netim ve hat ÅŸefleri tarafÄ±ndan operatÃ¶rlerin Ã§alÄ±ÅŸma yÃ¶ntemlerinin dÃ¼zenli denetimi yapÄ±lmamakta, gÃ¼vensiz davranÄ±ÅŸlar tespit edilip dÃ¼zeltilmemektedir. Ãœretim baskÄ±sÄ± nedeniyle gÃ¼venlik gÃ¶zetimi ihmal edilmektedir."
      }
    },
    {
      "branch_number": 2,
      "immediate_cause": {
        "code": "A1.1",
        "standard_title_tr": "Bireysel kural/prosedÃ¼r ihlali",
        "category_type": "DAVRANIÅSAL",
        "cause_tr": "OperatÃ¶r makineyi durdurmadan ve LOTO prosedÃ¼rÃ¼nÃ¼ uygulamadan mÃ¼dahale etti",
        "evidence_tr": "Olay aÃ§Ä±klamasÄ±nda operatÃ¶rÃ¼n bandÄ± durdurmadan ve gÃ¼venlik prosedÃ¼rlerini izlemeden doÄŸrudan mÃ¼dahale ettiÄŸi belirtilmektedir."
      },
      "why_chain": [
        {
          "level": 1,
          "question_tr": "Neden operatÃ¶r makineyi durdurmadan ve LOTO prosedÃ¼rÃ¼nÃ¼ uygulamadan mÃ¼dahale etti?",
          "answer_tr": "OperatÃ¶r LOTO prosedÃ¼rÃ¼nÃ¼ biliyordu ancak hÄ±zlÄ± mÃ¼dahale etmek iÃ§in atladÄ±, Ã§Ã¼nkÃ¼ Ã¼retim hedeflerine yetiÅŸme baskÄ±sÄ± vardÄ±"
        },
        {
          "level": 2,
          "question_tr": "Neden operatÃ¶r Ã¼retim baskÄ±sÄ± nedeniyle gÃ¼venlik prosedÃ¼rÃ¼nÃ¼ atladÄ±?",
          "answer_tr": "Hat ÅŸefi ve yÃ¶netim, Ã¼retim hedeflerine ulaÅŸmayÄ± Ã¶ncelik olarak vurguluyor ve prosedÃ¼r ihlallerine mÃ¼dahale etmiyordu"
        },
        {
          "level": 3,
          "question_tr": "Neden yÃ¶netim prosedÃ¼r ihlallerine mÃ¼dahale etmiyordu?",
          "answer_tr": "Daha Ã¶nce benzer kÄ±sa yollar kullanÄ±ldÄ±ÄŸÄ±nda hiÃ§bir dÃ¼zeltici Ã¶nlem alÄ±nmamÄ±ÅŸ, bu davranÄ±ÅŸlar normalleÅŸmiÅŸti"
        },
        {
          "level": 4,
          "question_tr": "Neden gÃ¼vensiz davranÄ±ÅŸlar normalleÅŸmiÅŸti ve dÃ¼zeltilmemiÅŸti?",
          "answer_tr": "GÃ¶zetim sistemi etkisiz Ã§alÄ±ÅŸÄ±yor, saha denetimleri yetersiz ve sapmalarÄ± tespit edip dÃ¼zeltme mekanizmasÄ± yoktu"
        },
        {
          "level": 5,
          "question_tr": "Neden gÃ¶zetim sistemi etkisiz ve sapmalarÄ± dÃ¼zeltme mekanizmasÄ± yoktu?",
          "answer_tr": "YÃ¶netim gÃ¼venlik kurallarÄ±nÄ±n ihlal edildiÄŸini biliyor ancak Ã¼retim hedefleri Ã¶ncelikli olduÄŸu iÃ§in bu sapmalara tolerans gÃ¶steriyordu"
        }
      ],
      "root_cause": {
        "code": "D1.9",
        "standard_title_tr": "YÃ¶netimin bilinen sapmalara tolerans gÃ¶stermesi",
        "category_type": "ORGANÄ°ZASYONEL",
        "cause_tr": "YÃ¶netimin Ã¼retim baskÄ±sÄ± nedeniyle LOTO prosedÃ¼rÃ¼ ihlallerine tolerans gÃ¶stermesi",
        "explanation_tr": "Ãœst yÃ¶netim ve hat ÅŸefleri, Ã¼retim hedeflerine ulaÅŸmak iÃ§in gÃ¼venlik prosedÃ¼rlerinin ihlal edildiÄŸini biliyor ancak mÃ¼dahale etmiyor. Bu durum gÃ¼vensiz davranÄ±ÅŸlarÄ±n normalleÅŸmesine ve operatÃ¶rlerin prosedÃ¼rleri atlayarak hÄ±zlÄ± mÃ¼dahale etmesine neden oluyor. Organizasyonda Ã¼retim Ã¶nceliÄŸi gÃ¼venliÄŸin Ã¶nÃ¼ne geÃ§miÅŸ durumda."
      }
    },
    {
      "branch_number": 3,
      "immediate_cause": {
        "code": "B1.1",
        "standard_title_tr": "Koruyucu cihazlarÄ±n etkisiz olmasÄ±",
        "category_type": "KOÅULSAL",
        "cause_tr": "KonveyÃ¶r bandÄ±nÄ±n koruyucu kapaÄŸÄ± aÃ§Ä±ldÄ±ÄŸÄ±nda makineyi otomatik olarak durduracak emniyet kilidi sistemi mevcut deÄŸildi veya Ã§alÄ±ÅŸmÄ±yordu",
        "evidence_tr": "OperatÃ¶rÃ¼n koruyucu kapaÄŸÄ± aÃ§masÄ±na raÄŸmen bandÄ±n Ã§alÄ±ÅŸmaya devam etmesi, interlock sisteminin olmadÄ±ÄŸÄ±nÄ± veya devre dÄ±ÅŸÄ± olduÄŸunu gÃ¶stermektedir."
      },
      "why_chain": [
        {
          "level": 1,
          "question_tr": "Neden emniyet kilidi sistemi mevcut deÄŸildi veya Ã§alÄ±ÅŸmÄ±yordu?",
          "answer_tr": "Sistem baÅŸlangÄ±Ã§ta tasarlanmamÄ±ÅŸ veya sonradan devre dÄ±ÅŸÄ± bÄ±rakÄ±lmÄ±ÅŸtÄ±"
        },
        {
          "level": 2,
          "question_tr": "Neden bu kritik gÃ¼venlik sistemi tasarÄ±ma dahil edilmemiÅŸti?",
          "answer_tr": "KonveyÃ¶r bandÄ± sistemi tasarlanÄ±rken emniyet kilidi gereksinimi deÄŸerlendirilmemiÅŸti"
        },
        {
          "level": 3,
          "question_tr": "Neden tasarÄ±m aÅŸamasÄ±nda bu gÃ¼venlik gereksinimi gÃ¶zden kaÃ§mÄ±ÅŸtÄ±?",
          "answer_tr": "TasarÄ±m Ã¶ncesi kapsamlÄ± risk deÄŸerlendirmesi yapÄ±lmamÄ±ÅŸ, tehlike senaryolarÄ± belirlenmemiÅŸti"
        },
        {
          "level": 4,
          "question_tr": "Neden risk deÄŸerlendirmesi yapÄ±lmadan tasarÄ±m onaylanmÄ±ÅŸtÄ±?",
          "answer_tr": "TasarÄ±m gÃ¶zden geÃ§irme sÃ¼recinde gÃ¼venlik kontrolleri ve risk analizi zorunluluÄŸu yoktu"
        },
        {
          "level": 5,
          "question_tr": "Neden tasarÄ±m sÃ¼recinde gÃ¼venlik gÃ¶zden geÃ§irmesi zorunlu deÄŸildi?",
          "answer_tr": "TasarÄ±m aÅŸamasÄ±nda gÃ¼venlik gereksinimlerinin sistematik olarak deÄŸerlendirilmesi iÃ§in resmi sÃ¼reÃ§ ve prosedÃ¼r bulunmuyordu"
        }
      ],
      "root_cause": {
        "code": "D5.2",
        "standard_title_tr": "Yetersiz tasarÄ±m gÃ¶zden geÃ§irme",
        "category_type": "ORGANÄ°ZASYONEL",
        "cause_tr": "TasarÄ±m SÃ¼recinde GÃ¼venlik GÃ¶zden GeÃ§irme ProsedÃ¼rÃ¼nÃ¼n OlmamasÄ±",
        "explanation_tr": "Makine ve ekipman tasarÄ±mlarÄ±nda emniyet sistemlerinin deÄŸerlendirilmesi iÃ§in resmi gÃ¶zden geÃ§irme sÃ¼reci mevcut deÄŸil. TasarÄ±m onayÄ± Ã¶ncesi risk analizi ve gÃ¼venlik kontrol listesi uygulamasÄ± yapÄ±lmÄ±yor."
      }
    }
  ],
  "final_root_causes": [
    {
      "code": "D1.2",
      "standard_title_tr": "Yetersiz gÃ¶zetim veya denetim",
      "category_type": "ORGANÄ°ZASYONEL",
      "cause_tr": "Saha GÃ¶zetiminin YetersizliÄŸi ve GÃ¼vensiz DavranÄ±ÅŸlarÄ±n Tespit Edilememesi",
      "explanation_tr": "YÃ¶netim ve hat ÅŸefleri tarafÄ±ndan operatÃ¶rlerin Ã§alÄ±ÅŸma yÃ¶ntemlerinin dÃ¼zenli denetimi yapÄ±lmamakta, gÃ¼vensiz davranÄ±ÅŸlar tespit edilip dÃ¼zeltilmemektedir. Ãœretim baskÄ±sÄ± nedeniyle gÃ¼venlik gÃ¶zetimi ihmal edilmektedir."
    },
    {
      "code": "D1.9",
      "standard_title_tr": "YÃ¶netimin bilinen sapmalara tolerans gÃ¶stermesi",
      "category_type": "ORGANÄ°ZASYONEL",
      "cause_tr": "YÃ¶netimin Ã¼retim baskÄ±sÄ± nedeniyle LOTO prosedÃ¼rÃ¼ ihlallerine tolerans gÃ¶stermesi",
      "explanation_tr": "Ãœst yÃ¶netim ve hat ÅŸefleri, Ã¼retim hedeflerine ulaÅŸmak iÃ§in gÃ¼venlik prosedÃ¼rlerinin ihlal edildiÄŸini biliyor ancak mÃ¼dahale etmiyor. Bu durum gÃ¼vensiz davranÄ±ÅŸlarÄ±n normalleÅŸmesine ve operatÃ¶rlerin prosedÃ¼rleri atlayarak hÄ±zlÄ± mÃ¼dahale etmesine neden oluyor. Organizasyonda Ã¼retim Ã¶nceliÄŸi gÃ¼venliÄŸin Ã¶nÃ¼ne geÃ§miÅŸ durumda."
    },
    {
      "code": "D5.2",
      "standard_title_tr": "Yetersiz tasarÄ±m gÃ¶zden geÃ§irme",
      "category_type": "ORGANÄ°ZASYONEL",
      "cause_tr": "TasarÄ±m SÃ¼recinde GÃ¼venlik GÃ¶zden GeÃ§irme ProsedÃ¼rÃ¼nÃ¼n OlmamasÄ±",
      "explanation_tr": "Makine ve ekipman tasarÄ±mlarÄ±nda emniyet sistemlerinin deÄŸerlendirilmesi iÃ§in resmi gÃ¶zden geÃ§irme sÃ¼reci mevcut deÄŸil. TasarÄ±m onayÄ± Ã¶ncesi risk analizi ve gÃ¼venlik kontrol listesi uygulamasÄ± yapÄ±lmÄ±yor."
    }
  ],
  "analysis_method": "HSG245 Hierarchical 5-Why (A/B â†’ C/D)",
  "final_report_tr": "================================================================================\nKÃ–K NEDEN ANALÄ°ZÄ° RAPORU (HSG245 - 5 Why Metodolojisi)\n================================================================================\n\nOLAY: \nOLAY RAPORU - MAKÄ°NE SIKIÅMASI / EZILME\n\nTarih: 22 Åubat 2026, Saat: 11:15\nLokasyon: Ambalaj HattÄ± 3 - KonveyÃ¶r BandÄ± Sistemi\nRapor Eden: Hat Åefi - AyÅŸe Demir\n\nOLAY AÃ‡IKLAMASI:\nKonveyÃ¶r bandÄ± operat. Olay Tipi: Accident\n\n--------------------------------------------------------------------------------\n\nâš¡ DAL 1: DAVRANIÅSAL\n\nğŸ“Œ DoÄŸrudan Neden [A3.5] GÃ¼venlik/koruyucu cihazlarÄ±n sÃ¶kÃ¼lmesi, baypas edilmesi veya devre dÄ±ÅŸÄ± bÄ±rakÄ±lmasÄ±:\n   OperatÃ¶r konveyÃ¶r bandÄ±nÄ±n acil durdurma dÃ¼ÄŸmesini kullanmadan ve koruyucu kapaÄŸÄ± aÃ§arak sÄ±kÄ±ÅŸan Ã¼rÃ¼nÃ¼ Ã§Ä±karmaya Ã§alÄ±ÅŸtÄ±\n   KanÄ±t: Raporda 'OperatÃ¶r konveyÃ¶r bandÄ±nÄ±n koruyucu kapaÄŸÄ±nÄ± aÃ§arak sÄ±kÄ±ÅŸan Ã¼rÃ¼nÃ¼ Ã§Ä±karmaya Ã§alÄ±ÅŸÄ±rken' ifadesi yer almaktadÄ±r.\n\nâ“ Neden 1? Neden operatÃ¶r acil durdurma dÃ¼ÄŸmesini kullanmadan mÃ¼dahale etti?\n   â†’ OperatÃ¶r sÄ±kÄ±ÅŸan Ã¼rÃ¼nÃ¼ hÄ±zlÄ±ca Ã§Ä±karmanÄ±n daha pratik olduÄŸunu dÃ¼ÅŸÃ¼ndÃ¼ ve bu yÃ¶ntemi daha Ã¶nce de kullanmÄ±ÅŸtÄ±\nâ“ Neden 2? Neden operatÃ¶r bu gÃ¼vensiz davranÄ±ÅŸÄ± daha Ã¶nce de uygulamÄ±ÅŸtÄ±?\n   â†’ GeÃ§miÅŸte aynÄ± ÅŸekilde mÃ¼dahale ettiÄŸinde herhangi bir kaza olmamÄ±ÅŸ ve bu davranÄ±ÅŸ iÃ§in uyarÄ± almamÄ±ÅŸtÄ±\nâ“ Neden 3? Neden bu gÃ¼vensiz davranÄ±ÅŸ fark edilip dÃ¼zeltilmemiÅŸti?\n   â†’ Hat ÅŸefi ve vardiya amirleri sahada yeterli gÃ¶zetim yapmÄ±yordu ve operatÃ¶rlerin Ã§alÄ±ÅŸma yÃ¶ntemlerini dÃ¼zenli kontrol etmiyordu\nâ“ Neden 4? Neden gÃ¶zetim ve denetim yetersizdi?\n   â†’ YÃ¶netim Ã¼retim hedeflerine odaklanmÄ±ÅŸ durumda ve gÃ¼venlik denetimi iÃ§in yeterli zaman ayrÄ±lmÄ±yordu, ayrÄ±ca gÃ¶zetim sorumluluklarÄ±nÄ±n net tanÄ±mÄ± yoktu\n\nğŸ¯ KÃ–K NEDEN [D1.2] Yetersiz gÃ¶zetim veya denetim - ORGANÄ°ZASYONEL:\n   Saha GÃ¶zetiminin YetersizliÄŸi ve GÃ¼vensiz DavranÄ±ÅŸlarÄ±n Tespit Edilememesi\n   YÃ¶netim ve hat ÅŸefleri tarafÄ±ndan operatÃ¶rlerin Ã§alÄ±ÅŸma yÃ¶ntemlerinin dÃ¼zenli denetimi yapÄ±lmamakta, gÃ¼vensiz davranÄ±ÅŸlar tespit edilip dÃ¼zeltilmemektedir. Ãœretim baskÄ±sÄ± nedeniyle gÃ¼venlik gÃ¶zetimi ihmal edilmektedir.\n\n--------------------------------------------------------------------------------\n\nâš¡ DAL 2: DAVRANIÅSAL\n\nğŸ“Œ DoÄŸrudan Neden [A1.1] Bireysel kural/prosedÃ¼r ihlali:\n   OperatÃ¶r makineyi durdurmadan ve LOTO prosedÃ¼rÃ¼nÃ¼ uygulamadan mÃ¼dahale etti\n   KanÄ±t: Olay aÃ§Ä±klamasÄ±nda operatÃ¶rÃ¼n bandÄ± durdurmadan ve gÃ¼venlik prosedÃ¼rlerini izlemeden doÄŸrudan mÃ¼dahale ettiÄŸi belirtilmektedir.\n\nâ“ Neden 1? Neden operatÃ¶r makineyi durdurmadan ve LOTO prosedÃ¼rÃ¼nÃ¼ uygulamadan mÃ¼dahale etti?\n   â†’ OperatÃ¶r LOTO prosedÃ¼rÃ¼nÃ¼ biliyordu ancak hÄ±zlÄ± mÃ¼dahale etmek iÃ§in atladÄ±, Ã§Ã¼nkÃ¼ Ã¼retim hedeflerine yetiÅŸme baskÄ±sÄ± vardÄ±\nâ“ Neden 2? Neden operatÃ¶r Ã¼retim baskÄ±sÄ± nedeniyle gÃ¼venlik prosedÃ¼rÃ¼nÃ¼ atladÄ±?\n   â†’ Hat ÅŸefi ve yÃ¶netim, Ã¼retim hedeflerine ulaÅŸmayÄ± Ã¶ncelik olarak vurguluyor ve prosedÃ¼r ihlallerine mÃ¼dahale etmiyordu\nâ“ Neden 3? Neden yÃ¶netim prosedÃ¼r ihlallerine mÃ¼dahale etmiyordu?\n   â†’ Daha Ã¶nce benzer kÄ±sa yollar kullanÄ±ldÄ±ÄŸÄ±nda hiÃ§bir dÃ¼zeltici Ã¶nlem alÄ±nmamÄ±ÅŸ, bu davranÄ±ÅŸlar normalleÅŸmiÅŸti\nâ“ Neden 4? Neden gÃ¼vensiz davranÄ±ÅŸlar normalleÅŸmiÅŸti ve dÃ¼zeltilmemiÅŸti?\n   â†’ GÃ¶zetim sistemi etkisiz Ã§alÄ±ÅŸÄ±yor, saha denetimleri yetersiz ve sapmalarÄ± tespit edip dÃ¼zeltme mekanizmasÄ± yoktu\nâ“ Neden 5? Neden gÃ¶zetim sistemi etkisiz ve sapmalarÄ± dÃ¼zeltme mekanizmasÄ± yoktu?\n   â†’ YÃ¶netim gÃ¼venlik kurallarÄ±nÄ±n ihlal edildiÄŸini biliyor ancak Ã¼retim hedefleri Ã¶ncelikli olduÄŸu iÃ§in bu sapmalara tolerans gÃ¶steriyordu\n\nğŸ¯ KÃ–K NEDEN [D1.9] YÃ¶netimin bilinen sapmalara tolerans gÃ¶stermesi - ORGANÄ°ZASYONEL:\n   YÃ¶netimin Ã¼retim baskÄ±sÄ± nedeniyle LOTO prosedÃ¼rÃ¼ ihlallerine tolerans gÃ¶stermesi\n   Ãœst yÃ¶netim ve hat ÅŸefleri, Ã¼retim hedeflerine ulaÅŸmak iÃ§in gÃ¼venlik prosedÃ¼rlerinin ihlal edildiÄŸini biliyor ancak mÃ¼dahale etmiyor. Bu durum gÃ¼vensiz davranÄ±ÅŸlarÄ±n normalleÅŸmesine ve operatÃ¶rlerin prosedÃ¼rleri atlayarak hÄ±zlÄ± mÃ¼dahale etmesine neden oluyor. Organizasyonda Ã¼retim Ã¶nceliÄŸi gÃ¼venliÄŸin Ã¶nÃ¼ne geÃ§miÅŸ durumda.\n\n--------------------------------------------------------------------------------\n\nâš¡ DAL 3: KOÅULSAL\n\nğŸ“Œ DoÄŸrudan Neden [B1.1] Koruyucu cihazlarÄ±n etkisiz olmasÄ±:\n   KonveyÃ¶r bandÄ±nÄ±n koruyucu kapaÄŸÄ± aÃ§Ä±ldÄ±ÄŸÄ±nda makineyi otomatik olarak durduracak emniyet kilidi sistemi mevcut deÄŸildi veya Ã§alÄ±ÅŸmÄ±yordu\n   KanÄ±t: OperatÃ¶rÃ¼n koruyucu kapaÄŸÄ± aÃ§masÄ±na raÄŸmen bandÄ±n Ã§alÄ±ÅŸmaya devam etmesi, interlock sisteminin olmadÄ±ÄŸÄ±nÄ± veya devre dÄ±ÅŸÄ± olduÄŸunu gÃ¶stermektedir.\n\nâ“ Neden 1? Neden emniyet kilidi sistemi mevcut deÄŸildi veya Ã§alÄ±ÅŸmÄ±yordu?\n   â†’ Sistem baÅŸlangÄ±Ã§ta tasarlanmamÄ±ÅŸ veya sonradan devre dÄ±ÅŸÄ± bÄ±rakÄ±lmÄ±ÅŸtÄ±\nâ“ Neden 2? Neden bu kritik gÃ¼venlik sistemi tasarÄ±ma dahil edilmemiÅŸti?\n   â†’ KonveyÃ¶r bandÄ± sistemi tasarlanÄ±rken emniyet kilidi gereksinimi deÄŸerlendirilmemiÅŸti\nâ“ Neden 3? Neden tasarÄ±m aÅŸamasÄ±nda bu gÃ¼venlik gereksinimi gÃ¶zden kaÃ§mÄ±ÅŸtÄ±?\n   â†’ TasarÄ±m Ã¶ncesi kapsamlÄ± risk deÄŸerlendirmesi yapÄ±lmamÄ±ÅŸ, tehlike senaryolarÄ± belirlenmemiÅŸti\nâ“ Neden 4? Neden risk deÄŸerlendirmesi yapÄ±lmadan tasarÄ±m onaylanmÄ±ÅŸtÄ±?\n   â†’ TasarÄ±m gÃ¶zden geÃ§irme sÃ¼recinde gÃ¼venlik kontrolleri ve risk analizi zorunluluÄŸu yoktu\nâ“ Neden 5? Neden tasarÄ±m sÃ¼recinde gÃ¼venlik gÃ¶zden geÃ§irmesi zorunlu deÄŸildi?\n   â†’ TasarÄ±m aÅŸamasÄ±nda gÃ¼venlik gereksinimlerinin sistematik olarak deÄŸerlendirilmesi iÃ§in resmi sÃ¼reÃ§ ve prosedÃ¼r bulunmuyordu\n\nğŸ¯ KÃ–K NEDEN [D5.2] Yetersiz tasarÄ±m gÃ¶zden geÃ§irme - ORGANÄ°ZASYONEL:\n   TasarÄ±m SÃ¼recinde GÃ¼venlik GÃ¶zden GeÃ§irme ProsedÃ¼rÃ¼nÃ¼n OlmamasÄ±\n   Makine ve ekipman tasarÄ±mlarÄ±nda emniyet sistemlerinin deÄŸerlendirilmesi iÃ§in resmi gÃ¶zden geÃ§irme sÃ¼reci mevcut deÄŸil. TasarÄ±m onayÄ± Ã¶ncesi risk analizi ve gÃ¼venlik kontrol listesi uygulamasÄ± yapÄ±lmÄ±yor.\n\n--------------------------------------------------------------------------------"
}