{
  "part1": {
    "ref_no": "INC-20260223-014829",
    "reported_by": "",
    "date_time": "23.02.26 01:48AM",
    "incident_type": "This incident describes a compressor failure in a production line causing a 4-hour production stoppage due to bearing seizure from overheating. This is an equipment/machinery failure incident, not a health or injury incident.\n\nHowever, since",
    "brief_details": {
      "what": "KompresÃ¶r rulmanÄ± aÅŸÄ±rÄ± Ä±sÄ±nma sonucu seizure yapmasÄ± nedeniyle 4 saatlik Ã¼retim durmasÄ±",
      "where": "Fabrika Ã¼retim hattÄ±",
      "when": "BelirtilmemiÅŸ",
      "who": "BelirtilmemiÅŸ",
      "emergency_measures": "Termal kamera gÃ¶rÃ¼ntÃ¼leri ve bakÄ±m kayÄ±tlarÄ± incelendi, otomatik yaÄŸ seviye sensÃ¶rÃ¼nÃ¼n kalibre edilmediÄŸi ve bakÄ±m kontrol listesinde sensÃ¶r kalibrasyonu adÄ±mÄ±nÄ±n eksik olduÄŸu tespit edildi"
    },
    "forwarded_to": "",
    "forwarded_date_time": ""
  },
  "part2": {
    "type_of_event": "Undesired circumstance",
    "actual_potential_harm": "4. Damage only - no injury",
    "riddor_reportable": "N",
    "riddor_date_reported": "",
    "accident_book_entry": "Y",
    "accident_book_date": "23.02.26",
    "accident_book_ref": "054/26",
    "investigation_level": "Medium level",
    "initial_assessment_by": "H&S Officer",
    "assessment_date": "23.02.26",
    "further_investigation_required": "Y",
    "priority": "Medium",
    "investigation_team": [
      "H&S Officer",
      "Maintenance Manager",
      "Production Manager",
      "Mechanical Engineer",
      "Maintenance Technician"
    ]
  },
  "part3_rca": {
    "incident_summary": "KompresÃ¶r rulmanÄ± aÅŸÄ±rÄ± Ä±sÄ±nma sonucu seizure yapmasÄ± nedeniyle 4 saatlik Ã¼retim durmasÄ±. Konum: Fabrika Ã¼retim hattÄ±. Olay Tipi: Undesired circumstance",
    "analysis_branches": [
      {
        "branch_number": 1,
        "immediate_cause": {
          "code": "B2.1",
          "standard_title_tr": "Ekipman/tesis arÄ±zasÄ±",
          "category_type": "KOÅULLAR",
          "cause_tr": "KompresÃ¶r rulmanÄ±nÄ±n aÅŸÄ±rÄ± Ä±sÄ±nma sonucu seizure (sÄ±kÄ±ÅŸma) yapmasÄ±",
          "evidence_tr": "Raporda 'KompresÃ¶r rulmanÄ± aÅŸÄ±rÄ± Ä±sÄ±nma sonucu seizure yapmasÄ±' ifadesi doÄŸrudan ekipman arÄ±zasÄ±nÄ± gÃ¶stermektedir."
        },
        "why_chain": [
          {
            "level": 1,
            "question_tr": "Neden kompresÃ¶r rulmanÄ± aÅŸÄ±rÄ± Ä±sÄ±ndÄ±?",
            "answer_tr": "Rulman yaÄŸlama sistemi yetersiz Ã§alÄ±ÅŸÄ±yordu ve yaÄŸ seviyesi dÃ¼ÅŸÃ¼ktÃ¼"
          },
          {
            "level": 2,
            "question_tr": "Neden yaÄŸlama sistemi yetersiz Ã§alÄ±ÅŸÄ±yordu?",
            "answer_tr": "Periyodik yaÄŸ seviyesi kontrolÃ¼ ve yaÄŸlama bakÄ±mÄ± yapÄ±lmamÄ±ÅŸtÄ±"
          },
          {
            "level": 3,
            "question_tr": "Neden periyodik bakÄ±m yapÄ±lmamÄ±ÅŸtÄ±?",
            "answer_tr": "KompresÃ¶r iÃ§in planlÄ± bakÄ±m programÄ± oluÅŸturulmamÄ±ÅŸ ve takip edilmiyordu"
          },
          {
            "level": 4,
            "question_tr": "Neden planlÄ± bakÄ±m programÄ± oluÅŸturulmamÄ±ÅŸtÄ±?",
            "answer_tr": "Kritik ekipmanlar iÃ§in bakÄ±m stratejisi belirlenmemiÅŸ ve Ã¶nleyici bakÄ±m planlamasÄ± yapÄ±lmamÄ±ÅŸtÄ±"
          }
        ],
        "root_cause": {
          "code": "D6.1",
          "standard_title_tr": "Yetersiz bakÄ±m stratejisi veya planlamasÄ±",
          "category_type": "ORGANÄ°ZASYONEL",
          "cause_tr": "KompresÃ¶r iÃ§in bakÄ±m stratejisi ve planlÄ± Ã¶nleyici bakÄ±m programÄ±nÄ±n bulunmamasÄ±",
          "explanation_tr": "Kritik ekipman olan kompresÃ¶r iÃ§in bakÄ±m stratejisi belirlenmemiÅŸ, periyodik yaÄŸlama ve rulman kontrollerini iÃ§eren Ã¶nleyici bakÄ±m planÄ± oluÅŸturulmamÄ±ÅŸ ve uygulanmamÄ±ÅŸtÄ±r"
        }
      },
      {
        "branch_number": 2,
        "immediate_cause": {
          "code": "B3.8",
          "standard_title_tr": "AÅŸÄ±rÄ± sÄ±caklÄ±k (sÄ±cak/soÄŸuk)",
          "category_type": "KOÅULLAR",
          "cause_tr": "Rulman bÃ¶lgesinde aÅŸÄ±rÄ± Ä±sÄ±nma meydana gelmesi",
          "evidence_tr": "Raporda 'aÅŸÄ±rÄ± Ä±sÄ±nma sonucu' ifadesi rulman bÃ¶lgesinde kritik sÄ±caklÄ±k artÄ±ÅŸÄ± olduÄŸunu gÃ¶stermektedir."
        },
        "why_chain": [
          {
            "level": 1,
            "question_tr": "Neden rulman bÃ¶lgesinde aÅŸÄ±rÄ± Ä±sÄ±nma meydana geldi?",
            "answer_tr": "Rulman yaÄŸlama sistemi yetersiz Ã§alÄ±ÅŸtÄ± ve sÃ¼rtÃ¼nme arttÄ±"
          },
          {
            "level": 2,
            "question_tr": "Neden yaÄŸlama sistemi yetersiz Ã§alÄ±ÅŸtÄ±?",
            "answer_tr": "Otomatik yaÄŸlama pompasÄ± arÄ±zalÄ±ydÄ± ve manuel yaÄŸlama yapÄ±lmadÄ±"
          },
          {
            "level": 3,
            "question_tr": "Neden pompa arÄ±zasÄ± tespit edilmedi ve manuel yaÄŸlama yapÄ±lmadÄ±?",
            "answer_tr": "KompresÃ¶r iÃ§in periyodik kontrol ve bakÄ±m planÄ± uygulanmÄ±yordu"
          },
          {
            "level": 4,
            "question_tr": "Neden periyodik bakÄ±m planÄ± uygulanmÄ±yordu?",
            "answer_tr": "KompresÃ¶r iÃ§in Ã¶ngÃ¶rÃ¼cÃ¼ ve Ã¶nleyici bakÄ±m stratejisi oluÅŸturulmamÄ±ÅŸtÄ±"
          }
        ],
        "root_cause": {
          "code": "D6.1",
          "standard_title_tr": "Yetersiz bakÄ±m stratejisi veya planlamasÄ±",
          "category_type": "ORGANÄ°ZASYONEL",
          "cause_tr": "KompresÃ¶r iÃ§in Ã¶ngÃ¶rÃ¼cÃ¼ ve Ã¶nleyici bakÄ±m stratejisinin bulunmamasÄ±",
          "explanation_tr": "Kritik ekipman olan kompresÃ¶r iÃ§in sistematik bakÄ±m stratejisi oluÅŸturulmamÄ±ÅŸ, periyodik kontrol ve yaÄŸlama planlarÄ± yapÄ±lmamÄ±ÅŸ, bu nedenle rulman arÄ±zasÄ± Ã¶nceden tespit edilememiÅŸ ve Ã¶nlenememiÅŸtir"
        }
      },
      {
        "branch_number": 3,
        "immediate_cause": {
          "code": "B2.2",
          "standard_title_tr": "Yetersiz ekipman/tesis hazÄ±rlÄ±ÄŸÄ±",
          "category_type": "KOÅULLAR",
          "cause_tr": "KompresÃ¶r rulmanÄ±nÄ±n bakÄ±m ve izleme sistemlerinin yetersiz olmasÄ±",
          "evidence_tr": "AÅŸÄ±rÄ± Ä±sÄ±nmanÄ±n seizure'a kadar ilerlemesi, Ã¶nceden tespit ve mÃ¼dahale sistemlerinin yetersizliÄŸine iÅŸaret etmektedir."
        },
        "why_chain": [
          {
            "level": 1,
            "question_tr": "Neden kompresÃ¶r rulmanÄ±nÄ±n bakÄ±m ve izleme sistemleri yetersizdi?",
            "answer_tr": "Rulman sÄ±caklÄ±k izleme sistemi kurulmamÄ±ÅŸtÄ± ve periyodik titreÅŸim Ã¶lÃ§Ã¼mleri yapÄ±lmÄ±yordu"
          },
          {
            "level": 2,
            "question_tr": "Neden sÄ±caklÄ±k izleme sistemi kurulmamÄ±ÅŸ ve titreÅŸim Ã¶lÃ§Ã¼mleri yapÄ±lmÄ±yordu?",
            "answer_tr": "KompresÃ¶r iÃ§in Ã¶ngÃ¶rÃ¼cÃ¼ bakÄ±m (predictive maintenance) programÄ± oluÅŸturulmamÄ±ÅŸtÄ±"
          },
          {
            "level": 3,
            "question_tr": "Neden Ã¶ngÃ¶rÃ¼cÃ¼ bakÄ±m programÄ± oluÅŸturulmamÄ±ÅŸtÄ±?",
            "answer_tr": "Kritik ekipmanlar iÃ§in bakÄ±m stratejisi belirlenmemiÅŸti ve sadece arÄ±za sonrasÄ± mÃ¼dahale yapÄ±lÄ±yordu"
          },
          {
            "level": 4,
            "question_tr": "Neden kritik ekipmanlar iÃ§in bakÄ±m stratejisi belirlenmemiÅŸti?",
            "answer_tr": "Ekipman kritiklik analizi yapÄ±lmamÄ±ÅŸ, bakÄ±m tipleri (Ã¶nleyici/Ã¶ngÃ¶rÃ¼cÃ¼/dÃ¼zeltici) planlanmamÄ±ÅŸtÄ±"
          },
          {
            "level": 5,
            "question_tr": "Neden ekipman kritiklik analizi ve bakÄ±m planlamasÄ± yapÄ±lmamÄ±ÅŸtÄ±?",
            "answer_tr": "Sistematik bakÄ±m stratejisi ve planlamasÄ± mevcut deÄŸildi, reaktif yaklaÅŸÄ±m hÃ¢kimdi"
          }
        ],
        "root_cause": {
          "code": "D6.1",
          "standard_title_tr": "Yetersiz bakÄ±m stratejisi veya planlamasÄ±",
          "category_type": "ORGANÄ°ZASYONEL",
          "cause_tr": "KompresÃ¶r iÃ§in sistematik bakÄ±m stratejisi ve planlamasÄ± bulunmamasÄ±",
          "explanation_tr": "Kritik ekipmanlar iÃ§in bakÄ±m stratejisi belirlenmemiÅŸ, Ã¶ngÃ¶rÃ¼cÃ¼ ve Ã¶nleyici bakÄ±m programlarÄ± oluÅŸturulmamÄ±ÅŸ, sadece arÄ±za sonrasÄ± reaktif mÃ¼dahale yapÄ±lmaktadÄ±r"
        }
      }
    ],
    "final_root_causes": [
      {
        "code": "D6.1",
        "standard_title_tr": "Yetersiz bakÄ±m stratejisi veya planlamasÄ±",
        "category_type": "ORGANÄ°ZASYONEL",
        "cause_tr": "KompresÃ¶r iÃ§in bakÄ±m stratejisi ve planlÄ± Ã¶nleyici bakÄ±m programÄ±nÄ±n bulunmamasÄ±",
        "explanation_tr": "Kritik ekipman olan kompresÃ¶r iÃ§in bakÄ±m stratejisi belirlenmemiÅŸ, periyodik yaÄŸlama ve rulman kontrollerini iÃ§eren Ã¶nleyici bakÄ±m planÄ± oluÅŸturulmamÄ±ÅŸ ve uygulanmamÄ±ÅŸtÄ±r"
      },
      {
        "code": "D6.1",
        "standard_title_tr": "Yetersiz bakÄ±m stratejisi veya planlamasÄ±",
        "category_type": "ORGANÄ°ZASYONEL",
        "cause_tr": "KompresÃ¶r iÃ§in Ã¶ngÃ¶rÃ¼cÃ¼ ve Ã¶nleyici bakÄ±m stratejisinin bulunmamasÄ±",
        "explanation_tr": "Kritik ekipman olan kompresÃ¶r iÃ§in sistematik bakÄ±m stratejisi oluÅŸturulmamÄ±ÅŸ, periyodik kontrol ve yaÄŸlama planlarÄ± yapÄ±lmamÄ±ÅŸ, bu nedenle rulman arÄ±zasÄ± Ã¶nceden tespit edilememiÅŸ ve Ã¶nlenememiÅŸtir"
      },
      {
        "code": "D6.1",
        "standard_title_tr": "Yetersiz bakÄ±m stratejisi veya planlamasÄ±",
        "category_type": "ORGANÄ°ZASYONEL",
        "cause_tr": "KompresÃ¶r iÃ§in sistematik bakÄ±m stratejisi ve planlamasÄ± bulunmamasÄ±",
        "explanation_tr": "Kritik ekipmanlar iÃ§in bakÄ±m stratejisi belirlenmemiÅŸ, Ã¶ngÃ¶rÃ¼cÃ¼ ve Ã¶nleyici bakÄ±m programlarÄ± oluÅŸturulmamÄ±ÅŸ, sadece arÄ±za sonrasÄ± reaktif mÃ¼dahale yapÄ±lmaktadÄ±r"
      }
    ],
    "analysis_method": "HSG245 Hierarchical 5-Why (A/B â†’ C/D)",
    "final_report_tr": "================================================================================\nKÃ–K NEDEN ANALÄ°ZÄ° RAPORU (HSG245 - 5 Why Metodolojisi)\n================================================================================\n\nOLAY: KompresÃ¶r rulmanÄ± aÅŸÄ±rÄ± Ä±sÄ±nma sonucu seizure yapmasÄ± nedeniyle 4 saatlik Ã¼retim durmasÄ±. Konum: Fabrika Ã¼retim hattÄ±. Olay Tipi: Undesired circumstance\n\n--------------------------------------------------------------------------------\n\nâš¡ DAL 1: KOÅULLAR\n\nğŸ“Œ DoÄŸrudan Neden [B2.1] Ekipman/tesis arÄ±zasÄ±:\n   KompresÃ¶r rulmanÄ±nÄ±n aÅŸÄ±rÄ± Ä±sÄ±nma sonucu seizure (sÄ±kÄ±ÅŸma) yapmasÄ±\n   KanÄ±t: Raporda 'KompresÃ¶r rulmanÄ± aÅŸÄ±rÄ± Ä±sÄ±nma sonucu seizure yapmasÄ±' ifadesi doÄŸrudan ekipman arÄ±zasÄ±nÄ± gÃ¶stermektedir.\n\nâ“ Neden 1? Neden kompresÃ¶r rulmanÄ± aÅŸÄ±rÄ± Ä±sÄ±ndÄ±?\n   â†’ Rulman yaÄŸlama sistemi yetersiz Ã§alÄ±ÅŸÄ±yordu ve yaÄŸ seviyesi dÃ¼ÅŸÃ¼ktÃ¼\nâ“ Neden 2? Neden yaÄŸlama sistemi yetersiz Ã§alÄ±ÅŸÄ±yordu?\n   â†’ Periyodik yaÄŸ seviyesi kontrolÃ¼ ve yaÄŸlama bakÄ±mÄ± yapÄ±lmamÄ±ÅŸtÄ±\nâ“ Neden 3? Neden periyodik bakÄ±m yapÄ±lmamÄ±ÅŸtÄ±?\n   â†’ KompresÃ¶r iÃ§in planlÄ± bakÄ±m programÄ± oluÅŸturulmamÄ±ÅŸ ve takip edilmiyordu\nâ“ Neden 4? Neden planlÄ± bakÄ±m programÄ± oluÅŸturulmamÄ±ÅŸtÄ±?\n   â†’ Kritik ekipmanlar iÃ§in bakÄ±m stratejisi belirlenmemiÅŸ ve Ã¶nleyici bakÄ±m planlamasÄ± yapÄ±lmamÄ±ÅŸtÄ±\n\nğŸ¯ KÃ–K NEDEN [D6.1] Yetersiz bakÄ±m stratejisi veya planlamasÄ± - ORGANÄ°ZASYONEL:\n   KompresÃ¶r iÃ§in bakÄ±m stratejisi ve planlÄ± Ã¶nleyici bakÄ±m programÄ±nÄ±n bulunmamasÄ±\n   Kritik ekipman olan kompresÃ¶r iÃ§in bakÄ±m stratejisi belirlenmemiÅŸ, periyodik yaÄŸlama ve rulman kontrollerini iÃ§eren Ã¶nleyici bakÄ±m planÄ± oluÅŸturulmamÄ±ÅŸ ve uygulanmamÄ±ÅŸtÄ±r\n\n--------------------------------------------------------------------------------\n\nâš¡ DAL 2: KOÅULLAR\n\nğŸ“Œ DoÄŸrudan Neden [B3.8] AÅŸÄ±rÄ± sÄ±caklÄ±k (sÄ±cak/soÄŸuk):\n   Rulman bÃ¶lgesinde aÅŸÄ±rÄ± Ä±sÄ±nma meydana gelmesi\n   KanÄ±t: Raporda 'aÅŸÄ±rÄ± Ä±sÄ±nma sonucu' ifadesi rulman bÃ¶lgesinde kritik sÄ±caklÄ±k artÄ±ÅŸÄ± olduÄŸunu gÃ¶stermektedir.\n\nâ“ Neden 1? Neden rulman bÃ¶lgesinde aÅŸÄ±rÄ± Ä±sÄ±nma meydana geldi?\n   â†’ Rulman yaÄŸlama sistemi yetersiz Ã§alÄ±ÅŸtÄ± ve sÃ¼rtÃ¼nme arttÄ±\nâ“ Neden 2? Neden yaÄŸlama sistemi yetersiz Ã§alÄ±ÅŸtÄ±?\n   â†’ Otomatik yaÄŸlama pompasÄ± arÄ±zalÄ±ydÄ± ve manuel yaÄŸlama yapÄ±lmadÄ±\nâ“ Neden 3? Neden pompa arÄ±zasÄ± tespit edilmedi ve manuel yaÄŸlama yapÄ±lmadÄ±?\n   â†’ KompresÃ¶r iÃ§in periyodik kontrol ve bakÄ±m planÄ± uygulanmÄ±yordu\nâ“ Neden 4? Neden periyodik bakÄ±m planÄ± uygulanmÄ±yordu?\n   â†’ KompresÃ¶r iÃ§in Ã¶ngÃ¶rÃ¼cÃ¼ ve Ã¶nleyici bakÄ±m stratejisi oluÅŸturulmamÄ±ÅŸtÄ±\n\nğŸ¯ KÃ–K NEDEN [D6.1] Yetersiz bakÄ±m stratejisi veya planlamasÄ± - ORGANÄ°ZASYONEL:\n   KompresÃ¶r iÃ§in Ã¶ngÃ¶rÃ¼cÃ¼ ve Ã¶nleyici bakÄ±m stratejisinin bulunmamasÄ±\n   Kritik ekipman olan kompresÃ¶r iÃ§in sistematik bakÄ±m stratejisi oluÅŸturulmamÄ±ÅŸ, periyodik kontrol ve yaÄŸlama planlarÄ± yapÄ±lmamÄ±ÅŸ, bu nedenle rulman arÄ±zasÄ± Ã¶nceden tespit edilememiÅŸ ve Ã¶nlenememiÅŸtir\n\n--------------------------------------------------------------------------------\n\nâš¡ DAL 3: KOÅULLAR\n\nğŸ“Œ DoÄŸrudan Neden [B2.2] Yetersiz ekipman/tesis hazÄ±rlÄ±ÄŸÄ±:\n   KompresÃ¶r rulmanÄ±nÄ±n bakÄ±m ve izleme sistemlerinin yetersiz olmasÄ±\n   KanÄ±t: AÅŸÄ±rÄ± Ä±sÄ±nmanÄ±n seizure'a kadar ilerlemesi, Ã¶nceden tespit ve mÃ¼dahale sistemlerinin yetersizliÄŸine iÅŸaret etmektedir.\n\nâ“ Neden 1? Neden kompresÃ¶r rulmanÄ±nÄ±n bakÄ±m ve izleme sistemleri yetersizdi?\n   â†’ Rulman sÄ±caklÄ±k izleme sistemi kurulmamÄ±ÅŸtÄ± ve periyodik titreÅŸim Ã¶lÃ§Ã¼mleri yapÄ±lmÄ±yordu\nâ“ Neden 2? Neden sÄ±caklÄ±k izleme sistemi kurulmamÄ±ÅŸ ve titreÅŸim Ã¶lÃ§Ã¼mleri yapÄ±lmÄ±yordu?\n   â†’ KompresÃ¶r iÃ§in Ã¶ngÃ¶rÃ¼cÃ¼ bakÄ±m (predictive maintenance) programÄ± oluÅŸturulmamÄ±ÅŸtÄ±\nâ“ Neden 3? Neden Ã¶ngÃ¶rÃ¼cÃ¼ bakÄ±m programÄ± oluÅŸturulmamÄ±ÅŸtÄ±?\n   â†’ Kritik ekipmanlar iÃ§in bakÄ±m stratejisi belirlenmemiÅŸti ve sadece arÄ±za sonrasÄ± mÃ¼dahale yapÄ±lÄ±yordu\nâ“ Neden 4? Neden kritik ekipmanlar iÃ§in bakÄ±m stratejisi belirlenmemiÅŸti?\n   â†’ Ekipman kritiklik analizi yapÄ±lmamÄ±ÅŸ, bakÄ±m tipleri (Ã¶nleyici/Ã¶ngÃ¶rÃ¼cÃ¼/dÃ¼zeltici) planlanmamÄ±ÅŸtÄ±\nâ“ Neden 5? Neden ekipman kritiklik analizi ve bakÄ±m planlamasÄ± yapÄ±lmamÄ±ÅŸtÄ±?\n   â†’ Sistematik bakÄ±m stratejisi ve planlamasÄ± mevcut deÄŸildi, reaktif yaklaÅŸÄ±m hÃ¢kimdi\n\nğŸ¯ KÃ–K NEDEN [D6.1] Yetersiz bakÄ±m stratejisi veya planlamasÄ± - ORGANÄ°ZASYONEL:\n   KompresÃ¶r iÃ§in sistematik bakÄ±m stratejisi ve planlamasÄ± bulunmamasÄ±\n   Kritik ekipmanlar iÃ§in bakÄ±m stratejisi belirlenmemiÅŸ, Ã¶ngÃ¶rÃ¼cÃ¼ ve Ã¶nleyici bakÄ±m programlarÄ± oluÅŸturulmamÄ±ÅŸ, sadece arÄ±za sonrasÄ± reaktif mÃ¼dahale yapÄ±lmaktadÄ±r\n\n--------------------------------------------------------------------------------"
  },
  "status": "investigation_complete"
}